Sheet: log
A1: date | B1: movement | C1: instruction | D1: scheduled_in | E1: summary | F1: actual_in | G1: debrief | H1: mvmt_next_steps | I1: prog_next_steps | J1: out_1 | K1: out_2 | L1: out_3 | M1: out_4 | N1: out_5 | O1: out_6 | P1: out_7 | Q1: out_8 | R1: out_9 | S1: out_10 | T1: out_11 | U1: out_12 | V1: out_13 | W1: out_14 | X1: out_15 | Y1: prebrief | Z1: new_target | AA1: force_n_fails | AB1: roll_notes_forward | AC1: repeat_next_time | AD1: program_descr | AE1: get date info | AF1: date | AG1: work_slot_posn | AH1: slot | AI1: next_slot | AJ1: end_of_workout | AK1: tracker_id | AL1: get tracker info | AM1: movement_id | AN1: first_stage_id | AO1: get movement info | AP1: movement | AQ1: max_wup_jump | AR1: min_wup | AS1: min_increment | AT1: min_wup_increment | AU1: bar_adds | AV1: loading_points | AW1: get slot history info | AX1: slot_last_row | AY1: last_tracker | AZ1: tracker_continues | BA1: current_stage | BB1: n_fails | BC1: last_target | BD1: target | BE1: last_in_result | BF1: roll_last_notes | BG1: last_prog_next_steps | BH1: prog_notes | BI1: get movement history info | BJ1: mvmt_last_row | BK1: last_mvmt | BL1: mvmt_continues | BM1: last_mvmt_next_steps | BN1: mvmt_notes | BO1: last_epley_pr | BP1: get stage info | BQ1: progression_descr | BR1: success_to_stage | BS1: fail_to_stage | BT1: instruction | BU1: rest | BV1: skip_wup | BW1: roll_notes_forward | BX1: more_is_better | BY1: calc_e1rm | BZ1: max_attempt | CA1: result_out_start | CB1: result_out_end | CC1: success | CD1: smash | CE1: small_lp_x_incrm | CF1: big_lp_x_incrm | CG1: add_x_incrm_at_start | CH1: propn_at_start | CI1: deload_after_n_fail | CJ1: deload_by_factor | CK1: propn_of_target | CL1: calc current | CM1: propl_target | CN1: rounded_propl_target | CO1: propl_last | CP1: rounded_propl_last | CQ1: scheduled_in | CR1: actual_in_per_load_pt | CS1: wup_climb_per_pt | CT1: out_epley_pr_goal | CU1: calc warmup | CV1: wup_weight_diff | CW1: wup_jumps_from_min | CX1: wup_min_reps | CY1: wup_climb_sets | CZ1: wup_base_jump | DA1: wup_boost_jump | DB1: boost_thru_set | DC1: wup_base_sets | DD1: wup_3 | DE1: wup_2 | DF1: wup_1 | DG1: wup_5s_base | DH1: wup_3_base | DI1: wup_2_base | DJ1: wup_1_base | DK1: wup_5s_boost | DL1: wup_3_boost | DM1: wup_2_boost | DN1: wup_1_boost | DO1: wup_minsets_text | DP1: wup_5s_boost_text | DQ1: wup_3_boost_text | DR1: wup_2_boost_text | DS1: wup_1_boost_text | DT1: wup_5s_base_text | DU1: wup_3_base_text | DV1: wup_2_base_text | DW1: wup_1_base_text | DX1: analyze data | DY1: outs_recorded | DZ1: result_out_start_cleaned | EA1: result_out_end_cleaned | EB1: out_sum | EC1: succeeded | ED1: smashed | EE1: out_max | EF1: out_epley | EG1: calc consequences | EH1: cleaned_repeat_next_time | EI1: cleaned_success_to_stage | EJ1: cleaned_fail_to_stage | EK1: cleaned_deload_by_factor | EL1: smash_in_result | EM1: success_in_result | EN1: deload_in_result | EO1: n_fails_result | EP1: deload_result | EQ1: in_result | ER1: stage_result | ES1: epley_pr_result | ET1: track slot histories | EU1: 101_last_row | EV1: 102_last_row | EW1: 103_last_row | EX1: 104_last_row | EY1: 105_last_row | EZ1: 106_last_row | FA1: 107_last_row | FB1: 108_last_row | FC1: 109_last_row | FD1: 110_last_row | FE1: 111_last_row | FF1: 112_last_row | FG1: 113_last_row | FH1: 114_last_row | FI1: 115_last_row | FJ1: 116_last_row | FK1: 117_last_row | FL1: 118_last_row | FM1: 119_last_row | FN1: 120_last_row | FO1: 121_last_row | FP1: 122_last_row | FQ1: 123_last_row | FR1: 124_last_row | FS1: 125_last_row | FT1: 126_last_row | FU1: 127_last_row | FV1: 128_last_row | FW1: 129_last_row | FX1: 130_last_row | FY1: track mvmt histories | FZ1: 101_mvmt_last_row | GA1: 102_mvmt_last_row | GB1: 103_mvmt_last_row | GC1: 104_mvmt_last_row | GD1: 105_mvmt_last_row | GE1: 106_mvmt_last_row | GF1: 107_mvmt_last_row | GG1: 108_mvmt_last_row | GH1: 109_mvmt_last_row | GI1: 110_mvmt_last_row | GJ1: 111_mvmt_last_row | GK1: 112_mvmt_last_row | GL1: 113_mvmt_last_row | GM1: 114_mvmt_last_row | GN1: 115_mvmt_last_row | GO1: 116_mvmt_last_row | GP1: 117_mvmt_last_row | GQ1: 118_mvmt_last_row | GR1: 119_mvmt_last_row | GS1: 120_mvmt_last_row | GT1: 121_mvmt_last_row | GU1: 122_mvmt_last_row | GV1: 123_mvmt_last_row | GW1: 124_mvmt_last_row | GX1: 125_mvmt_last_row | GY1: 126_mvmt_last_row | GZ1: 127_mvmt_last_row | HA1: 128_mvmt_last_row | HB1: 129_mvmt_last_row | HC1: 130_mvmt_last_row
A2: 2020-06-26 | B2: of:=IFNA([.AP2];"") -> back squat (non-microloadable), WAS bar | C2: of:=IFNA([.BT2];"") -> 3x5 | D2: of:=IFNA([.CQ2];"") -> 0 | E2: of:=CHAR(10)&CHAR(10)&"----"&CHAR(10)&"# "&TEXT([.A2];"yyyy-mm-dd")&CHAR(10)&"# "&[.B2]&CHAR(10)&"# "&[.C2]&CHAR(10)&IF(AND([.F2]>0;[.BY2]);"# "&"reps for PR: "&[.CT2]&CHAR(10);"")&"# "&"rest: "&IF([.BU2]>0;[.BU2];"")&CHAR(10)&"# "&"wup climbs per loading point: "&[.CS2]&CHAR(10)&"# "&"work per loading point: "&[.CR2]&IF([.Z2]>0;CHAR(10)&"# "&"New target: "&[.Z2];"")&CHAR(10)&CHAR(10)&"## debrief:"&CHAR(10)&IF([.Y2]=0;"";CHAR(10)&"## "&"prebrief:"&CHAR(10)&TRIM([.Y2]))&CHAR(10)&"## "&"movement notes:"&CHAR(10)&IF([.BN2]=0;"";CHAR(10)&TRIM([.BN2]))&CHAR(10)&"## "&"progression notes:"&CHAR(10)&IF([.BH2]=0;"";CHAR(10)&TRIM([.BH2]))&CHAR(10)&"## "&"results:" -> 

----
# 2020-06-26
# back squat (non-microloadable), WAS bar
# 3x5
# rest: 1.5/3/5m
# wup climbs per loading point: 
# work per loading point: 0

## debrief:

## movement notes:

## progression notes:

## results: | AD2: Demo data | AF2: of:=IF(ROW()=2;[.A2];IF([.AJ1];INDEX([$dates.A$1:$dates.A$1048576];MATCH([.AF1];[$dates.A$1:$dates.A$1048576];0)+1;1;1);[.AF1])) -> 2020-06-26 | AG2: of:=IF(OR([.AJ1]; ROW([.AJ1])=1);1;[.AG1]+1) -> 1 | AH2: of:=INDEX([$dates.D$1:$dates.W$1048576];MATCH([.AF2];[$dates.A$1:$dates.A$1048576]);MATCH("work_slot_"&[.AG2];[$dates.D$1:$dates.W$1];0);1) -> 101 | AI2: of:=IFNA(INDEX([$dates.D$1:$dates.W$1048576];MATCH([.AF2];[$dates.A$1:$dates.A$1048576]);MATCH("work_slot_"&[.AG2]+1;[$dates.D$1:$dates.W$1];0);1);0) -> 0 | AJ2: of:=[.AI2]=0 -> true | AK2: of:=INDEX([$dates.A$1:$dates.CU$1048576];MATCH([.AF2];[$dates.A$1:$dates.A$1048576];0);MATCH("slot_"&[.AH2]&"_tracker_id";[$dates.$A$1:$dates.$AMJ$1];0);1) -> 1001 | AM2: of:=INDEX([$trackers.C$1:$trackers.C$1048576];MATCH([.AK2];[$trackers.A$1:$trackers.A$1048576];0);1;1) -> 1001 | AN2: of:=INDEX([$trackers.E$1:$trackers.E$1048576];MATCH([.AK2];[$trackers.A$1:$trackers.A$1048576];0);1;1) -> 1001 | AP2: of:=INDEX([$movements.B$1:$movements.B$1048576];MATCH([.$AM2];[$movements.$A$1:$movements.$A$1048576];0);1;1) -> back squat (non-microloadable), WAS bar | AQ2: of:=INDEX([$movements.C$1:$movements.C$1048576];MATCH([.$AM2];[$movements.$A$1:$movements.$A$1048576];0);1;1) -> 45 | AR2: of:=INDEX([$movements.D$1:$movements.D$1048576];MATCH([.$AM2];[$movements.$A$1:$movements.$A$1048576];0);1;1) -> 41.5 | AS2: of:=INDEX([$movements.E$1:$movements.E$1048576];MATCH([.$AM2];[$movements.$A$1:$movements.$A$1048576];0);1;1) -> 5 | AT2: of:=INDEX([$movements.F$1:$movements.F$1048576];MATCH([.$AM2];[$movements.$A$1:$movements.$A$1048576];0);1;1) -> 5 | AU2: of:=INDEX([$movements.G$1:$movements.G$1048576];MATCH([.$AM2];[$movements.$A$1:$movements.$A$1048576];0);1;1) -> 41.5 | AV2: of:=INDEX([$movements.H$1:$movements.H$1048576];MATCH([.$AM2];[$movements.$A$1:$movements.$A$1048576];0);1;1) -> 2 | AX2: of:=INDEX([.$A2:.$AMJ2];1;MATCH([.AH2]&"_last_row";[.$A$1:.$AMJ$1];0);1) -> 101_last_row | AY2: of:=IF(ISNUMBER([.AX2]);INDEX([.AK$1:.AK$1048576];[.$AX2];1;1);0) -> 0 | AZ2: of:=[.AY2]=[.AK2] -> false | BA2: of:=IF([.$AZ2];INDEX([.ER$1:.ER$1048576];[.$AX2];1;1);[.AN2]) -> 1001 | BB2: of:=IF([.AA2]<>"";[.AA2];IF([.$AZ2];INDEX([.EO$1:.EO$1048576];[.$AX2];1;1);0)) -> 0 | BC2: of:=IF([.$AZ2];INDEX([.$BD$1:.$BD$1048576];[.$AX2];1;1);0) -> 0 | BD2: of:=IF([.Z2]>0;[.Z2];[.BC2]) -> 0 | BE2: of:=IF([.$AZ2];INDEX([.EQ$1:.EQ$1048576];[.$AX2];1;1);0) -> 0 | BF2: of:=IF([.$AZ2];OR(INDEX([.AB$1:.AB$1048576];[.$AX2];1;1);INDEX([.BW$1:.BW$1048576];[.$AX2];1;1));0) -> false | BG2: of:=IF([.$AZ2];IF(AND([.$BF2];INDEX([.I$1:.I$1048576];[.$AX2];1;1)="");INDEX([.BG$1:.BG$1048576];[.$AX2];1;1);INDEX([.I$1:.I$1048576];[.$AX2];1;1));0) -> 0 | BH2: of:=IF([.BW2];0;[.BG2]) -> 0 | BJ2: of:=INDEX([.$A2:.$AMJ2];1;MATCH([.AH2]&"_mvmt_last_row";[.$A$1:.$AMJ$1];0);1) -> 101_mvmt_last_row | BK2: of:=IF(ISNUMBER([.BJ2]);INDEX([.AM$1:.AM$1048576];[.$BJ2];1;1);0) -> 0 | BL2: of:=[.BK2]=[.AM2] -> false | BM2: of:=IF([.$BL2];IF(AND([.$BF2];INDEX([.H$1:.H$1048576];[.$BJ2];1;1)="");INDEX([.BM$1:.BM$1048576];[.$BJ2];1;1);INDEX([.H$1:.H$1048576];[.$BJ2];1;1));0) -> 0 | BN2: of:=IF([.BW2];0;[.BM2]) -> 0 | BO2: of:=IF([.$BL2];INDEX([.ES$1:.ES$1048576];[.$BJ2];1;1);0) -> 0 | BQ2: of:=INDEX([$progression_stages.C$1:$progression_stages.C$1048576];MATCH([.$BA2];[$progression_stages.$A$1:$progression_stages.$A$1048576];0);1;1) -> SL 3x5 non-DL | BR2: of:=INDEX([$progression_stages.D$1:$progression_stages.D$1048576];MATCH([.$BA2];[$progression_stages.$A$1:$progression_stages.$A$1048576];0);1;1) -> 0 | BS2: of:=INDEX([$progression_stages.E$1:$progression_stages.E$1048576];MATCH([.$BA2];[$progression_stages.$A$1:$progression_stages.$A$1048576];0);1;1) -> 0 | BT2: of:=INDEX([$progression_stages.F$1:$progression_stages.F$1048576];MATCH([.$BA2];[$progression_stages.$A$1:$progression_stages.$A$1048576];0);1;1) -> 3x5 | BU2: of:=INDEX([$progression_stages.G$1:$progression_stages.G$1048576];MATCH([.$BA2];[$progression_stages.$A$1:$progression_stages.$A$1048576];0);1;1) -> 1.5/3/5m | BV2: of:=INDEX([$progression_stages.H$1:$progression_stages.H$1048576];MATCH([.$BA2];[$progression_stages.$A$1:$progression_stages.$A$1048576];0);1;1) -> 0 | BW2: of:=INDEX([$progression_stages.I$1:$progression_stages.I$1048576];MATCH([.$BA2];[$progression_stages.$A$1:$progression_stages.$A$1048576];0);1;1) -> 0 | BX2: of:=INDEX([$progression_stages.J$1:$progression_stages.J$1048576];MATCH([.$BA2];[$progression_stages.$A$1:$progression_stages.$A$1048576];0);1;1) -> true | BY2: of:=INDEX([$progression_stages.K$1:$progression_stages.K$1048576];MATCH([.$BA2];[$progression_stages.$A$1:$progression_stages.$A$1048576];0);1;1) -> true | BZ2: of:=INDEX([$progression_stages.L$1:$progression_stages.L$1048576];MATCH([.$BA2];[$progression_stages.$A$1:$progression_stages.$A$1048576];0);1;1) -> false | CA2: of:=INDEX([$progression_stages.M$1:$progression_stages.M$1048576];MATCH([.$BA2];[$progression_stages.$A$1:$progression_stages.$A$1048576];0);1;1) -> 0 | CB2: of:=INDEX([$progression_stages.N$1:$progression_stages.N$1048576];MATCH([.$BA2];[$progression_stages.$A$1:$progression_stages.$A$1048576];0);1;1) -> 0 | CC2: of:=INDEX([$progression_stages.O$1:$progression_stages.O$1048576];MATCH([.$BA2];[$progression_stages.$A$1:$progression_stages.$A$1048576];0);1;1) -> 15 | CD2: of:=INDEX([$progression_stages.P$1:$progression_stages.P$1048576];MATCH([.$BA2];[$progression_stages.$A$1:$progression_stages.$A$1048576];0);1;1) -> 0 | CE2: of:=INDEX([$progression_stages.Q$1:$progression_stages.Q$1048576];MATCH([.$BA2];[$progression_stages.$A$1:$progression_stages.$A$1048576];0);1;1) -> 1 | CF2: of:=INDEX([$progression_stages.R$1:$progression_stages.R$1048576];MATCH([.$BA2];[$progression_stages.$A$1:$progression_stages.$A$1048576];0);1;1) -> 0 | CG2: of:=INDEX([$progression_stages.S$1:$progression_stages.S$1048576];MATCH([.$BA2];[$progression_stages.$A$1:$progression_stages.$A$1048576];0);1;1) -> 0 | CH2: of:=INDEX([$progression_stages.T$1:$progression_stages.T$1048576];MATCH([.$BA2];[$progression_stages.$A$1:$progression_stages.$A$1048576];0);1;1) -> 0 | CI2: of:=INDEX([$progression_stages.U$1:$progression_stages.U$1048576];MATCH([.$BA2];[$progression_stages.$A$1:$progression_stages.$A$1048576];0);1;1) -> 3 | CJ2: of:=INDEX([$progression_stages.V$1:$progression_stages.V$1048576];MATCH([.$BA2];[$progression_stages.$A$1:$progression_stages.$A$1048576];0);1;1) -> 0.9 | CK2: of:=INDEX([$progression_stages.W$1:$progression_stages.W$1048576];MATCH([.$BA2];[$progression_stages.$A$1:$progression_stages.$A$1048576];0);1;1) -> 0 | CM2: of:=[.CK2]*[.BD2] -> 0 | CN2: of:=IF(AND([.CM2]>0;[.AS2]>0);[.AU2]+MROUND([.CM2]-[.AU2];[.AS2]);[.CM2]) -> 0 | CO2: of:=IF([.CH2]=0;[.BE2];[.CH2]*[.BE2]) -> 0 | CP2: of:=IF(AND([.CO2]>0;[.AS2]>0);[.AU2]+MROUND([.CO2]-[.AU2];[.AS2]);[.CO2]) -> 0 | CQ2: of:=IF([.CK2]>0;[.CN2];[.CP2]+[.CG2]*[.AS2]) -> 0 | CR2: of:=IF([.F2]<=[.AU2];0;([.F2]-[.AU2])/[.AV2]) -> 0 | CS2: of:=IF([.BV2];"";TRIM([.DO2]&[.DP2]&[.DQ2]&[.DR2]&[.DS2]&[.DT2]&[.DU2]&[.DV2]&[.DW2])) ->  | CT2: of:=IF([.BO2]/[.F2]<(1+1/30);FLOOR(ROUND([.BO2]/[.F2];9))+1;FLOOR(ROUND(30*([.BO2]/[.F2]-1);9))+1) ->  | CV2: of:=MAX([.F2]-[.AR2];0) -> 0 | CW2: of:=IF([.AQ2]=0;0;[.CV2]/[.AQ2]) -> 0 | CX2: of:=IF(AND([.CW2]>=0.5;[.CW2]<1);3;IF([.CW2]>=1;5;0)) -> 0 | CY2: of:=IF([.AQ2]=0;0;MAX(CEILING([.CV2]/[.AQ2])-1;0)) -> 0 | CZ2: of:=FLOOR(([.CV2]/([.CY2]+1))/IF([.AT2]=0;1;[.AT2]))*[.AT2] -> 0 | DA2: of:=[.CZ2]+[.AT2] -> 5 | DB2: of:=CEILING(([.CV2]-(([.CY2]+1)*[.CZ2]))/IF([.AT2]=0;1;[.AT2])) -> 0 | DC2: of:=[.CY2]-[.DB2] -> 0 | DD2: of:=[.CY2]>=1 -> false | DE2: of:=[.CY2]>=2 -> false | DF2: of:=[.CY2]>=3 -> false | DG2: of:=MAX([.DC2]-3;0) -> 0 | DH2: of:=AND([.DD2];SUM([.DD2:.DF2])-0<=[.DC2]) -> false | DI2: of:=AND([.DE2];SUM([.DD2:.DF2])-1<=[.DC2]) -> false | DJ2: of:=AND([.DF2];SUM([.DD2:.DF2])-2<=[.DC2]) -> false | DK2: of:=MAX([.CY2]-3-[.DG2];0) -> 0 | DL2: of:=AND([.DD2];NOT([.DH2])) -> false | DM2: of:=AND([.DE2];NOT([.DI2])) -> false | DN2: of:=AND([.DF2];NOT([.DJ2])) -> false | DO2: of:=IF([.CX2]>0;"2x"&[.CX2]&"x"&[.AR2]&" ";"") ->  | DP2: of:=IF([.DK2]>0;[.DK2]&"x5x"&[.DA2]/[.AV2]&" ";"") ->  | DQ2: of:=IF([.DL2];"1x3x"&[.DA2]/[.AV2]&" ";"") ->  | DR2: of:=IF([.DM2];"1x2x"&[.DA2]/[.AV2]&" ";"") ->  | DS2: of:=IF([.DN2];"1x1x"&[.DA2]/[.AV2]&" ";"") ->  | DT2: of:=IF([.DG2]>0;[.DG2]&"x5x"&[.CZ2]/[.AV2]&" ";"") ->  | DU2: of:=IF([.DH2];"1x3x"&[.CZ2]/[.AV2]&" ";"") ->  | DV2: of:=IF([.DI2];"1x2x"&[.CZ2]/[.AV2]&" ";"") ->  | DW2: of:=IF([.DJ2];"1x1x"&[.CZ2]/[.AV2]&" ";"") ->  | DY2: of:=COUNT([.J2:.X2]) -> 0 | DZ2: of:=MIN(MAX([.DY2];1);MAX([.CA2];1)) -> 1 | EA2: of:=IF([.CB2]>0;MIN([.CB2];[.DY2]);15) -> 15 | EB2: of:=SUM(INDEX([.J2:.X2];1;[.DZ2];1):INDEX([.J2:.X2];1;[.EA2];1)) -> 0 | EC2: of:=AND(IF([.BX2];[.EB2]>=[.CC2];[.EB2]<=[.CC2]);[.AA2]=0) -> false | ED2: of:=IF([.BX2];AND([.CD2]>0;[.EB2]>=[.CD2]);AND([.CD2]>0;[.EB2]<=[.CD2])) -> false | EE2: of:=MAX([.J2:.X2]) -> 0 | EF2: of:=IF([.BY2];IF([.EE2]=1;[.F2];[.F2]*(1+[.EE2]/30));0) -> 0 | EH2: of:=[.AC2] -> 0 | EI2: of:=IF([.BR2]=0;[.$BA2];[.BR2]) -> 1001 | EJ2: of:=IF([.BS2]=0;[.$BA2];[.BS2]) -> 1001 | EK2: of:=IF([.CJ2]=0;1;[.CJ2]) -> 0.9 | EL2: of:=[.F2]+[.CF2]*[.AS2] -> 0 | EM2: of:=[.F2]+[.CE2]*[.AS2] -> 5 | EN2: of:=MROUND([.F2]*[.EK2];[.AS2]) -> 0 | EO2: of:=IF(NOT([.EC2]);[.BB2]+1;0) -> 1 | EP2: of:=AND([.CI2]>0;[.EO2]>=[.CI2]) -> false | EQ2: of:=IF([.EH2];[.F2];IF([.ED2];[.EL2];IF([.EC2];[.EM2];IF([.EP2];[.EN2];[.F2])))) -> 0 | ER2: of:=IF([.EH2];[.BA2];IF([.EC2];[.EI2];[.EJ2])) -> 1001 | ES2: of:=MAX([.EF2];[.BO2]) -> 0 | EU2: of:=IF([.$AH1]=VALUE(LEFT([.EU$1];3));ROW([.EU1]);[.EU1]) -> 101_last_row | EV2: of:=IF([.$AH1]=VALUE(LEFT([.EV$1];3));ROW([.EV1]);[.EV1]) -> 102_last_row | EW2: of:=IF([.$AH1]=VALUE(LEFT([.EW$1];3));ROW([.EW1]);[.EW1]) -> 103_last_row | EX2: of:=IF([.$AH1]=VALUE(LEFT([.EX$1];3));ROW([.EX1]);[.EX1]) -> 104_last_row | EY2: of:=IF([.$AH1]=VALUE(LEFT([.EY$1];3));ROW([.EY1]);[.EY1]) -> 105_last_row | EZ2: of:=IF([.$AH1]=VALUE(LEFT([.EZ$1];3));ROW([.EZ1]);[.EZ1]) -> 106_last_row | FA2: of:=IF([.$AH1]=VALUE(LEFT([.FA$1];3));ROW([.FA1]);[.FA1]) -> 107_last_row | FB2: of:=IF([.$AH1]=VALUE(LEFT([.FB$1];3));ROW([.FB1]);[.FB1]) -> 108_last_row | FC2: of:=IF([.$AH1]=VALUE(LEFT([.FC$1];3));ROW([.FC1]);[.FC1]) -> 109_last_row | FD2: of:=IF([.$AH1]=VALUE(LEFT([.FD$1];3));ROW([.FD1]);[.FD1]) -> 110_last_row | FE2: of:=IF([.$AH1]=VALUE(LEFT([.FE$1];3));ROW([.FE1]);[.FE1]) -> 111_last_row | FF2: of:=IF([.$AH1]=VALUE(LEFT([.FF$1];3));ROW([.FF1]);[.FF1]) -> 112_last_row | FG2: of:=IF([.$AH1]=VALUE(LEFT([.FG$1];3));ROW([.FG1]);[.FG1]) -> 113_last_row | FH2: of:=IF([.$AH1]=VALUE(LEFT([.FH$1];3));ROW([.FH1]);[.FH1]) -> 114_last_row | FI2: of:=IF([.$AH1]=VALUE(LEFT([.FI$1];3));ROW([.FI1]);[.FI1]) -> 115_last_row | FJ2: of:=IF([.$AH1]=VALUE(LEFT([.FJ$1];3));ROW([.FJ1]);[.FJ1]) -> 116_last_row | FK2: of:=IF([.$AH1]=VALUE(LEFT([.FK$1];3));ROW([.FK1]);[.FK1]) -> 117_last_row | FL2: of:=IF([.$AH1]=VALUE(LEFT([.FL$1];3));ROW([.FL1]);[.FL1]) -> 118_last_row | FM2: of:=IF([.$AH1]=VALUE(LEFT([.FM$1];3));ROW([.FM1]);[.FM1]) -> 119_last_row | FN2: of:=IF([.$AH1]=VALUE(LEFT([.FN$1];3));ROW([.FN1]);[.FN1]) -> 120_last_row | FO2: of:=IF([.$AH1]=VALUE(LEFT([.FO$1];3));ROW([.FO1]);[.FO1]) -> 121_last_row | FP2: of:=IF([.$AH1]=VALUE(LEFT([.FP$1];3));ROW([.FP1]);[.FP1]) -> 122_last_row | FQ2: of:=IF([.$AH1]=VALUE(LEFT([.FQ$1];3));ROW([.FQ1]);[.FQ1]) -> 123_last_row | FR2: of:=IF([.$AH1]=VALUE(LEFT([.FR$1];3));ROW([.FR1]);[.FR1]) -> 124_last_row | FS2: of:=IF([.$AH1]=VALUE(LEFT([.FS$1];3));ROW([.FS1]);[.FS1]) -> 125_last_row | FT2: of:=IF([.$AH1]=VALUE(LEFT([.FT$1];3));ROW([.FT1]);[.FT1]) -> 126_last_row | FU2: of:=IF([.$AH1]=VALUE(LEFT([.FU$1];3));ROW([.FU1]);[.FU1]) -> 127_last_row | FV2: of:=IF([.$AH1]=VALUE(LEFT([.FV$1];3));ROW([.FV1]);[.FV1]) -> 128_last_row | FW2: of:=IF([.$AH1]=VALUE(LEFT([.FW$1];3));ROW([.FW1]);[.FW1]) -> 129_last_row | FX2: of:=IF([.$AH1]=VALUE(LEFT([.FX$1];3));ROW([.FX1]);[.FX1]) -> 130_last_row | FZ2: of:=IF(IFNA([.$AM1];0)=INDEX([$trackers.$A$1:$trackers.$F$1048576];MATCH(INDEX([$dates.$A$1:$dates.$CU$1048576];MATCH([.$AF2];[$dates.$A$1:$dates.$A$1048576];0);MATCH("slot_"&LEFT([.FZ$1];3)&"_tracker_id";[$dates.$A$1:$dates.$AMJ$1];0);1);[$trackers.$A$1:$trackers.$A$1048576]);3;1);ROW([.FZ1]);[.FZ1]) -> 101_mvmt_last_row | GA2: of:=IF(IFNA([.$AM1];0)=INDEX([$trackers.$A$1:$trackers.$F$1048576];MATCH(INDEX([$dates.$A$1:$dates.$CU$1048576];MATCH([.$AF2];[$dates.$A$1:$dates.$A$1048576];0);MATCH("slot_"&LEFT([.GA$1];3)&"_tracker_id";[$dates.$A$1:$dates.$AMJ$1];0);1);[$trackers.$A$1:$trackers.$A$1048576]);3;1);ROW([.GA1]);[.GA1]) -> 102_mvmt_last_row | GB2: of:=IF(IFNA([.$AM1];0)=INDEX([$trackers.$A$1:$trackers.$F$1048576];MATCH(INDEX([$dates.$A$1:$dates.$CU$1048576];MATCH([.$AF2];[$dates.$A$1:$dates.$A$1048576];0);MATCH("slot_"&LEFT([.GB$1];3)&"_tracker_id";[$dates.$A$1:$dates.$AMJ$1];0);1);[$trackers.$A$1:$trackers.$A$1048576]);3;1);ROW([.GB1]);[.GB1]) ->  | GC2: of:=IF(IFNA([.$AM1];0)=INDEX([$trackers.$A$1:$trackers.$F$1048576];MATCH(INDEX([$dates.$A$1:$dates.$CU$1048576];MATCH([.$AF2];[$dates.$A$1:$dates.$A$1048576];0);MATCH("slot_"&LEFT([.GC$1];3)&"_tracker_id";[$dates.$A$1:$dates.$AMJ$1];0);1);[$trackers.$A$1:$trackers.$A$1048576]);3;1);ROW([.GC1]);[.GC1]) ->  | GD2: of:=IF(IFNA([.$AM1];0)=INDEX([$trackers.$A$1:$trackers.$F$1048576];MATCH(INDEX([$dates.$A$1:$dates.$CU$1048576];MATCH([.$AF2];[$dates.$A$1:$dates.$A$1048576];0);MATCH("slot_"&LEFT([.GD$1];3)&"_tracker_id";[$dates.$A$1:$dates.$AMJ$1];0);1);[$trackers.$A$1:$trackers.$A$1048576]);3;1);ROW([.GD1]);[.GD1]) ->  | GE2: of:=IF(IFNA([.$AM1];0)=INDEX([$trackers.$A$1:$trackers.$F$1048576];MATCH(INDEX([$dates.$A$1:$dates.$CU$1048576];MATCH([.$AF2];[$dates.$A$1:$dates.$A$1048576];0);MATCH("slot_"&LEFT([.GE$1];3)&"_tracker_id";[$dates.$A$1:$dates.$AMJ$1];0);1);[$trackers.$A$1:$trackers.$A$1048576]);3;1);ROW([.GE1]);[.GE1]) ->  | GF2: of:=IF(IFNA([.$AM1];0)=INDEX([$trackers.$A$1:$trackers.$F$1048576];MATCH(INDEX([$dates.$A$1:$dates.$CU$1048576];MATCH([.$AF2];[$dates.$A$1:$dates.$A$1048576];0);MATCH("slot_"&LEFT([.GF$1];3)&"_tracker_id";[$dates.$A$1:$dates.$AMJ$1];0);1);[$trackers.$A$1:$trackers.$A$1048576]);3;1);ROW([.GF1]);[.GF1]) ->  | GG2: of:=IF(IFNA([.$AM1];0)=INDEX([$trackers.$A$1:$trackers.$F$1048576];MATCH(INDEX([$dates.$A$1:$dates.$CU$1048576];MATCH([.$AF2];[$dates.$A$1:$dates.$A$1048576];0);MATCH("slot_"&LEFT([.GG$1];3)&"_tracker_id";[$dates.$A$1:$dates.$AMJ$1];0);1);[$trackers.$A$1:$trackers.$A$1048576]);3;1);ROW([.GG1]);[.GG1]) ->  | GH2: of:=IF(IFNA([.$AM1];0)=INDEX([$trackers.$A$1:$trackers.$F$1048576];MATCH(INDEX([$dates.$A$1:$dates.$CU$1048576];MATCH([.$AF2];[$dates.$A$1:$dates.$A$1048576];0);MATCH("slot_"&LEFT([.GH$1];3)&"_tracker_id";[$dates.$A$1:$dates.$AMJ$1];0);1);[$trackers.$A$1:$trackers.$A$1048576]);3;1);ROW([.GH1]);[.GH1]) ->  | GI2: of:=IF(IFNA([.$AM1];0)=INDEX([$trackers.$A$1:$trackers.$F$1048576];MATCH(INDEX([$dates.$A$1:$dates.$CU$1048576];MATCH([.$AF2];[$dates.$A$1:$dates.$A$1048576];0);MATCH("slot_"&LEFT([.GI$1];3)&"_tracker_id";[$dates.$A$1:$dates.$AMJ$1];0);1);[$trackers.$A$1:$trackers.$A$1048576]);3;1);ROW([.GI1]);[.GI1]) ->  | GJ2: of:=IF(IFNA([.$AM1];0)=INDEX([$trackers.$A$1:$trackers.$F$1048576];MATCH(INDEX([$dates.$A$1:$dates.$CU$1048576];MATCH([.$AF2];[$dates.$A$1:$dates.$A$1048576];0);MATCH("slot_"&LEFT([.GJ$1];3)&"_tracker_id";[$dates.$A$1:$dates.$AMJ$1];0);1);[$trackers.$A$1:$trackers.$A$1048576]);3;1);ROW([.GJ1]);[.GJ1]) ->  | GK2: of:=IF(IFNA([.$AM1];0)=INDEX([$trackers.$A$1:$trackers.$F$1048576];MATCH(INDEX([$dates.$A$1:$dates.$CU$1048576];MATCH([.$AF2];[$dates.$A$1:$dates.$A$1048576];0);MATCH("slot_"&LEFT([.GK$1];3)&"_tracker_id";[$dates.$A$1:$dates.$AMJ$1];0);1);[$trackers.$A$1:$trackers.$A$1048576]);3;1);ROW([.GK1]);[.GK1]) ->  | GL2: of:=IF(IFNA([.$AM1];0)=INDEX([$trackers.$A$1:$trackers.$F$1048576];MATCH(INDEX([$dates.$A$1:$dates.$CU$1048576];MATCH([.$AF2];[$dates.$A$1:$dates.$A$1048576];0);MATCH("slot_"&LEFT([.GL$1];3)&"_tracker_id";[$dates.$A$1:$dates.$AMJ$1];0);1);[$trackers.$A$1:$trackers.$A$1048576]);3;1);ROW([.GL1]);[.GL1]) ->  | GM2: of:=IF(IFNA([.$AM1];0)=INDEX([$trackers.$A$1:$trackers.$F$1048576];MATCH(INDEX([$dates.$A$1:$dates.$CU$1048576];MATCH([.$AF2];[$dates.$A$1:$dates.$A$1048576];0);MATCH("slot_"&LEFT([.GM$1];3)&"_tracker_id";[$dates.$A$1:$dates.$AMJ$1];0);1);[$trackers.$A$1:$trackers.$A$1048576]);3;1);ROW([.GM1]);[.GM1]) ->  | GN2: of:=IF(IFNA([.$AM1];0)=INDEX([$trackers.$A$1:$trackers.$F$1048576];MATCH(INDEX([$dates.$A$1:$dates.$CU$1048576];MATCH([.$AF2];[$dates.$A$1:$dates.$A$1048576];0);MATCH("slot_"&LEFT([.GN$1];3)&"_tracker_id";[$dates.$A$1:$dates.$AMJ$1];0);1);[$trackers.$A$1:$trackers.$A$1048576]);3;1);ROW([.GN1]);[.GN1]) ->  | GO2: of:=IF(IFNA([.$AM1];0)=INDEX([$trackers.$A$1:$trackers.$F$1048576];MATCH(INDEX([$dates.$A$1:$dates.$CU$1048576];MATCH([.$AF2];[$dates.$A$1:$dates.$A$1048576];0);MATCH("slot_"&LEFT([.GO$1];3)&"_tracker_id";[$dates.$A$1:$dates.$AMJ$1];0);1);[$trackers.$A$1:$trackers.$A$1048576]);3;1);ROW([.GO1]);[.GO1]) ->  | GP2: of:=IF(IFNA([.$AM1];0)=INDEX([$trackers.$A$1:$trackers.$F$1048576];MATCH(INDEX([$dates.$A$1:$dates.$CU$1048576];MATCH([.$AF2];[$dates.$A$1:$dates.$A$1048576];0);MATCH("slot_"&LEFT([.GP$1];3)&"_tracker_id";[$dates.$A$1:$dates.$AMJ$1];0);1);[$trackers.$A$1:$trackers.$A$1048576]);3;1);ROW([.GP1]);[.GP1]) ->  | GQ2: of:=IF(IFNA([.$AM1];0)=INDEX([$trackers.$A$1:$trackers.$F$1048576];MATCH(INDEX([$dates.$A$1:$dates.$CU$1048576];MATCH([.$AF2];[$dates.$A$1:$dates.$A$1048576];0);MATCH("slot_"&LEFT([.GQ$1];3)&"_tracker_id";[$dates.$A$1:$dates.$AMJ$1];0);1);[$trackers.$A$1:$trackers.$A$1048576]);3;1);ROW([.GQ1]);[.GQ1]) ->  | GR2: of:=IF(IFNA([.$AM1];0)=INDEX([$trackers.$A$1:$trackers.$F$1048576];MATCH(INDEX([$dates.$A$1:$dates.$CU$1048576];MATCH([.$AF2];[$dates.$A$1:$dates.$A$1048576];0);MATCH("slot_"&LEFT([.GR$1];3)&"_tracker_id";[$dates.$A$1:$dates.$AMJ$1];0);1);[$trackers.$A$1:$trackers.$A$1048576]);3;1);ROW([.GR1]);[.GR1]) ->  | GS2: of:=IF(IFNA([.$AM1];0)=INDEX([$trackers.$A$1:$trackers.$F$1048576];MATCH(INDEX([$dates.$A$1:$dates.$CU$1048576];MATCH([.$AF2];[$dates.$A$1:$dates.$A$1048576];0);MATCH("slot_"&LEFT([.GS$1];3)&"_tracker_id";[$dates.$A$1:$dates.$AMJ$1];0);1);[$trackers.$A$1:$trackers.$A$1048576]);3;1);ROW([.GS1]);[.GS1]) ->  | GT2: of:=IF(IFNA([.$AM1];0)=INDEX([$trackers.$A$1:$trackers.$F$1048576];MATCH(INDEX([$dates.$A$1:$dates.$CU$1048576];MATCH([.$AF2];[$dates.$A$1:$dates.$A$1048576];0);MATCH("slot_"&LEFT([.GT$1];3)&"_tracker_id";[$dates.$A$1:$dates.$AMJ$1];0);1);[$trackers.$A$1:$trackers.$A$1048576]);3;1);ROW([.GT1]);[.GT1]) ->  | GU2: of:=IF(IFNA([.$AM1];0)=INDEX([$trackers.$A$1:$trackers.$F$1048576];MATCH(INDEX([$dates.$A$1:$dates.$CU$1048576];MATCH([.$AF2];[$dates.$A$1:$dates.$A$1048576];0);MATCH("slot_"&LEFT([.GU$1];3)&"_tracker_id";[$dates.$A$1:$dates.$AMJ$1];0);1);[$trackers.$A$1:$trackers.$A$1048576]);3;1);ROW([.GU1]);[.GU1]) ->  | GV2: of:=IF(IFNA([.$AM1];0)=INDEX([$trackers.$A$1:$trackers.$F$1048576];MATCH(INDEX([$dates.$A$1:$dates.$CU$1048576];MATCH([.$AF2];[$dates.$A$1:$dates.$A$1048576];0);MATCH("slot_"&LEFT([.GV$1];3)&"_tracker_id";[$dates.$A$1:$dates.$AMJ$1];0);1);[$trackers.$A$1:$trackers.$A$1048576]);3;1);ROW([.GV1]);[.GV1]) ->  | GW2: of:=IF(IFNA([.$AM1];0)=INDEX([$trackers.$A$1:$trackers.$F$1048576];MATCH(INDEX([$dates.$A$1:$dates.$CU$1048576];MATCH([.$AF2];[$dates.$A$1:$dates.$A$1048576];0);MATCH("slot_"&LEFT([.GW$1];3)&"_tracker_id";[$dates.$A$1:$dates.$AMJ$1];0);1);[$trackers.$A$1:$trackers.$A$1048576]);3;1);ROW([.GW1]);[.GW1]) ->  | GX2: of:=IF(IFNA([.$AM1];0)=INDEX([$trackers.$A$1:$trackers.$F$1048576];MATCH(INDEX([$dates.$A$1:$dates.$CU$1048576];MATCH([.$AF2];[$dates.$A$1:$dates.$A$1048576];0);MATCH("slot_"&LEFT([.GX$1];3)&"_tracker_id";[$dates.$A$1:$dates.$AMJ$1];0);1);[$trackers.$A$1:$trackers.$A$1048576]);3;1);ROW([.GX1]);[.GX1]) ->  | GY2: of:=IF(IFNA([.$AM1];0)=INDEX([$trackers.$A$1:$trackers.$F$1048576];MATCH(INDEX([$dates.$A$1:$dates.$CU$1048576];MATCH([.$AF2];[$dates.$A$1:$dates.$A$1048576];0);MATCH("slot_"&LEFT([.GY$1];3)&"_tracker_id";[$dates.$A$1:$dates.$AMJ$1];0);1);[$trackers.$A$1:$trackers.$A$1048576]);3;1);ROW([.GY1]);[.GY1]) ->  | GZ2: of:=IF(IFNA([.$AM1];0)=INDEX([$trackers.$A$1:$trackers.$F$1048576];MATCH(INDEX([$dates.$A$1:$dates.$CU$1048576];MATCH([.$AF2];[$dates.$A$1:$dates.$A$1048576];0);MATCH("slot_"&LEFT([.GZ$1];3)&"_tracker_id";[$dates.$A$1:$dates.$AMJ$1];0);1);[$trackers.$A$1:$trackers.$A$1048576]);3;1);ROW([.GZ1]);[.GZ1]) ->  | HA2: of:=IF(IFNA([.$AM1];0)=INDEX([$trackers.$A$1:$trackers.$F$1048576];MATCH(INDEX([$dates.$A$1:$dates.$CU$1048576];MATCH([.$AF2];[$dates.$A$1:$dates.$A$1048576];0);MATCH("slot_"&LEFT([.HA$1];3)&"_tracker_id";[$dates.$A$1:$dates.$AMJ$1];0);1);[$trackers.$A$1:$trackers.$A$1048576]);3;1);ROW([.HA1]);[.HA1]) ->  | HB2: of:=IF(IFNA([.$AM1];0)=INDEX([$trackers.$A$1:$trackers.$F$1048576];MATCH(INDEX([$dates.$A$1:$dates.$CU$1048576];MATCH([.$AF2];[$dates.$A$1:$dates.$A$1048576];0);MATCH("slot_"&LEFT([.HB$1];3)&"_tracker_id";[$dates.$A$1:$dates.$AMJ$1];0);1);[$trackers.$A$1:$trackers.$A$1048576]);3;1);ROW([.HB1]);[.HB1]) ->  | HC2: of:=IF(IFNA([.$AM1];0)=INDEX([$trackers.$A$1:$trackers.$F$1048576];MATCH(INDEX([$dates.$A$1:$dates.$CU$1048576];MATCH([.$AF2];[$dates.$A$1:$dates.$A$1048576];0);MATCH("slot_"&LEFT([.HC$1];3)&"_tracker_id";[$dates.$A$1:$dates.$AMJ$1];0);1);[$trackers.$A$1:$trackers.$A$1048576]);3;1);ROW([.HC1]);[.HC1]) -> 
A3: of:=[.AF3] -> 2020-06-27 | B3: of:=IFNA([.AP3];"") -> bench (non-microloadable), WAS bar | C3: of:=IFNA([.BT3];"") -> 3x5 | D3: of:=IFNA([.CQ3];"") -> 0 | E3: of:=CHAR(10)&CHAR(10)&"----"&CHAR(10)&"# "&TEXT([.A3];"yyyy-mm-dd")&CHAR(10)&"# "&[.B3]&CHAR(10)&"# "&[.C3]&CHAR(10)&IF(AND([.F3]>0;[.BY3]);"# "&"reps for PR: "&[.CT3]&CHAR(10);"")&"# "&"rest: "&IF([.BU3]>0;[.BU3];"")&CHAR(10)&"# "&"wup climbs per loading point: "&[.CS3]&CHAR(10)&"# "&"work per loading point: "&[.CR3]&IF([.Z3]>0;CHAR(10)&"# "&"New target: "&[.Z3];"")&CHAR(10)&CHAR(10)&"## debrief:"&CHAR(10)&IF([.Y3]=0;"";CHAR(10)&"## "&"prebrief:"&CHAR(10)&TRIM([.Y3]))&CHAR(10)&"## "&"movement notes:"&CHAR(10)&IF([.BN3]=0;"";CHAR(10)&TRIM([.BN3]))&CHAR(10)&"## "&"progression notes:"&CHAR(10)&IF([.BH3]=0;"";CHAR(10)&TRIM([.BH3]))&CHAR(10)&"## "&"results:" -> 

----
# 2020-06-27
# bench (non-microloadable), WAS bar
# 3x5
# rest: 1.5/3/5m
# wup climbs per loading point: 
# work per loading point: 0

## debrief:

## movement notes:

## progression notes:

## results: | AD3: Demo data | AF3: of:=IF(ROW()=2;[.A3];IF([.AJ2];INDEX([$dates.A$1:$dates.A$1048576];MATCH([.AF2];[$dates.A$1:$dates.A$1048576];0)+1;1;1);[.AF2])) -> 2020-06-27 | AG3: of:=IF(OR([.AJ2]; ROW([.AJ2])=1);1;[.AG2]+1) -> 1 | AH3: of:=INDEX([$dates.D$1:$dates.W$1048576];MATCH([.AF3];[$dates.A$1:$dates.A$1048576]);MATCH("work_slot_"&[.AG3];[$dates.D$1:$dates.W$1];0);1) -> 102 | AI3: of:=IFNA(INDEX([$dates.D$1:$dates.W$1048576];MATCH([.AF3];[$dates.A$1:$dates.A$1048576]);MATCH("work_slot_"&[.AG3]+1;[$dates.D$1:$dates.W$1];0);1);0) -> 0 | AJ3: of:=[.AI3]=0 -> true | AK3: of:=INDEX([$dates.A$1:$dates.CU$1048576];MATCH([.AF3];[$dates.A$1:$dates.A$1048576];0);MATCH("slot_"&[.AH3]&"_tracker_id";[$dates.$A$1:$dates.$AMJ$1];0);1) -> 1002 | AM3: of:=INDEX([$trackers.C$1:$trackers.C$1048576];MATCH([.AK3];[$trackers.A$1:$trackers.A$1048576];0);1;1) -> 1002 | AN3: of:=INDEX([$trackers.E$1:$trackers.E$1048576];MATCH([.AK3];[$trackers.A$1:$trackers.A$1048576];0);1;1) -> 1001 | AP3: of:=INDEX([$movements.B$1:$movements.B$1048576];MATCH([.$AM3];[$movements.$A$1:$movements.$A$1048576];0);1;1) -> bench (non-microloadable), WAS bar | AQ3: of:=INDEX([$movements.C$1:$movements.C$1048576];MATCH([.$AM3];[$movements.$A$1:$movements.$A$1048576];0);1;1) -> 45 | AR3: of:=INDEX([$movements.D$1:$movements.D$1048576];MATCH([.$AM3];[$movements.$A$1:$movements.$A$1048576];0);1;1) -> 41.5 | AS3: of:=INDEX([$movements.E$1:$movements.E$1048576];MATCH([.$AM3];[$movements.$A$1:$movements.$A$1048576];0);1;1) -> 5 | AT3: of:=INDEX([$movements.F$1:$movements.F$1048576];MATCH([.$AM3];[$movements.$A$1:$movements.$A$1048576];0);1;1) -> 5 | AU3: of:=INDEX([$movements.G$1:$movements.G$1048576];MATCH([.$AM3];[$movements.$A$1:$movements.$A$1048576];0);1;1) -> 41.5 | AV3: of:=INDEX([$movements.H$1:$movements.H$1048576];MATCH([.$AM3];[$movements.$A$1:$movements.$A$1048576];0);1;1) -> 2 | AX3: of:=INDEX([.$A3:.$AMJ3];1;MATCH([.AH3]&"_last_row";[.$A$1:.$AMJ$1];0);1) -> 102_last_row | AY3: of:=IF(ISNUMBER([.AX3]);INDEX([.AK$1:.AK$1048576];[.$AX3];1;1);0) -> 0 | AZ3: of:=[.AY3]=[.AK3] -> false | BA3: of:=IF([.$AZ3];INDEX([.ER$1:.ER$1048576];[.$AX3];1;1);[.AN3]) -> 1001 | BB3: of:=IF([.AA3]<>"";[.AA3];IF([.$AZ3];INDEX([.EO$1:.EO$1048576];[.$AX3];1;1);0)) -> 0 | BC3: of:=IF([.$AZ3];INDEX([.$BD$1:.$BD$1048576];[.$AX3];1;1);0) -> 0 | BD3: of:=IF([.Z3]>0;[.Z3];[.BC3]) -> 0 | BE3: of:=IF([.$AZ3];INDEX([.EQ$1:.EQ$1048576];[.$AX3];1;1);0) -> 0 | BF3: of:=IF([.$AZ3];OR(INDEX([.AB$1:.AB$1048576];[.$AX3];1;1);INDEX([.BW$1:.BW$1048576];[.$AX3];1;1));0) -> false | BG3: of:=IF([.$AZ3];IF(AND([.$BF3];INDEX([.I$1:.I$1048576];[.$AX3];1;1)="");INDEX([.BG$1:.BG$1048576];[.$AX3];1;1);INDEX([.I$1:.I$1048576];[.$AX3];1;1));0) -> 0 | BH3: of:=IF([.BW3];0;[.BG3]) -> 0 | BJ3: of:=INDEX([.$A3:.$AMJ3];1;MATCH([.AH3]&"_mvmt_last_row";[.$A$1:.$AMJ$1];0);1) -> 102_mvmt_last_row | BK3: of:=IF(ISNUMBER([.BJ3]);INDEX([.AM$1:.AM$1048576];[.$BJ3];1;1);0) -> 0 | BL3: of:=[.BK3]=[.AM3] -> false | BM3: of:=IF([.$BL3];IF(AND([.$BF3];INDEX([.H$1:.H$1048576];[.$BJ3];1;1)="");INDEX([.BM$1:.BM$1048576];[.$BJ3];1;1);INDEX([.H$1:.H$1048576];[.$BJ3];1;1));0) -> 0 | BN3: of:=IF([.BW3];0;[.BM3]) -> 0 | BO3: of:=IF([.$BL3];INDEX([.ES$1:.ES$1048576];[.$BJ3];1;1);0) -> 0 | BQ3: of:=INDEX([$progression_stages.C$1:$progression_stages.C$1048576];MATCH([.$BA3];[$progression_stages.$A$1:$progression_stages.$A$1048576];0);1;1) -> SL 3x5 non-DL | BR3: of:=INDEX([$progression_stages.D$1:$progression_stages.D$1048576];MATCH([.$BA3];[$progression_stages.$A$1:$progression_stages.$A$1048576];0);1;1) -> 0 | BS3: of:=INDEX([$progression_stages.E$1:$progression_stages.E$1048576];MATCH([.$BA3];[$progression_stages.$A$1:$progression_stages.$A$1048576];0);1;1) -> 0 | BT3: of:=INDEX([$progression_stages.F$1:$progression_stages.F$1048576];MATCH([.$BA3];[$progression_stages.$A$1:$progression_stages.$A$1048576];0);1;1) -> 3x5 | BU3: of:=INDEX([$progression_stages.G$1:$progression_stages.G$1048576];MATCH([.$BA3];[$progression_stages.$A$1:$progression_stages.$A$1048576];0);1;1) -> 1.5/3/5m | BV3: of:=INDEX([$progression_stages.H$1:$progression_stages.H$1048576];MATCH([.$BA3];[$progression_stages.$A$1:$progression_stages.$A$1048576];0);1;1) -> 0 | BW3: of:=INDEX([$progression_stages.I$1:$progression_stages.I$1048576];MATCH([.$BA3];[$progression_stages.$A$1:$progression_stages.$A$1048576];0);1;1) -> 0 | BX3: of:=INDEX([$progression_stages.J$1:$progression_stages.J$1048576];MATCH([.$BA3];[$progression_stages.$A$1:$progression_stages.$A$1048576];0);1;1) -> true | BY3: of:=INDEX([$progression_stages.K$1:$progression_stages.K$1048576];MATCH([.$BA3];[$progression_stages.$A$1:$progression_stages.$A$1048576];0);1;1) -> true | BZ3: of:=INDEX([$progression_stages.L$1:$progression_stages.L$1048576];MATCH([.$BA3];[$progression_stages.$A$1:$progression_stages.$A$1048576];0);1;1) -> false | CA3: of:=INDEX([$progression_stages.M$1:$progression_stages.M$1048576];MATCH([.$BA3];[$progression_stages.$A$1:$progression_stages.$A$1048576];0);1;1) -> 0 | CB3: of:=INDEX([$progression_stages.N$1:$progression_stages.N$1048576];MATCH([.$BA3];[$progression_stages.$A$1:$progression_stages.$A$1048576];0);1;1) -> 0 | CC3: of:=INDEX([$progression_stages.O$1:$progression_stages.O$1048576];MATCH([.$BA3];[$progression_stages.$A$1:$progression_stages.$A$1048576];0);1;1) -> 15 | CD3: of:=INDEX([$progression_stages.P$1:$progression_stages.P$1048576];MATCH([.$BA3];[$progression_stages.$A$1:$progression_stages.$A$1048576];0);1;1) -> 0 | CE3: of:=INDEX([$progression_stages.Q$1:$progression_stages.Q$1048576];MATCH([.$BA3];[$progression_stages.$A$1:$progression_stages.$A$1048576];0);1;1) -> 1 | CF3: of:=INDEX([$progression_stages.R$1:$progression_stages.R$1048576];MATCH([.$BA3];[$progression_stages.$A$1:$progression_stages.$A$1048576];0);1;1) -> 0 | CG3: of:=INDEX([$progression_stages.S$1:$progression_stages.S$1048576];MATCH([.$BA3];[$progression_stages.$A$1:$progression_stages.$A$1048576];0);1;1) -> 0 | CH3: of:=INDEX([$progression_stages.T$1:$progression_stages.T$1048576];MATCH([.$BA3];[$progression_stages.$A$1:$progression_stages.$A$1048576];0);1;1) -> 0 | CI3: of:=INDEX([$progression_stages.U$1:$progression_stages.U$1048576];MATCH([.$BA3];[$progression_stages.$A$1:$progression_stages.$A$1048576];0);1;1) -> 3 | CJ3: of:=INDEX([$progression_stages.V$1:$progression_stages.V$1048576];MATCH([.$BA3];[$progression_stages.$A$1:$progression_stages.$A$1048576];0);1;1) -> 0.9 | CK3: of:=INDEX([$progression_stages.W$1:$progression_stages.W$1048576];MATCH([.$BA3];[$progression_stages.$A$1:$progression_stages.$A$1048576];0);1;1) -> 0 | CM3: of:=[.CK3]*[.BD3] -> 0 | CN3: of:=IF(AND([.CM3]>0;[.AS3]>0);[.AU3]+MROUND([.CM3]-[.AU3];[.AS3]);[.CM3]) -> 0 | CO3: of:=IF([.CH3]=0;[.BE3];[.CH3]*[.BE3]) -> 0 | CP3: of:=IF(AND([.CO3]>0;[.AS3]>0);[.AU3]+MROUND([.CO3]-[.AU3];[.AS3]);[.CO3]) -> 0 | CQ3: of:=IF([.CK3]>0;[.CN3];[.CP3]+[.CG3]*[.AS3]) -> 0 | CR3: of:=IF([.F3]<=[.AU3];0;([.F3]-[.AU3])/[.AV3]) -> 0 | CS3: of:=IF([.BV3];"";TRIM([.DO3]&[.DP3]&[.DQ3]&[.DR3]&[.DS3]&[.DT3]&[.DU3]&[.DV3]&[.DW3])) ->  | CT3: of:=IF([.BO2]/[.F2]<(1+1/30);FLOOR(ROUND([.BO2]/[.F2];9))+1;FLOOR(ROUND(30*([.BO2]/[.F2]-1);9))+1) ->  | CV3: of:=MAX([.F3]-[.AR3];0) -> 0 | CW3: of:=IF([.AQ3]=0;0;[.CV3]/[.AQ3]) -> 0 | CX3: of:=IF(AND([.CW3]>=0.5;[.CW3]<1);3;IF([.CW3]>=1;5;0)) -> 0 | CY3: of:=IF([.AQ3]=0;0;MAX(CEILING([.CV3]/[.AQ3])-1;0)) -> 0 | CZ3: of:=FLOOR(([.CV3]/([.CY3]+1))/IF([.AT3]=0;1;[.AT3]))*[.AT3] -> 0 | DA3: of:=[.CZ3]+[.AT3] -> 5 | DB3: of:=CEILING(([.CV3]-(([.CY3]+1)*[.CZ3]))/IF([.AT3]=0;1;[.AT3])) -> 0 | DC3: of:=[.CY3]-[.DB3] -> 0 | DD3: of:=[.CY3]>=1 -> false | DE3: of:=[.CY3]>=2 -> false | DF3: of:=[.CY3]>=3 -> false | DG3: of:=MAX([.DC3]-3;0) -> 0 | DH3: of:=AND([.DD3];SUM([.DD3:.DF3])-0<=[.DC3]) -> false | DI3: of:=AND([.DE3];SUM([.DD3:.DF3])-1<=[.DC3]) -> false | DJ3: of:=AND([.DF3];SUM([.DD3:.DF3])-2<=[.DC3]) -> false | DK3: of:=MAX([.CY3]-3-[.DG3];0) -> 0 | DL3: of:=AND([.DD3];NOT([.DH3])) -> false | DM3: of:=AND([.DE3];NOT([.DI3])) -> false | DN3: of:=AND([.DF3];NOT([.DJ3])) -> false | DO3: of:=IF([.CX3]>0;"2x"&[.CX3]&"x"&[.AR3]&" ";"") ->  | DP3: of:=IF([.DK3]>0;[.DK3]&"x5x"&[.DA3]/[.AV3]&" ";"") ->  | DQ3: of:=IF([.DL3];"1x3x"&[.DA3]/[.AV3]&" ";"") ->  | DR3: of:=IF([.DM3];"1x2x"&[.DA3]/[.AV3]&" ";"") ->  | DS3: of:=IF([.DN3];"1x1x"&[.DA3]/[.AV3]&" ";"") ->  | DT3: of:=IF([.DG3]>0;[.DG3]&"x5x"&[.CZ3]/[.AV3]&" ";"") ->  | DU3: of:=IF([.DH3];"1x3x"&[.CZ3]/[.AV3]&" ";"") ->  | DV3: of:=IF([.DI3];"1x2x"&[.CZ3]/[.AV3]&" ";"") ->  | DW3: of:=IF([.DJ3];"1x1x"&[.CZ3]/[.AV3]&" ";"") ->  | DY3: of:=COUNT([.J3:.X3]) -> 0 | DZ3: of:=MIN(MAX([.DY3];1);MAX([.CA3];1)) -> 1 | EA3: of:=IF([.CB3]>0;MIN([.CB3];[.DY3]);15) -> 15 | EB3: of:=SUM(INDEX([.J3:.X3];1;[.DZ3];1):INDEX([.J3:.X3];1;[.EA3];1)) -> 0 | EC3: of:=AND(IF([.BX3];[.EB3]>=[.CC3];[.EB3]<=[.CC3]);[.AA3]=0) -> false | ED3: of:=IF([.BX3];AND([.CD3]>0;[.EB3]>=[.CD3]);AND([.CD3]>0;[.EB3]<=[.CD3])) -> false | EE3: of:=MAX([.J3:.X3]) -> 0 | EF3: of:=IF([.BY3];IF([.EE3]=1;[.F3];[.F3]*(1+[.EE3]/30));0) -> 0 | EH3: of:=[.AC3] -> 0 | EI3: of:=IF([.BR3]=0;[.$BA3];[.BR3]) -> 1001 | EJ3: of:=IF([.BS3]=0;[.$BA3];[.BS3]) -> 1001 | EK3: of:=IF([.CJ3]=0;1;[.CJ3]) -> 0.9 | EL3: of:=[.F3]+[.CF3]*[.AS3] -> 0 | EM3: of:=[.F3]+[.CE3]*[.AS3] -> 5 | EN3: of:=MROUND([.F3]*[.EK3];[.AS3]) -> 0 | EO3: of:=IF(NOT([.EC3]);[.BB3]+1;0) -> 1 | EP3: of:=AND([.CI3]>0;[.EO3]>=[.CI3]) -> false | EQ3: of:=IF([.EH3];[.F3];IF([.ED3];[.EL3];IF([.EC3];[.EM3];IF([.EP3];[.EN3];[.F3])))) -> 0 | ER3: of:=IF([.EH3];[.BA3];IF([.EC3];[.EI3];[.EJ3])) -> 1001 | ES3: of:=MAX([.EF3];[.BO3]) -> 0 | EU3: of:=IF([.$AH2]=VALUE(LEFT([.EU$1];3));ROW([.EU2]);[.EU2]) -> 2 | EV3: of:=IF([.$AH2]=VALUE(LEFT([.EV$1];3));ROW([.EV2]);[.EV2]) -> 102_last_row | EW3: of:=IF([.$AH2]=VALUE(LEFT([.EW$1];3));ROW([.EW2]);[.EW2]) -> 103_last_row | EX3: of:=IF([.$AH2]=VALUE(LEFT([.EX$1];3));ROW([.EX2]);[.EX2]) -> 104_last_row | EY3: of:=IF([.$AH2]=VALUE(LEFT([.EY$1];3));ROW([.EY2]);[.EY2]) -> 105_last_row | EZ3: of:=IF([.$AH2]=VALUE(LEFT([.EZ$1];3));ROW([.EZ2]);[.EZ2]) -> 106_last_row | FA3: of:=IF([.$AH2]=VALUE(LEFT([.FA$1];3));ROW([.FA2]);[.FA2]) -> 107_last_row | FB3: of:=IF([.$AH2]=VALUE(LEFT([.FB$1];3));ROW([.FB2]);[.FB2]) -> 108_last_row | FC3: of:=IF([.$AH2]=VALUE(LEFT([.FC$1];3));ROW([.FC2]);[.FC2]) -> 109_last_row | FD3: of:=IF([.$AH2]=VALUE(LEFT([.FD$1];3));ROW([.FD2]);[.FD2]) -> 110_last_row | FE3: of:=IF([.$AH2]=VALUE(LEFT([.FE$1];3));ROW([.FE2]);[.FE2]) -> 111_last_row | FF3: of:=IF([.$AH2]=VALUE(LEFT([.FF$1];3));ROW([.FF2]);[.FF2]) -> 112_last_row | FG3: of:=IF([.$AH2]=VALUE(LEFT([.FG$1];3));ROW([.FG2]);[.FG2]) -> 113_last_row | FH3: of:=IF([.$AH2]=VALUE(LEFT([.FH$1];3));ROW([.FH2]);[.FH2]) -> 114_last_row | FI3: of:=IF([.$AH2]=VALUE(LEFT([.FI$1];3));ROW([.FI2]);[.FI2]) -> 115_last_row | FJ3: of:=IF([.$AH2]=VALUE(LEFT([.FJ$1];3));ROW([.FJ2]);[.FJ2]) -> 116_last_row | FK3: of:=IF([.$AH2]=VALUE(LEFT([.FK$1];3));ROW([.FK2]);[.FK2]) -> 117_last_row | FL3: of:=IF([.$AH2]=VALUE(LEFT([.FL$1];3));ROW([.FL2]);[.FL2]) -> 118_last_row | FM3: of:=IF([.$AH2]=VALUE(LEFT([.FM$1];3));ROW([.FM2]);[.FM2]) -> 119_last_row | FN3: of:=IF([.$AH2]=VALUE(LEFT([.FN$1];3));ROW([.FN2]);[.FN2]) -> 120_last_row | FO3: of:=IF([.$AH2]=VALUE(LEFT([.FO$1];3));ROW([.FO2]);[.FO2]) -> 121_last_row | FP3: of:=IF([.$AH2]=VALUE(LEFT([.FP$1];3));ROW([.FP2]);[.FP2]) -> 122_last_row | FQ3: of:=IF([.$AH2]=VALUE(LEFT([.FQ$1];3));ROW([.FQ2]);[.FQ2]) -> 123_last_row | FR3: of:=IF([.$AH2]=VALUE(LEFT([.FR$1];3));ROW([.FR2]);[.FR2]) -> 124_last_row | FS3: of:=IF([.$AH2]=VALUE(LEFT([.FS$1];3));ROW([.FS2]);[.FS2]) -> 125_last_row | FT3: of:=IF([.$AH2]=VALUE(LEFT([.FT$1];3));ROW([.FT2]);[.FT2]) -> 126_last_row | FU3: of:=IF([.$AH2]=VALUE(LEFT([.FU$1];3));ROW([.FU2]);[.FU2]) -> 127_last_row | FV3: of:=IF([.$AH2]=VALUE(LEFT([.FV$1];3));ROW([.FV2]);[.FV2]) -> 128_last_row | FW3: of:=IF([.$AH2]=VALUE(LEFT([.FW$1];3));ROW([.FW2]);[.FW2]) -> 129_last_row | FX3: of:=IF([.$AH2]=VALUE(LEFT([.FX$1];3));ROW([.FX2]);[.FX2]) -> 130_last_row | FZ3: of:=IF(IFNA([.$AM2];0)=INDEX([$trackers.$A$1:$trackers.$F$1048576];MATCH(INDEX([$dates.$A$1:$dates.$CU$1048576];MATCH([.$AF3];[$dates.$A$1:$dates.$A$1048576];0);MATCH("slot_"&LEFT([.FZ$1];3)&"_tracker_id";[$dates.$A$1:$dates.$AMJ$1];0);1);[$trackers.$A$1:$trackers.$A$1048576]);3;1);ROW([.FZ2]);[.FZ2]) -> 2 | GA3: of:=IF(IFNA([.$AM2];0)=INDEX([$trackers.$A$1:$trackers.$F$1048576];MATCH(INDEX([$dates.$A$1:$dates.$CU$1048576];MATCH([.$AF3];[$dates.$A$1:$dates.$A$1048576];0);MATCH("slot_"&LEFT([.GA$1];3)&"_tracker_id";[$dates.$A$1:$dates.$AMJ$1];0);1);[$trackers.$A$1:$trackers.$A$1048576]);3;1);ROW([.GA2]);[.GA2]) -> 102_mvmt_last_row | GB3: of:=IF(IFNA([.$AM2];0)=INDEX([$trackers.$A$1:$trackers.$F$1048576];MATCH(INDEX([$dates.$A$1:$dates.$CU$1048576];MATCH([.$AF3];[$dates.$A$1:$dates.$A$1048576];0);MATCH("slot_"&LEFT([.GB$1];3)&"_tracker_id";[$dates.$A$1:$dates.$AMJ$1];0);1);[$trackers.$A$1:$trackers.$A$1048576]);3;1);ROW([.GB2]);[.GB2]) ->  | GC3: of:=IF(IFNA([.$AM2];0)=INDEX([$trackers.$A$1:$trackers.$F$1048576];MATCH(INDEX([$dates.$A$1:$dates.$CU$1048576];MATCH([.$AF3];[$dates.$A$1:$dates.$A$1048576];0);MATCH("slot_"&LEFT([.GC$1];3)&"_tracker_id";[$dates.$A$1:$dates.$AMJ$1];0);1);[$trackers.$A$1:$trackers.$A$1048576]);3;1);ROW([.GC2]);[.GC2]) ->  | GD3: of:=IF(IFNA([.$AM2];0)=INDEX([$trackers.$A$1:$trackers.$F$1048576];MATCH(INDEX([$dates.$A$1:$dates.$CU$1048576];MATCH([.$AF3];[$dates.$A$1:$dates.$A$1048576];0);MATCH("slot_"&LEFT([.GD$1];3)&"_tracker_id";[$dates.$A$1:$dates.$AMJ$1];0);1);[$trackers.$A$1:$trackers.$A$1048576]);3;1);ROW([.GD2]);[.GD2]) ->  | GE3: of:=IF(IFNA([.$AM2];0)=INDEX([$trackers.$A$1:$trackers.$F$1048576];MATCH(INDEX([$dates.$A$1:$dates.$CU$1048576];MATCH([.$AF3];[$dates.$A$1:$dates.$A$1048576];0);MATCH("slot_"&LEFT([.GE$1];3)&"_tracker_id";[$dates.$A$1:$dates.$AMJ$1];0);1);[$trackers.$A$1:$trackers.$A$1048576]);3;1);ROW([.GE2]);[.GE2]) ->  | GF3: of:=IF(IFNA([.$AM2];0)=INDEX([$trackers.$A$1:$trackers.$F$1048576];MATCH(INDEX([$dates.$A$1:$dates.$CU$1048576];MATCH([.$AF3];[$dates.$A$1:$dates.$A$1048576];0);MATCH("slot_"&LEFT([.GF$1];3)&"_tracker_id";[$dates.$A$1:$dates.$AMJ$1];0);1);[$trackers.$A$1:$trackers.$A$1048576]);3;1);ROW([.GF2]);[.GF2]) ->  | GG3: of:=IF(IFNA([.$AM2];0)=INDEX([$trackers.$A$1:$trackers.$F$1048576];MATCH(INDEX([$dates.$A$1:$dates.$CU$1048576];MATCH([.$AF3];[$dates.$A$1:$dates.$A$1048576];0);MATCH("slot_"&LEFT([.GG$1];3)&"_tracker_id";[$dates.$A$1:$dates.$AMJ$1];0);1);[$trackers.$A$1:$trackers.$A$1048576]);3;1);ROW([.GG2]);[.GG2]) ->  | GH3: of:=IF(IFNA([.$AM2];0)=INDEX([$trackers.$A$1:$trackers.$F$1048576];MATCH(INDEX([$dates.$A$1:$dates.$CU$1048576];MATCH([.$AF3];[$dates.$A$1:$dates.$A$1048576];0);MATCH("slot_"&LEFT([.GH$1];3)&"_tracker_id";[$dates.$A$1:$dates.$AMJ$1];0);1);[$trackers.$A$1:$trackers.$A$1048576]);3;1);ROW([.GH2]);[.GH2]) ->  | GI3: of:=IF(IFNA([.$AM2];0)=INDEX([$trackers.$A$1:$trackers.$F$1048576];MATCH(INDEX([$dates.$A$1:$dates.$CU$1048576];MATCH([.$AF3];[$dates.$A$1:$dates.$A$1048576];0);MATCH("slot_"&LEFT([.GI$1];3)&"_tracker_id";[$dates.$A$1:$dates.$AMJ$1];0);1);[$trackers.$A$1:$trackers.$A$1048576]);3;1);ROW([.GI2]);[.GI2]) ->  | GJ3: of:=IF(IFNA([.$AM2];0)=INDEX([$trackers.$A$1:$trackers.$F$1048576];MATCH(INDEX([$dates.$A$1:$dates.$CU$1048576];MATCH([.$AF3];[$dates.$A$1:$dates.$A$1048576];0);MATCH("slot_"&LEFT([.GJ$1];3)&"_tracker_id";[$dates.$A$1:$dates.$AMJ$1];0);1);[$trackers.$A$1:$trackers.$A$1048576]);3;1);ROW([.GJ2]);[.GJ2]) ->  | GK3: of:=IF(IFNA([.$AM2];0)=INDEX([$trackers.$A$1:$trackers.$F$1048576];MATCH(INDEX([$dates.$A$1:$dates.$CU$1048576];MATCH([.$AF3];[$dates.$A$1:$dates.$A$1048576];0);MATCH("slot_"&LEFT([.GK$1];3)&"_tracker_id";[$dates.$A$1:$dates.$AMJ$1];0);1);[$trackers.$A$1:$trackers.$A$1048576]);3;1);ROW([.GK2]);[.GK2]) ->  | GL3: of:=IF(IFNA([.$AM2];0)=INDEX([$trackers.$A$1:$trackers.$F$1048576];MATCH(INDEX([$dates.$A$1:$dates.$CU$1048576];MATCH([.$AF3];[$dates.$A$1:$dates.$A$1048576];0);MATCH("slot_"&LEFT([.GL$1];3)&"_tracker_id";[$dates.$A$1:$dates.$AMJ$1];0);1);[$trackers.$A$1:$trackers.$A$1048576]);3;1);ROW([.GL2]);[.GL2]) ->  | GM3: of:=IF(IFNA([.$AM2];0)=INDEX([$trackers.$A$1:$trackers.$F$1048576];MATCH(INDEX([$dates.$A$1:$dates.$CU$1048576];MATCH([.$AF3];[$dates.$A$1:$dates.$A$1048576];0);MATCH("slot_"&LEFT([.GM$1];3)&"_tracker_id";[$dates.$A$1:$dates.$AMJ$1];0);1);[$trackers.$A$1:$trackers.$A$1048576]);3;1);ROW([.GM2]);[.GM2]) ->  | GN3: of:=IF(IFNA([.$AM2];0)=INDEX([$trackers.$A$1:$trackers.$F$1048576];MATCH(INDEX([$dates.$A$1:$dates.$CU$1048576];MATCH([.$AF3];[$dates.$A$1:$dates.$A$1048576];0);MATCH("slot_"&LEFT([.GN$1];3)&"_tracker_id";[$dates.$A$1:$dates.$AMJ$1];0);1);[$trackers.$A$1:$trackers.$A$1048576]);3;1);ROW([.GN2]);[.GN2]) ->  | GO3: of:=IF(IFNA([.$AM2];0)=INDEX([$trackers.$A$1:$trackers.$F$1048576];MATCH(INDEX([$dates.$A$1:$dates.$CU$1048576];MATCH([.$AF3];[$dates.$A$1:$dates.$A$1048576];0);MATCH("slot_"&LEFT([.GO$1];3)&"_tracker_id";[$dates.$A$1:$dates.$AMJ$1];0);1);[$trackers.$A$1:$trackers.$A$1048576]);3;1);ROW([.GO2]);[.GO2]) ->  | GP3: of:=IF(IFNA([.$AM2];0)=INDEX([$trackers.$A$1:$trackers.$F$1048576];MATCH(INDEX([$dates.$A$1:$dates.$CU$1048576];MATCH([.$AF3];[$dates.$A$1:$dates.$A$1048576];0);MATCH("slot_"&LEFT([.GP$1];3)&"_tracker_id";[$dates.$A$1:$dates.$AMJ$1];0);1);[$trackers.$A$1:$trackers.$A$1048576]);3;1);ROW([.GP2]);[.GP2]) ->  | GQ3: of:=IF(IFNA([.$AM2];0)=INDEX([$trackers.$A$1:$trackers.$F$1048576];MATCH(INDEX([$dates.$A$1:$dates.$CU$1048576];MATCH([.$AF3];[$dates.$A$1:$dates.$A$1048576];0);MATCH("slot_"&LEFT([.GQ$1];3)&"_tracker_id";[$dates.$A$1:$dates.$AMJ$1];0);1);[$trackers.$A$1:$trackers.$A$1048576]);3;1);ROW([.GQ2]);[.GQ2]) ->  | GR3: of:=IF(IFNA([.$AM2];0)=INDEX([$trackers.$A$1:$trackers.$F$1048576];MATCH(INDEX([$dates.$A$1:$dates.$CU$1048576];MATCH([.$AF3];[$dates.$A$1:$dates.$A$1048576];0);MATCH("slot_"&LEFT([.GR$1];3)&"_tracker_id";[$dates.$A$1:$dates.$AMJ$1];0);1);[$trackers.$A$1:$trackers.$A$1048576]);3;1);ROW([.GR2]);[.GR2]) ->  | GS3: of:=IF(IFNA([.$AM2];0)=INDEX([$trackers.$A$1:$trackers.$F$1048576];MATCH(INDEX([$dates.$A$1:$dates.$CU$1048576];MATCH([.$AF3];[$dates.$A$1:$dates.$A$1048576];0);MATCH("slot_"&LEFT([.GS$1];3)&"_tracker_id";[$dates.$A$1:$dates.$AMJ$1];0);1);[$trackers.$A$1:$trackers.$A$1048576]);3;1);ROW([.GS2]);[.GS2]) ->  | GT3: of:=IF(IFNA([.$AM2];0)=INDEX([$trackers.$A$1:$trackers.$F$1048576];MATCH(INDEX([$dates.$A$1:$dates.$CU$1048576];MATCH([.$AF3];[$dates.$A$1:$dates.$A$1048576];0);MATCH("slot_"&LEFT([.GT$1];3)&"_tracker_id";[$dates.$A$1:$dates.$AMJ$1];0);1);[$trackers.$A$1:$trackers.$A$1048576]);3;1);ROW([.GT2]);[.GT2]) ->  | GU3: of:=IF(IFNA([.$AM2];0)=INDEX([$trackers.$A$1:$trackers.$F$1048576];MATCH(INDEX([$dates.$A$1:$dates.$CU$1048576];MATCH([.$AF3];[$dates.$A$1:$dates.$A$1048576];0);MATCH("slot_"&LEFT([.GU$1];3)&"_tracker_id";[$dates.$A$1:$dates.$AMJ$1];0);1);[$trackers.$A$1:$trackers.$A$1048576]);3;1);ROW([.GU2]);[.GU2]) ->  | GV3: of:=IF(IFNA([.$AM2];0)=INDEX([$trackers.$A$1:$trackers.$F$1048576];MATCH(INDEX([$dates.$A$1:$dates.$CU$1048576];MATCH([.$AF3];[$dates.$A$1:$dates.$A$1048576];0);MATCH("slot_"&LEFT([.GV$1];3)&"_tracker_id";[$dates.$A$1:$dates.$AMJ$1];0);1);[$trackers.$A$1:$trackers.$A$1048576]);3;1);ROW([.GV2]);[.GV2]) ->  | GW3: of:=IF(IFNA([.$AM2];0)=INDEX([$trackers.$A$1:$trackers.$F$1048576];MATCH(INDEX([$dates.$A$1:$dates.$CU$1048576];MATCH([.$AF3];[$dates.$A$1:$dates.$A$1048576];0);MATCH("slot_"&LEFT([.GW$1];3)&"_tracker_id";[$dates.$A$1:$dates.$AMJ$1];0);1);[$trackers.$A$1:$trackers.$A$1048576]);3;1);ROW([.GW2]);[.GW2]) ->  | GX3: of:=IF(IFNA([.$AM2];0)=INDEX([$trackers.$A$1:$trackers.$F$1048576];MATCH(INDEX([$dates.$A$1:$dates.$CU$1048576];MATCH([.$AF3];[$dates.$A$1:$dates.$A$1048576];0);MATCH("slot_"&LEFT([.GX$1];3)&"_tracker_id";[$dates.$A$1:$dates.$AMJ$1];0);1);[$trackers.$A$1:$trackers.$A$1048576]);3;1);ROW([.GX2]);[.GX2]) ->  | GY3: of:=IF(IFNA([.$AM2];0)=INDEX([$trackers.$A$1:$trackers.$F$1048576];MATCH(INDEX([$dates.$A$1:$dates.$CU$1048576];MATCH([.$AF3];[$dates.$A$1:$dates.$A$1048576];0);MATCH("slot_"&LEFT([.GY$1];3)&"_tracker_id";[$dates.$A$1:$dates.$AMJ$1];0);1);[$trackers.$A$1:$trackers.$A$1048576]);3;1);ROW([.GY2]);[.GY2]) ->  | GZ3: of:=IF(IFNA([.$AM2];0)=INDEX([$trackers.$A$1:$trackers.$F$1048576];MATCH(INDEX([$dates.$A$1:$dates.$CU$1048576];MATCH([.$AF3];[$dates.$A$1:$dates.$A$1048576];0);MATCH("slot_"&LEFT([.GZ$1];3)&"_tracker_id";[$dates.$A$1:$dates.$AMJ$1];0);1);[$trackers.$A$1:$trackers.$A$1048576]);3;1);ROW([.GZ2]);[.GZ2]) ->  | HA3: of:=IF(IFNA([.$AM2];0)=INDEX([$trackers.$A$1:$trackers.$F$1048576];MATCH(INDEX([$dates.$A$1:$dates.$CU$1048576];MATCH([.$AF3];[$dates.$A$1:$dates.$A$1048576];0);MATCH("slot_"&LEFT([.HA$1];3)&"_tracker_id";[$dates.$A$1:$dates.$AMJ$1];0);1);[$trackers.$A$1:$trackers.$A$1048576]);3;1);ROW([.HA2]);[.HA2]) ->  | HB3: of:=IF(IFNA([.$AM2];0)=INDEX([$trackers.$A$1:$trackers.$F$1048576];MATCH(INDEX([$dates.$A$1:$dates.$CU$1048576];MATCH([.$AF3];[$dates.$A$1:$dates.$A$1048576];0);MATCH("slot_"&LEFT([.HB$1];3)&"_tracker_id";[$dates.$A$1:$dates.$AMJ$1];0);1);[$trackers.$A$1:$trackers.$A$1048576]);3;1);ROW([.HB2]);[.HB2]) ->  | HC3: of:=IF(IFNA([.$AM2];0)=INDEX([$trackers.$A$1:$trackers.$F$1048576];MATCH(INDEX([$dates.$A$1:$dates.$CU$1048576];MATCH([.$AF3];[$dates.$A$1:$dates.$A$1048576];0);MATCH("slot_"&LEFT([.HC$1];3)&"_tracker_id";[$dates.$A$1:$dates.$AMJ$1];0);1);[$trackers.$A$1:$trackers.$A$1048576]);3;1);ROW([.HC2]);[.HC2]) -> 

Sheet: slot_reference
A1: date: | B1: 2020-06-26
A2: first_row_after_date | B2: of:=MATCH([.$B$1]+1;[$log.A$1:$log.A$1048576];0) -> 3
A4: slot | B4: tracker_id | C4: tracker_ref | D4: movement_id | E4: movement_ref | F4: first_stage_id | G4: progression_ref | H4: last_in_result | I4: next_prebrief | J4: last_mvmt_next_steps | K4: last_stg_next_steps | L4: n_fails | M4: target | N4: slot_last_row | O4: last_tracker | P4: tracker_continues | Q4: at_stage | R4: mvmt_last_row | S4: last_mvmt | T4: mvmt_continues
A5: 101 | B5: of:=INDEX([$dates.$A$1:$dates.$CU$1048576];MATCH([.$B$1];[$dates.$A$1:$dates.$A$1048576];0);MATCH("slot_"&[.A5]&"_tracker_id";[$dates.$A$1:$dates.$AMJ$1];0);1) -> 1001 | C5: of:=INDEX([$trackers.B$1:$trackers.B$1048576];MATCH([.$B5];[$trackers.$A$1:$trackers.$A$1048576];0);1;1) -> back squat SL | D5: of:=INDEX([$trackers.C$1:$trackers.C$1048576];MATCH([.$B5];[$trackers.$A$1:$trackers.$A$1048576];0);1;1) -> 1001 | E5: of:=INDEX([$trackers.D$1:$trackers.D$1048576];MATCH([.$B5];[$trackers.$A$1:$trackers.$A$1048576];0);1;1) -> back squat (non-microloadable), WAS bar | F5: of:=INDEX([$trackers.E$1:$trackers.E$1048576];MATCH([.$B5];[$trackers.$A$1:$trackers.$A$1048576];0);1;1) -> 1001 | G5: of:=INDEX([$trackers.F$1:$trackers.F$1048576];MATCH([.$B5];[$trackers.$A$1:$trackers.$A$1048576];0);1;1) -> SL 3x5 non-DL | H5: of:=IF([.$P5];INDEX([$log.EQ$1:$log.EQ$1048576];[.$N5];1;1);0) -> 0 | I5: of:=IF([.J5]=0;"";"movement notes:"&CHAR(10)&TRIM([.J5]))&IF([.K5]=0;"";CHAR(10)&CHAR(10)&"progression stage notes:"&CHAR(10)&TRIM([.K5])) ->  | J5: of:=IF([.$T5];INDEX([$log.H$1:$log.H$1048576];[.$R5];1;1);0) -> 0 | K5: of:=IF([.$P5];INDEX([$log.I$1:$log.I$1048576];[.$N5];1;1);0) -> 0 | L5: of:=IF([.P5];INDEX([$log.EO$1:$log.EO$1048576];[.$N5];1;1);0) -> 1 | M5: of:=IF([.$P5];INDEX([$log.Z$1:$log.Z$1048576];[.$N5];1;1);0) -> 0 | N5: of:=INDEX(INDIRECT("$log."&[.$B$2]&":$log."&[.$B$2]);1;MATCH([.$A5]&"_last_row";[$log.$A$1:$log.$AMJ$1];0);1) -> 2 | O5: of:=IF(ISNUMBER([.N5]);INDEX([$log.AK$1:$log.AK$1048576];[.$N5];1;1);0) -> 1001 | P5: of:=[.O5]=[.B5] -> true | Q5: of:=IF([.P5];INDEX([$log.ER$1:$log.ER$1048576];[.$N5];1;1);[.F5]) -> 1001 | R5: of:=INDEX(INDIRECT("$log."&[.$B$2]&":$log."&[.$B$2]);1;MATCH([.$A5]&"_mvmt_last_row";[$log.$A$1:$log.$AMJ$1];0);1) -> 2 | S5: of:=IF(ISNUMBER([.R5]);INDEX([$log.AM$1:$log.AM$1048576];[.$R5];1;1);0) -> 1001 | T5: of:=[.S5]=[.D5] -> true
A6: 102 | B6: of:=INDEX([$dates.$A$1:$dates.$CU$1048576];MATCH([.$B$1];[$dates.$A$1:$dates.$A$1048576];0);MATCH("slot_"&[.A6]&"_tracker_id";[$dates.$A$1:$dates.$AMJ$1];0);1) -> 1002 | C6: of:=INDEX([$trackers.B$1:$trackers.B$1048576];MATCH([.$B6];[$trackers.$A$1:$trackers.$A$1048576];0);1;1) -> bench SL | D6: of:=INDEX([$trackers.C$1:$trackers.C$1048576];MATCH([.$B6];[$trackers.$A$1:$trackers.$A$1048576];0);1;1) -> 1002 | E6: of:=INDEX([$trackers.D$1:$trackers.D$1048576];MATCH([.$B6];[$trackers.$A$1:$trackers.$A$1048576];0);1;1) -> bench (non-microloadable), WAS bar | F6: of:=INDEX([$trackers.E$1:$trackers.E$1048576];MATCH([.$B6];[$trackers.$A$1:$trackers.$A$1048576];0);1;1) -> 1001 | G6: of:=INDEX([$trackers.F$1:$trackers.F$1048576];MATCH([.$B6];[$trackers.$A$1:$trackers.$A$1048576];0);1;1) -> SL 3x5 non-DL | H6: of:=IF([.$P6];INDEX([$log.EQ$1:$log.EQ$1048576];[.$N6];1;1);0) -> 0 | I6: of:=IF([.J6]=0;"";"movement notes:"&CHAR(10)&TRIM([.J6]))&IF([.K6]=0;"";CHAR(10)&CHAR(10)&"progression stage notes:"&CHAR(10)&TRIM([.K6])) ->  | J6: of:=IF([.$T6];INDEX([$log.H$1:$log.H$1048576];[.$R6];1;1);0) -> 0 | K6: of:=IF([.$P6];INDEX([$log.I$1:$log.I$1048576];[.$N6];1;1);0) -> 0 | L6: of:=IF([.P6];INDEX([$log.EO$1:$log.EO$1048576];[.$N6];1;1);0) -> 0 | M6: of:=IF([.$P6];INDEX([$log.Z$1:$log.Z$1048576];[.$N6];1;1);0) -> 0 | N6: of:=INDEX(INDIRECT("$log."&[.$B$2]&":$log."&[.$B$2]);1;MATCH([.$A6]&"_last_row";[$log.$A$1:$log.$AMJ$1];0);1) -> 102_last_row | O6: of:=IF(ISNUMBER([.N6]);INDEX([$log.AK$1:$log.AK$1048576];[.$N6];1;1);0) -> 0 | P6: of:=[.O6]=[.B6] -> false | Q6: of:=IF([.P6];INDEX([$log.ER$1:$log.ER$1048576];[.$N6];1;1);[.F6]) -> 1001 | R6: of:=INDEX(INDIRECT("$log."&[.$B$2]&":$log."&[.$B$2]);1;MATCH([.$A6]&"_mvmt_last_row";[$log.$A$1:$log.$AMJ$1];0);1) -> 102_mvmt_last_row | S6: of:=IF(ISNUMBER([.R6]);INDEX([$log.AM$1:$log.AM$1048576];[.$R6];1;1);0) -> 0 | T6: of:=[.S6]=[.D6] -> false
A7: 103 | B7: of:=INDEX([$dates.$A$1:$dates.$CU$1048576];MATCH([.$B$1];[$dates.$A$1:$dates.$A$1048576];0);MATCH("slot_"&[.A7]&"_tracker_id";[$dates.$A$1:$dates.$AMJ$1];0);1) -> 0 | C7: of:=INDEX([$trackers.B$1:$trackers.B$1048576];MATCH([.$B7];[$trackers.$A$1:$trackers.$A$1048576];0);1;1) ->  | D7: of:=INDEX([$trackers.C$1:$trackers.C$1048576];MATCH([.$B7];[$trackers.$A$1:$trackers.$A$1048576];0);1;1) ->  | E7: of:=INDEX([$trackers.D$1:$trackers.D$1048576];MATCH([.$B7];[$trackers.$A$1:$trackers.$A$1048576];0);1;1) ->  | F7: of:=INDEX([$trackers.E$1:$trackers.E$1048576];MATCH([.$B7];[$trackers.$A$1:$trackers.$A$1048576];0);1;1) ->  | G7: of:=INDEX([$trackers.F$1:$trackers.F$1048576];MATCH([.$B7];[$trackers.$A$1:$trackers.$A$1048576];0);1;1) ->  | H7: of:=IF([.$P7];INDEX([$log.EQ$1:$log.EQ$1048576];[.$N7];1;1);0) ->  | I7: of:=IF([.J7]=0;"";"movement notes:"&CHAR(10)&TRIM([.J7]))&IF([.K7]=0;"";CHAR(10)&CHAR(10)&"progression stage notes:"&CHAR(10)&TRIM([.K7])) ->  | J7: of:=IF([.$T7];INDEX([$log.H$1:$log.H$1048576];[.$R7];1;1);0) ->  | K7: of:=IF([.$P7];INDEX([$log.I$1:$log.I$1048576];[.$N7];1;1);0) ->  | L7: of:=IF([.P7];INDEX([$log.EO$1:$log.EO$1048576];[.$N7];1;1);0) ->  | M7: of:=IF([.$P7];INDEX([$log.Z$1:$log.Z$1048576];[.$N7];1;1);0) ->  | N7: of:=INDEX(INDIRECT("$log."&[.$B$2]&":$log."&[.$B$2]);1;MATCH([.$A7]&"_last_row";[$log.$A$1:$log.$AMJ$1];0);1) -> 103_last_row | O7: of:=IF(ISNUMBER([.N7]);INDEX([$log.AK$1:$log.AK$1048576];[.$N7];1;1);0) -> 0 | P7: of:=[.O7]=[.B7] -> true | Q7: of:=IF([.P7];INDEX([$log.ER$1:$log.ER$1048576];[.$N7];1;1);[.F7]) ->  | R7: of:=INDEX(INDIRECT("$log."&[.$B$2]&":$log."&[.$B$2]);1;MATCH([.$A7]&"_mvmt_last_row";[$log.$A$1:$log.$AMJ$1];0);1) ->  | S7: of:=IF(ISNUMBER([.R7]);INDEX([$log.AM$1:$log.AM$1048576];[.$R7];1;1);0) -> 0 | T7: of:=[.S7]=[.D7] -> 
A8: 104 | B8: of:=INDEX([$dates.$A$1:$dates.$CU$1048576];MATCH([.$B$1];[$dates.$A$1:$dates.$A$1048576];0);MATCH("slot_"&[.A8]&"_tracker_id";[$dates.$A$1:$dates.$AMJ$1];0);1) -> 0 | C8: of:=INDEX([$trackers.B$1:$trackers.B$1048576];MATCH([.$B8];[$trackers.$A$1:$trackers.$A$1048576];0);1;1) ->  | D8: of:=INDEX([$trackers.C$1:$trackers.C$1048576];MATCH([.$B8];[$trackers.$A$1:$trackers.$A$1048576];0);1;1) ->  | E8: of:=INDEX([$trackers.D$1:$trackers.D$1048576];MATCH([.$B8];[$trackers.$A$1:$trackers.$A$1048576];0);1;1) ->  | F8: of:=INDEX([$trackers.E$1:$trackers.E$1048576];MATCH([.$B8];[$trackers.$A$1:$trackers.$A$1048576];0);1;1) ->  | G8: of:=INDEX([$trackers.F$1:$trackers.F$1048576];MATCH([.$B8];[$trackers.$A$1:$trackers.$A$1048576];0);1;1) ->  | H8: of:=IF([.$P8];INDEX([$log.EQ$1:$log.EQ$1048576];[.$N8];1;1);0) ->  | I8: of:=IF([.J8]=0;"";"movement notes:"&CHAR(10)&TRIM([.J8]))&IF([.K8]=0;"";CHAR(10)&CHAR(10)&"progression stage notes:"&CHAR(10)&TRIM([.K8])) ->  | J8: of:=IF([.$T8];INDEX([$log.H$1:$log.H$1048576];[.$R8];1;1);0) ->  | K8: of:=IF([.$P8];INDEX([$log.I$1:$log.I$1048576];[.$N8];1;1);0) ->  | L8: of:=IF([.P8];INDEX([$log.EO$1:$log.EO$1048576];[.$N8];1;1);0) ->  | M8: of:=IF([.$P8];INDEX([$log.Z$1:$log.Z$1048576];[.$N8];1;1);0) ->  | N8: of:=INDEX(INDIRECT("$log."&[.$B$2]&":$log."&[.$B$2]);1;MATCH([.$A8]&"_last_row";[$log.$A$1:$log.$AMJ$1];0);1) -> 104_last_row | O8: of:=IF(ISNUMBER([.N8]);INDEX([$log.AK$1:$log.AK$1048576];[.$N8];1;1);0) -> 0 | P8: of:=[.O8]=[.B8] -> true | Q8: of:=IF([.P8];INDEX([$log.ER$1:$log.ER$1048576];[.$N8];1;1);[.F8]) ->  | R8: of:=INDEX(INDIRECT("$log."&[.$B$2]&":$log."&[.$B$2]);1;MATCH([.$A8]&"_mvmt_last_row";[$log.$A$1:$log.$AMJ$1];0);1) ->  | S8: of:=IF(ISNUMBER([.R8]);INDEX([$log.AM$1:$log.AM$1048576];[.$R8];1;1);0) -> 0 | T8: of:=[.S8]=[.D8] -> 
A9: 105 | B9: of:=INDEX([$dates.$A$1:$dates.$CU$1048576];MATCH([.$B$1];[$dates.$A$1:$dates.$A$1048576];0);MATCH("slot_"&[.A9]&"_tracker_id";[$dates.$A$1:$dates.$AMJ$1];0);1) -> 0 | C9: of:=INDEX([$trackers.B$1:$trackers.B$1048576];MATCH([.$B9];[$trackers.$A$1:$trackers.$A$1048576];0);1;1) ->  | D9: of:=INDEX([$trackers.C$1:$trackers.C$1048576];MATCH([.$B9];[$trackers.$A$1:$trackers.$A$1048576];0);1;1) ->  | E9: of:=INDEX([$trackers.D$1:$trackers.D$1048576];MATCH([.$B9];[$trackers.$A$1:$trackers.$A$1048576];0);1;1) ->  | F9: of:=INDEX([$trackers.E$1:$trackers.E$1048576];MATCH([.$B9];[$trackers.$A$1:$trackers.$A$1048576];0);1;1) ->  | G9: of:=INDEX([$trackers.F$1:$trackers.F$1048576];MATCH([.$B9];[$trackers.$A$1:$trackers.$A$1048576];0);1;1) ->  | H9: of:=IF([.$P9];INDEX([$log.EQ$1:$log.EQ$1048576];[.$N9];1;1);0) ->  | I9: of:=IF([.J9]=0;"";"movement notes:"&CHAR(10)&TRIM([.J9]))&IF([.K9]=0;"";CHAR(10)&CHAR(10)&"progression stage notes:"&CHAR(10)&TRIM([.K9])) ->  | J9: of:=IF([.$T9];INDEX([$log.H$1:$log.H$1048576];[.$R9];1;1);0) ->  | K9: of:=IF([.$P9];INDEX([$log.I$1:$log.I$1048576];[.$N9];1;1);0) ->  | L9: of:=IF([.P9];INDEX([$log.EO$1:$log.EO$1048576];[.$N9];1;1);0) ->  | M9: of:=IF([.$P9];INDEX([$log.Z$1:$log.Z$1048576];[.$N9];1;1);0) ->  | N9: of:=INDEX(INDIRECT("$log."&[.$B$2]&":$log."&[.$B$2]);1;MATCH([.$A9]&"_last_row";[$log.$A$1:$log.$AMJ$1];0);1) -> 105_last_row | O9: of:=IF(ISNUMBER([.N9]);INDEX([$log.AK$1:$log.AK$1048576];[.$N9];1;1);0) -> 0 | P9: of:=[.O9]=[.B9] -> true | Q9: of:=IF([.P9];INDEX([$log.ER$1:$log.ER$1048576];[.$N9];1;1);[.F9]) ->  | R9: of:=INDEX(INDIRECT("$log."&[.$B$2]&":$log."&[.$B$2]);1;MATCH([.$A9]&"_mvmt_last_row";[$log.$A$1:$log.$AMJ$1];0);1) ->  | S9: of:=IF(ISNUMBER([.R9]);INDEX([$log.AM$1:$log.AM$1048576];[.$R9];1;1);0) -> 0 | T9: of:=[.S9]=[.D9] -> 
A10: 106 | B10: of:=INDEX([$dates.$A$1:$dates.$CU$1048576];MATCH([.$B$1];[$dates.$A$1:$dates.$A$1048576];0);MATCH("slot_"&[.A10]&"_tracker_id";[$dates.$A$1:$dates.$AMJ$1];0);1) -> 0 | C10: of:=INDEX([$trackers.B$1:$trackers.B$1048576];MATCH([.$B10];[$trackers.$A$1:$trackers.$A$1048576];0);1;1) ->  | D10: of:=INDEX([$trackers.C$1:$trackers.C$1048576];MATCH([.$B10];[$trackers.$A$1:$trackers.$A$1048576];0);1;1) ->  | E10: of:=INDEX([$trackers.D$1:$trackers.D$1048576];MATCH([.$B10];[$trackers.$A$1:$trackers.$A$1048576];0);1;1) ->  | F10: of:=INDEX([$trackers.E$1:$trackers.E$1048576];MATCH([.$B10];[$trackers.$A$1:$trackers.$A$1048576];0);1;1) ->  | G10: of:=INDEX([$trackers.F$1:$trackers.F$1048576];MATCH([.$B10];[$trackers.$A$1:$trackers.$A$1048576];0);1;1) ->  | H10: of:=IF([.$P10];INDEX([$log.EQ$1:$log.EQ$1048576];[.$N10];1;1);0) ->  | I10: of:=IF([.J10]=0;"";"movement notes:"&CHAR(10)&TRIM([.J10]))&IF([.K10]=0;"";CHAR(10)&CHAR(10)&"progression stage notes:"&CHAR(10)&TRIM([.K10])) ->  | J10: of:=IF([.$T10];INDEX([$log.H$1:$log.H$1048576];[.$R10];1;1);0) ->  | K10: of:=IF([.$P10];INDEX([$log.I$1:$log.I$1048576];[.$N10];1;1);0) ->  | L10: of:=IF([.P10];INDEX([$log.EO$1:$log.EO$1048576];[.$N10];1;1);0) ->  | M10: of:=IF([.$P10];INDEX([$log.Z$1:$log.Z$1048576];[.$N10];1;1);0) ->  | N10: of:=INDEX(INDIRECT("$log."&[.$B$2]&":$log."&[.$B$2]);1;MATCH([.$A10]&"_last_row";[$log.$A$1:$log.$AMJ$1];0);1) -> 106_last_row | O10: of:=IF(ISNUMBER([.N10]);INDEX([$log.AK$1:$log.AK$1048576];[.$N10];1;1);0) -> 0 | P10: of:=[.O10]=[.B10] -> true | Q10: of:=IF([.P10];INDEX([$log.ER$1:$log.ER$1048576];[.$N10];1;1);[.F10]) ->  | R10: of:=INDEX(INDIRECT("$log."&[.$B$2]&":$log."&[.$B$2]);1;MATCH([.$A10]&"_mvmt_last_row";[$log.$A$1:$log.$AMJ$1];0);1) ->  | S10: of:=IF(ISNUMBER([.R10]);INDEX([$log.AM$1:$log.AM$1048576];[.$R10];1;1);0) -> 0 | T10: of:=[.S10]=[.D10] -> 
A11: 107 | B11: of:=INDEX([$dates.$A$1:$dates.$CU$1048576];MATCH([.$B$1];[$dates.$A$1:$dates.$A$1048576];0);MATCH("slot_"&[.A11]&"_tracker_id";[$dates.$A$1:$dates.$AMJ$1];0);1) -> 0 | C11: of:=INDEX([$trackers.B$1:$trackers.B$1048576];MATCH([.$B11];[$trackers.$A$1:$trackers.$A$1048576];0);1;1) ->  | D11: of:=INDEX([$trackers.C$1:$trackers.C$1048576];MATCH([.$B11];[$trackers.$A$1:$trackers.$A$1048576];0);1;1) ->  | E11: of:=INDEX([$trackers.D$1:$trackers.D$1048576];MATCH([.$B11];[$trackers.$A$1:$trackers.$A$1048576];0);1;1) ->  | F11: of:=INDEX([$trackers.E$1:$trackers.E$1048576];MATCH([.$B11];[$trackers.$A$1:$trackers.$A$1048576];0);1;1) ->  | G11: of:=INDEX([$trackers.F$1:$trackers.F$1048576];MATCH([.$B11];[$trackers.$A$1:$trackers.$A$1048576];0);1;1) ->  | H11: of:=IF([.$P11];INDEX([$log.EQ$1:$log.EQ$1048576];[.$N11];1;1);0) ->  | I11: of:=IF([.J11]=0;"";"movement notes:"&CHAR(10)&TRIM([.J11]))&IF([.K11]=0;"";CHAR(10)&CHAR(10)&"progression stage notes:"&CHAR(10)&TRIM([.K11])) ->  | J11: of:=IF([.$T11];INDEX([$log.H$1:$log.H$1048576];[.$R11];1;1);0) ->  | K11: of:=IF([.$P11];INDEX([$log.I$1:$log.I$1048576];[.$N11];1;1);0) ->  | L11: of:=IF([.P11];INDEX([$log.EO$1:$log.EO$1048576];[.$N11];1;1);0) ->  | M11: of:=IF([.$P11];INDEX([$log.Z$1:$log.Z$1048576];[.$N11];1;1);0) ->  | N11: of:=INDEX(INDIRECT("$log."&[.$B$2]&":$log."&[.$B$2]);1;MATCH([.$A11]&"_last_row";[$log.$A$1:$log.$AMJ$1];0);1) -> 107_last_row | O11: of:=IF(ISNUMBER([.N11]);INDEX([$log.AK$1:$log.AK$1048576];[.$N11];1;1);0) -> 0 | P11: of:=[.O11]=[.B11] -> true | Q11: of:=IF([.P11];INDEX([$log.ER$1:$log.ER$1048576];[.$N11];1;1);[.F11]) ->  | R11: of:=INDEX(INDIRECT("$log."&[.$B$2]&":$log."&[.$B$2]);1;MATCH([.$A11]&"_mvmt_last_row";[$log.$A$1:$log.$AMJ$1];0);1) ->  | S11: of:=IF(ISNUMBER([.R11]);INDEX([$log.AM$1:$log.AM$1048576];[.$R11];1;1);0) -> 0 | T11: of:=[.S11]=[.D11] -> 
A12: 108 | B12: of:=INDEX([$dates.$A$1:$dates.$CU$1048576];MATCH([.$B$1];[$dates.$A$1:$dates.$A$1048576];0);MATCH("slot_"&[.A12]&"_tracker_id";[$dates.$A$1:$dates.$AMJ$1];0);1) -> 0 | C12: of:=INDEX([$trackers.B$1:$trackers.B$1048576];MATCH([.$B12];[$trackers.$A$1:$trackers.$A$1048576];0);1;1) ->  | D12: of:=INDEX([$trackers.C$1:$trackers.C$1048576];MATCH([.$B12];[$trackers.$A$1:$trackers.$A$1048576];0);1;1) ->  | E12: of:=INDEX([$trackers.D$1:$trackers.D$1048576];MATCH([.$B12];[$trackers.$A$1:$trackers.$A$1048576];0);1;1) ->  | F12: of:=INDEX([$trackers.E$1:$trackers.E$1048576];MATCH([.$B12];[$trackers.$A$1:$trackers.$A$1048576];0);1;1) ->  | G12: of:=INDEX([$trackers.F$1:$trackers.F$1048576];MATCH([.$B12];[$trackers.$A$1:$trackers.$A$1048576];0);1;1) ->  | H12: of:=IF([.$P12];INDEX([$log.EQ$1:$log.EQ$1048576];[.$N12];1;1);0) ->  | I12: of:=IF([.J12]=0;"";"movement notes:"&CHAR(10)&TRIM([.J12]))&IF([.K12]=0;"";CHAR(10)&CHAR(10)&"progression stage notes:"&CHAR(10)&TRIM([.K12])) ->  | J12: of:=IF([.$T12];INDEX([$log.H$1:$log.H$1048576];[.$R12];1;1);0) ->  | K12: of:=IF([.$P12];INDEX([$log.I$1:$log.I$1048576];[.$N12];1;1);0) ->  | L12: of:=IF([.P12];INDEX([$log.EO$1:$log.EO$1048576];[.$N12];1;1);0) ->  | M12: of:=IF([.$P12];INDEX([$log.Z$1:$log.Z$1048576];[.$N12];1;1);0) ->  | N12: of:=INDEX(INDIRECT("$log."&[.$B$2]&":$log."&[.$B$2]);1;MATCH([.$A12]&"_last_row";[$log.$A$1:$log.$AMJ$1];0);1) -> 108_last_row | O12: of:=IF(ISNUMBER([.N12]);INDEX([$log.AK$1:$log.AK$1048576];[.$N12];1;1);0) -> 0 | P12: of:=[.O12]=[.B12] -> true | Q12: of:=IF([.P12];INDEX([$log.ER$1:$log.ER$1048576];[.$N12];1;1);[.F12]) ->  | R12: of:=INDEX(INDIRECT("$log."&[.$B$2]&":$log."&[.$B$2]);1;MATCH([.$A12]&"_mvmt_last_row";[$log.$A$1:$log.$AMJ$1];0);1) ->  | S12: of:=IF(ISNUMBER([.R12]);INDEX([$log.AM$1:$log.AM$1048576];[.$R12];1;1);0) -> 0 | T12: of:=[.S12]=[.D12] -> 
A13: 109 | B13: of:=INDEX([$dates.$A$1:$dates.$CU$1048576];MATCH([.$B$1];[$dates.$A$1:$dates.$A$1048576];0);MATCH("slot_"&[.A13]&"_tracker_id";[$dates.$A$1:$dates.$AMJ$1];0);1) -> 0 | C13: of:=INDEX([$trackers.B$1:$trackers.B$1048576];MATCH([.$B13];[$trackers.$A$1:$trackers.$A$1048576];0);1;1) ->  | D13: of:=INDEX([$trackers.C$1:$trackers.C$1048576];MATCH([.$B13];[$trackers.$A$1:$trackers.$A$1048576];0);1;1) ->  | E13: of:=INDEX([$trackers.D$1:$trackers.D$1048576];MATCH([.$B13];[$trackers.$A$1:$trackers.$A$1048576];0);1;1) ->  | F13: of:=INDEX([$trackers.E$1:$trackers.E$1048576];MATCH([.$B13];[$trackers.$A$1:$trackers.$A$1048576];0);1;1) ->  | G13: of:=INDEX([$trackers.F$1:$trackers.F$1048576];MATCH([.$B13];[$trackers.$A$1:$trackers.$A$1048576];0);1;1) ->  | H13: of:=IF([.$P13];INDEX([$log.EQ$1:$log.EQ$1048576];[.$N13];1;1);0) ->  | I13: of:=IF([.J13]=0;"";"movement notes:"&CHAR(10)&TRIM([.J13]))&IF([.K13]=0;"";CHAR(10)&CHAR(10)&"progression stage notes:"&CHAR(10)&TRIM([.K13])) ->  | J13: of:=IF([.$T13];INDEX([$log.H$1:$log.H$1048576];[.$R13];1;1);0) ->  | K13: of:=IF([.$P13];INDEX([$log.I$1:$log.I$1048576];[.$N13];1;1);0) ->  | L13: of:=IF([.P13];INDEX([$log.EO$1:$log.EO$1048576];[.$N13];1;1);0) ->  | M13: of:=IF([.$P13];INDEX([$log.Z$1:$log.Z$1048576];[.$N13];1;1);0) ->  | N13: of:=INDEX(INDIRECT("$log."&[.$B$2]&":$log."&[.$B$2]);1;MATCH([.$A13]&"_last_row";[$log.$A$1:$log.$AMJ$1];0);1) -> 109_last_row | O13: of:=IF(ISNUMBER([.N13]);INDEX([$log.AK$1:$log.AK$1048576];[.$N13];1;1);0) -> 0 | P13: of:=[.O13]=[.B13] -> true | Q13: of:=IF([.P13];INDEX([$log.ER$1:$log.ER$1048576];[.$N13];1;1);[.F13]) ->  | R13: of:=INDEX(INDIRECT("$log."&[.$B$2]&":$log."&[.$B$2]);1;MATCH([.$A13]&"_mvmt_last_row";[$log.$A$1:$log.$AMJ$1];0);1) ->  | S13: of:=IF(ISNUMBER([.R13]);INDEX([$log.AM$1:$log.AM$1048576];[.$R13];1;1);0) -> 0 | T13: of:=[.S13]=[.D13] -> 
A14: 110 | B14: of:=INDEX([$dates.$A$1:$dates.$CU$1048576];MATCH([.$B$1];[$dates.$A$1:$dates.$A$1048576];0);MATCH("slot_"&[.A14]&"_tracker_id";[$dates.$A$1:$dates.$AMJ$1];0);1) -> 0 | C14: of:=INDEX([$trackers.B$1:$trackers.B$1048576];MATCH([.$B14];[$trackers.$A$1:$trackers.$A$1048576];0);1;1) ->  | D14: of:=INDEX([$trackers.C$1:$trackers.C$1048576];MATCH([.$B14];[$trackers.$A$1:$trackers.$A$1048576];0);1;1) ->  | E14: of:=INDEX([$trackers.D$1:$trackers.D$1048576];MATCH([.$B14];[$trackers.$A$1:$trackers.$A$1048576];0);1;1) ->  | F14: of:=INDEX([$trackers.E$1:$trackers.E$1048576];MATCH([.$B14];[$trackers.$A$1:$trackers.$A$1048576];0);1;1) ->  | G14: of:=INDEX([$trackers.F$1:$trackers.F$1048576];MATCH([.$B14];[$trackers.$A$1:$trackers.$A$1048576];0);1;1) ->  | H14: of:=IF([.$P14];INDEX([$log.EQ$1:$log.EQ$1048576];[.$N14];1;1);0) ->  | I14: of:=IF([.J14]=0;"";"movement notes:"&CHAR(10)&TRIM([.J14]))&IF([.K14]=0;"";CHAR(10)&CHAR(10)&"progression stage notes:"&CHAR(10)&TRIM([.K14])) ->  | J14: of:=IF([.$T14];INDEX([$log.H$1:$log.H$1048576];[.$R14];1;1);0) ->  | K14: of:=IF([.$P14];INDEX([$log.I$1:$log.I$1048576];[.$N14];1;1);0) ->  | L14: of:=IF([.P14];INDEX([$log.EO$1:$log.EO$1048576];[.$N14];1;1);0) ->  | M14: of:=IF([.$P14];INDEX([$log.Z$1:$log.Z$1048576];[.$N14];1;1);0) ->  | N14: of:=INDEX(INDIRECT("$log."&[.$B$2]&":$log."&[.$B$2]);1;MATCH([.$A14]&"_last_row";[$log.$A$1:$log.$AMJ$1];0);1) -> 110_last_row | O14: of:=IF(ISNUMBER([.N14]);INDEX([$log.AK$1:$log.AK$1048576];[.$N14];1;1);0) -> 0 | P14: of:=[.O14]=[.B14] -> true | Q14: of:=IF([.P14];INDEX([$log.ER$1:$log.ER$1048576];[.$N14];1;1);[.F14]) ->  | R14: of:=INDEX(INDIRECT("$log."&[.$B$2]&":$log."&[.$B$2]);1;MATCH([.$A14]&"_mvmt_last_row";[$log.$A$1:$log.$AMJ$1];0);1) ->  | S14: of:=IF(ISNUMBER([.R14]);INDEX([$log.AM$1:$log.AM$1048576];[.$R14];1;1);0) -> 0 | T14: of:=[.S14]=[.D14] -> 
A15: 111 | B15: of:=INDEX([$dates.$A$1:$dates.$CU$1048576];MATCH([.$B$1];[$dates.$A$1:$dates.$A$1048576];0);MATCH("slot_"&[.A15]&"_tracker_id";[$dates.$A$1:$dates.$AMJ$1];0);1) -> 0 | C15: of:=INDEX([$trackers.B$1:$trackers.B$1048576];MATCH([.$B15];[$trackers.$A$1:$trackers.$A$1048576];0);1;1) ->  | D15: of:=INDEX([$trackers.C$1:$trackers.C$1048576];MATCH([.$B15];[$trackers.$A$1:$trackers.$A$1048576];0);1;1) ->  | E15: of:=INDEX([$trackers.D$1:$trackers.D$1048576];MATCH([.$B15];[$trackers.$A$1:$trackers.$A$1048576];0);1;1) ->  | F15: of:=INDEX([$trackers.E$1:$trackers.E$1048576];MATCH([.$B15];[$trackers.$A$1:$trackers.$A$1048576];0);1;1) ->  | G15: of:=INDEX([$trackers.F$1:$trackers.F$1048576];MATCH([.$B15];[$trackers.$A$1:$trackers.$A$1048576];0);1;1) ->  | H15: of:=IF([.$P15];INDEX([$log.EQ$1:$log.EQ$1048576];[.$N15];1;1);0) ->  | I15: of:=IF([.J15]=0;"";"movement notes:"&CHAR(10)&TRIM([.J15]))&IF([.K15]=0;"";CHAR(10)&CHAR(10)&"progression stage notes:"&CHAR(10)&TRIM([.K15])) ->  | J15: of:=IF([.$T15];INDEX([$log.H$1:$log.H$1048576];[.$R15];1;1);0) ->  | K15: of:=IF([.$P15];INDEX([$log.I$1:$log.I$1048576];[.$N15];1;1);0) ->  | L15: of:=IF([.P15];INDEX([$log.EO$1:$log.EO$1048576];[.$N15];1;1);0) ->  | M15: of:=IF([.$P15];INDEX([$log.Z$1:$log.Z$1048576];[.$N15];1;1);0) ->  | N15: of:=INDEX(INDIRECT("$log."&[.$B$2]&":$log."&[.$B$2]);1;MATCH([.$A15]&"_last_row";[$log.$A$1:$log.$AMJ$1];0);1) -> 111_last_row | O15: of:=IF(ISNUMBER([.N15]);INDEX([$log.AK$1:$log.AK$1048576];[.$N15];1;1);0) -> 0 | P15: of:=[.O15]=[.B15] -> true | Q15: of:=IF([.P15];INDEX([$log.ER$1:$log.ER$1048576];[.$N15];1;1);[.F15]) ->  | R15: of:=INDEX(INDIRECT("$log."&[.$B$2]&":$log."&[.$B$2]);1;MATCH([.$A15]&"_mvmt_last_row";[$log.$A$1:$log.$AMJ$1];0);1) ->  | S15: of:=IF(ISNUMBER([.R15]);INDEX([$log.AM$1:$log.AM$1048576];[.$R15];1;1);0) -> 0 | T15: of:=[.S15]=[.D15] -> 
A16: 112 | B16: of:=INDEX([$dates.$A$1:$dates.$CU$1048576];MATCH([.$B$1];[$dates.$A$1:$dates.$A$1048576];0);MATCH("slot_"&[.A16]&"_tracker_id";[$dates.$A$1:$dates.$AMJ$1];0);1) -> 0 | C16: of:=INDEX([$trackers.B$1:$trackers.B$1048576];MATCH([.$B16];[$trackers.$A$1:$trackers.$A$1048576];0);1;1) ->  | D16: of:=INDEX([$trackers.C$1:$trackers.C$1048576];MATCH([.$B16];[$trackers.$A$1:$trackers.$A$1048576];0);1;1) ->  | E16: of:=INDEX([$trackers.D$1:$trackers.D$1048576];MATCH([.$B16];[$trackers.$A$1:$trackers.$A$1048576];0);1;1) ->  | F16: of:=INDEX([$trackers.E$1:$trackers.E$1048576];MATCH([.$B16];[$trackers.$A$1:$trackers.$A$1048576];0);1;1) ->  | G16: of:=INDEX([$trackers.F$1:$trackers.F$1048576];MATCH([.$B16];[$trackers.$A$1:$trackers.$A$1048576];0);1;1) ->  | H16: of:=IF([.$P16];INDEX([$log.EQ$1:$log.EQ$1048576];[.$N16];1;1);0) ->  | I16: of:=IF([.J16]=0;"";"movement notes:"&CHAR(10)&TRIM([.J16]))&IF([.K16]=0;"";CHAR(10)&CHAR(10)&"progression stage notes:"&CHAR(10)&TRIM([.K16])) ->  | J16: of:=IF([.$T16];INDEX([$log.H$1:$log.H$1048576];[.$R16];1;1);0) ->  | K16: of:=IF([.$P16];INDEX([$log.I$1:$log.I$1048576];[.$N16];1;1);0) ->  | L16: of:=IF([.P16];INDEX([$log.EO$1:$log.EO$1048576];[.$N16];1;1);0) ->  | M16: of:=IF([.$P16];INDEX([$log.Z$1:$log.Z$1048576];[.$N16];1;1);0) ->  | N16: of:=INDEX(INDIRECT("$log."&[.$B$2]&":$log."&[.$B$2]);1;MATCH([.$A16]&"_last_row";[$log.$A$1:$log.$AMJ$1];0);1) -> 112_last_row | O16: of:=IF(ISNUMBER([.N16]);INDEX([$log.AK$1:$log.AK$1048576];[.$N16];1;1);0) -> 0 | P16: of:=[.O16]=[.B16] -> true | Q16: of:=IF([.P16];INDEX([$log.ER$1:$log.ER$1048576];[.$N16];1;1);[.F16]) ->  | R16: of:=INDEX(INDIRECT("$log."&[.$B$2]&":$log."&[.$B$2]);1;MATCH([.$A16]&"_mvmt_last_row";[$log.$A$1:$log.$AMJ$1];0);1) ->  | S16: of:=IF(ISNUMBER([.R16]);INDEX([$log.AM$1:$log.AM$1048576];[.$R16];1;1);0) -> 0 | T16: of:=[.S16]=[.D16] -> 
A17: 113 | B17: of:=INDEX([$dates.$A$1:$dates.$CU$1048576];MATCH([.$B$1];[$dates.$A$1:$dates.$A$1048576];0);MATCH("slot_"&[.A17]&"_tracker_id";[$dates.$A$1:$dates.$AMJ$1];0);1) -> 0 | C17: of:=INDEX([$trackers.B$1:$trackers.B$1048576];MATCH([.$B17];[$trackers.$A$1:$trackers.$A$1048576];0);1;1) ->  | D17: of:=INDEX([$trackers.C$1:$trackers.C$1048576];MATCH([.$B17];[$trackers.$A$1:$trackers.$A$1048576];0);1;1) ->  | E17: of:=INDEX([$trackers.D$1:$trackers.D$1048576];MATCH([.$B17];[$trackers.$A$1:$trackers.$A$1048576];0);1;1) ->  | F17: of:=INDEX([$trackers.E$1:$trackers.E$1048576];MATCH([.$B17];[$trackers.$A$1:$trackers.$A$1048576];0);1;1) ->  | G17: of:=INDEX([$trackers.F$1:$trackers.F$1048576];MATCH([.$B17];[$trackers.$A$1:$trackers.$A$1048576];0);1;1) ->  | H17: of:=IF([.$P17];INDEX([$log.EQ$1:$log.EQ$1048576];[.$N17];1;1);0) ->  | I17: of:=IF([.J17]=0;"";"movement notes:"&CHAR(10)&TRIM([.J17]))&IF([.K17]=0;"";CHAR(10)&CHAR(10)&"progression stage notes:"&CHAR(10)&TRIM([.K17])) ->  | J17: of:=IF([.$T17];INDEX([$log.H$1:$log.H$1048576];[.$R17];1;1);0) ->  | K17: of:=IF([.$P17];INDEX([$log.I$1:$log.I$1048576];[.$N17];1;1);0) ->  | L17: of:=IF([.P17];INDEX([$log.EO$1:$log.EO$1048576];[.$N17];1;1);0) ->  | M17: of:=IF([.$P17];INDEX([$log.Z$1:$log.Z$1048576];[.$N17];1;1);0) ->  | N17: of:=INDEX(INDIRECT("$log."&[.$B$2]&":$log."&[.$B$2]);1;MATCH([.$A17]&"_last_row";[$log.$A$1:$log.$AMJ$1];0);1) -> 113_last_row | O17: of:=IF(ISNUMBER([.N17]);INDEX([$log.AK$1:$log.AK$1048576];[.$N17];1;1);0) -> 0 | P17: of:=[.O17]=[.B17] -> true | Q17: of:=IF([.P17];INDEX([$log.ER$1:$log.ER$1048576];[.$N17];1;1);[.F17]) ->  | R17: of:=INDEX(INDIRECT("$log."&[.$B$2]&":$log."&[.$B$2]);1;MATCH([.$A17]&"_mvmt_last_row";[$log.$A$1:$log.$AMJ$1];0);1) ->  | S17: of:=IF(ISNUMBER([.R17]);INDEX([$log.AM$1:$log.AM$1048576];[.$R17];1;1);0) -> 0 | T17: of:=[.S17]=[.D17] -> 
A18: 114 | B18: of:=INDEX([$dates.$A$1:$dates.$CU$1048576];MATCH([.$B$1];[$dates.$A$1:$dates.$A$1048576];0);MATCH("slot_"&[.A18]&"_tracker_id";[$dates.$A$1:$dates.$AMJ$1];0);1) -> 0 | C18: of:=INDEX([$trackers.B$1:$trackers.B$1048576];MATCH([.$B18];[$trackers.$A$1:$trackers.$A$1048576];0);1;1) ->  | D18: of:=INDEX([$trackers.C$1:$trackers.C$1048576];MATCH([.$B18];[$trackers.$A$1:$trackers.$A$1048576];0);1;1) ->  | E18: of:=INDEX([$trackers.D$1:$trackers.D$1048576];MATCH([.$B18];[$trackers.$A$1:$trackers.$A$1048576];0);1;1) ->  | F18: of:=INDEX([$trackers.E$1:$trackers.E$1048576];MATCH([.$B18];[$trackers.$A$1:$trackers.$A$1048576];0);1;1) ->  | G18: of:=INDEX([$trackers.F$1:$trackers.F$1048576];MATCH([.$B18];[$trackers.$A$1:$trackers.$A$1048576];0);1;1) ->  | H18: of:=IF([.$P18];INDEX([$log.EQ$1:$log.EQ$1048576];[.$N18];1;1);0) ->  | I18: of:=IF([.J18]=0;"";"movement notes:"&CHAR(10)&TRIM([.J18]))&IF([.K18]=0;"";CHAR(10)&CHAR(10)&"progression stage notes:"&CHAR(10)&TRIM([.K18])) ->  | J18: of:=IF([.$T18];INDEX([$log.H$1:$log.H$1048576];[.$R18];1;1);0) ->  | K18: of:=IF([.$P18];INDEX([$log.I$1:$log.I$1048576];[.$N18];1;1);0) ->  | L18: of:=IF([.P18];INDEX([$log.EO$1:$log.EO$1048576];[.$N18];1;1);0) ->  | M18: of:=IF([.$P18];INDEX([$log.Z$1:$log.Z$1048576];[.$N18];1;1);0) ->  | N18: of:=INDEX(INDIRECT("$log."&[.$B$2]&":$log."&[.$B$2]);1;MATCH([.$A18]&"_last_row";[$log.$A$1:$log.$AMJ$1];0);1) -> 114_last_row | O18: of:=IF(ISNUMBER([.N18]);INDEX([$log.AK$1:$log.AK$1048576];[.$N18];1;1);0) -> 0 | P18: of:=[.O18]=[.B18] -> true | Q18: of:=IF([.P18];INDEX([$log.ER$1:$log.ER$1048576];[.$N18];1;1);[.F18]) ->  | R18: of:=INDEX(INDIRECT("$log."&[.$B$2]&":$log."&[.$B$2]);1;MATCH([.$A18]&"_mvmt_last_row";[$log.$A$1:$log.$AMJ$1];0);1) ->  | S18: of:=IF(ISNUMBER([.R18]);INDEX([$log.AM$1:$log.AM$1048576];[.$R18];1;1);0) -> 0 | T18: of:=[.S18]=[.D18] -> 
A19: 115 | B19: of:=INDEX([$dates.$A$1:$dates.$CU$1048576];MATCH([.$B$1];[$dates.$A$1:$dates.$A$1048576];0);MATCH("slot_"&[.A19]&"_tracker_id";[$dates.$A$1:$dates.$AMJ$1];0);1) -> 0 | C19: of:=INDEX([$trackers.B$1:$trackers.B$1048576];MATCH([.$B19];[$trackers.$A$1:$trackers.$A$1048576];0);1;1) ->  | D19: of:=INDEX([$trackers.C$1:$trackers.C$1048576];MATCH([.$B19];[$trackers.$A$1:$trackers.$A$1048576];0);1;1) ->  | E19: of:=INDEX([$trackers.D$1:$trackers.D$1048576];MATCH([.$B19];[$trackers.$A$1:$trackers.$A$1048576];0);1;1) ->  | F19: of:=INDEX([$trackers.E$1:$trackers.E$1048576];MATCH([.$B19];[$trackers.$A$1:$trackers.$A$1048576];0);1;1) ->  | G19: of:=INDEX([$trackers.F$1:$trackers.F$1048576];MATCH([.$B19];[$trackers.$A$1:$trackers.$A$1048576];0);1;1) ->  | H19: of:=IF([.$P19];INDEX([$log.EQ$1:$log.EQ$1048576];[.$N19];1;1);0) ->  | I19: of:=IF([.J19]=0;"";"movement notes:"&CHAR(10)&TRIM([.J19]))&IF([.K19]=0;"";CHAR(10)&CHAR(10)&"progression stage notes:"&CHAR(10)&TRIM([.K19])) ->  | J19: of:=IF([.$T19];INDEX([$log.H$1:$log.H$1048576];[.$R19];1;1);0) ->  | K19: of:=IF([.$P19];INDEX([$log.I$1:$log.I$1048576];[.$N19];1;1);0) ->  | L19: of:=IF([.P19];INDEX([$log.EO$1:$log.EO$1048576];[.$N19];1;1);0) ->  | M19: of:=IF([.$P19];INDEX([$log.Z$1:$log.Z$1048576];[.$N19];1;1);0) ->  | N19: of:=INDEX(INDIRECT("$log."&[.$B$2]&":$log."&[.$B$2]);1;MATCH([.$A19]&"_last_row";[$log.$A$1:$log.$AMJ$1];0);1) -> 115_last_row | O19: of:=IF(ISNUMBER([.N19]);INDEX([$log.AK$1:$log.AK$1048576];[.$N19];1;1);0) -> 0 | P19: of:=[.O19]=[.B19] -> true | Q19: of:=IF([.P19];INDEX([$log.ER$1:$log.ER$1048576];[.$N19];1;1);[.F19]) ->  | R19: of:=INDEX(INDIRECT("$log."&[.$B$2]&":$log."&[.$B$2]);1;MATCH([.$A19]&"_mvmt_last_row";[$log.$A$1:$log.$AMJ$1];0);1) ->  | S19: of:=IF(ISNUMBER([.R19]);INDEX([$log.AM$1:$log.AM$1048576];[.$R19];1;1);0) -> 0 | T19: of:=[.S19]=[.D19] -> 
A20: 116 | B20: of:=INDEX([$dates.$A$1:$dates.$CU$1048576];MATCH([.$B$1];[$dates.$A$1:$dates.$A$1048576];0);MATCH("slot_"&[.A20]&"_tracker_id";[$dates.$A$1:$dates.$AMJ$1];0);1) -> 0 | C20: of:=INDEX([$trackers.B$1:$trackers.B$1048576];MATCH([.$B20];[$trackers.$A$1:$trackers.$A$1048576];0);1;1) ->  | D20: of:=INDEX([$trackers.C$1:$trackers.C$1048576];MATCH([.$B20];[$trackers.$A$1:$trackers.$A$1048576];0);1;1) ->  | E20: of:=INDEX([$trackers.D$1:$trackers.D$1048576];MATCH([.$B20];[$trackers.$A$1:$trackers.$A$1048576];0);1;1) ->  | F20: of:=INDEX([$trackers.E$1:$trackers.E$1048576];MATCH([.$B20];[$trackers.$A$1:$trackers.$A$1048576];0);1;1) ->  | G20: of:=INDEX([$trackers.F$1:$trackers.F$1048576];MATCH([.$B20];[$trackers.$A$1:$trackers.$A$1048576];0);1;1) ->  | H20: of:=IF([.$P20];INDEX([$log.EQ$1:$log.EQ$1048576];[.$N20];1;1);0) ->  | I20: of:=IF([.J20]=0;"";"movement notes:"&CHAR(10)&TRIM([.J20]))&IF([.K20]=0;"";CHAR(10)&CHAR(10)&"progression stage notes:"&CHAR(10)&TRIM([.K20])) ->  | J20: of:=IF([.$T20];INDEX([$log.H$1:$log.H$1048576];[.$R20];1;1);0) ->  | K20: of:=IF([.$P20];INDEX([$log.I$1:$log.I$1048576];[.$N20];1;1);0) ->  | L20: of:=IF([.P20];INDEX([$log.EO$1:$log.EO$1048576];[.$N20];1;1);0) ->  | M20: of:=IF([.$P20];INDEX([$log.Z$1:$log.Z$1048576];[.$N20];1;1);0) ->  | N20: of:=INDEX(INDIRECT("$log."&[.$B$2]&":$log."&[.$B$2]);1;MATCH([.$A20]&"_last_row";[$log.$A$1:$log.$AMJ$1];0);1) -> 116_last_row | O20: of:=IF(ISNUMBER([.N20]);INDEX([$log.AK$1:$log.AK$1048576];[.$N20];1;1);0) -> 0 | P20: of:=[.O20]=[.B20] -> true | Q20: of:=IF([.P20];INDEX([$log.ER$1:$log.ER$1048576];[.$N20];1;1);[.F20]) ->  | R20: of:=INDEX(INDIRECT("$log."&[.$B$2]&":$log."&[.$B$2]);1;MATCH([.$A20]&"_mvmt_last_row";[$log.$A$1:$log.$AMJ$1];0);1) ->  | S20: of:=IF(ISNUMBER([.R20]);INDEX([$log.AM$1:$log.AM$1048576];[.$R20];1;1);0) -> 0 | T20: of:=[.S20]=[.D20] -> 
A21: 117 | B21: of:=INDEX([$dates.$A$1:$dates.$CU$1048576];MATCH([.$B$1];[$dates.$A$1:$dates.$A$1048576];0);MATCH("slot_"&[.A21]&"_tracker_id";[$dates.$A$1:$dates.$AMJ$1];0);1) -> 0 | C21: of:=INDEX([$trackers.B$1:$trackers.B$1048576];MATCH([.$B21];[$trackers.$A$1:$trackers.$A$1048576];0);1;1) ->  | D21: of:=INDEX([$trackers.C$1:$trackers.C$1048576];MATCH([.$B21];[$trackers.$A$1:$trackers.$A$1048576];0);1;1) ->  | E21: of:=INDEX([$trackers.D$1:$trackers.D$1048576];MATCH([.$B21];[$trackers.$A$1:$trackers.$A$1048576];0);1;1) ->  | F21: of:=INDEX([$trackers.E$1:$trackers.E$1048576];MATCH([.$B21];[$trackers.$A$1:$trackers.$A$1048576];0);1;1) ->  | G21: of:=INDEX([$trackers.F$1:$trackers.F$1048576];MATCH([.$B21];[$trackers.$A$1:$trackers.$A$1048576];0);1;1) ->  | H21: of:=IF([.$P21];INDEX([$log.EQ$1:$log.EQ$1048576];[.$N21];1;1);0) ->  | I21: of:=IF([.J21]=0;"";"movement notes:"&CHAR(10)&TRIM([.J21]))&IF([.K21]=0;"";CHAR(10)&CHAR(10)&"progression stage notes:"&CHAR(10)&TRIM([.K21])) ->  | J21: of:=IF([.$T21];INDEX([$log.H$1:$log.H$1048576];[.$R21];1;1);0) ->  | K21: of:=IF([.$P21];INDEX([$log.I$1:$log.I$1048576];[.$N21];1;1);0) ->  | L21: of:=IF([.P21];INDEX([$log.EO$1:$log.EO$1048576];[.$N21];1;1);0) ->  | M21: of:=IF([.$P21];INDEX([$log.Z$1:$log.Z$1048576];[.$N21];1;1);0) ->  | N21: of:=INDEX(INDIRECT("$log."&[.$B$2]&":$log."&[.$B$2]);1;MATCH([.$A21]&"_last_row";[$log.$A$1:$log.$AMJ$1];0);1) -> 117_last_row | O21: of:=IF(ISNUMBER([.N21]);INDEX([$log.AK$1:$log.AK$1048576];[.$N21];1;1);0) -> 0 | P21: of:=[.O21]=[.B21] -> true | Q21: of:=IF([.P21];INDEX([$log.ER$1:$log.ER$1048576];[.$N21];1;1);[.F21]) ->  | R21: of:=INDEX(INDIRECT("$log."&[.$B$2]&":$log."&[.$B$2]);1;MATCH([.$A21]&"_mvmt_last_row";[$log.$A$1:$log.$AMJ$1];0);1) ->  | S21: of:=IF(ISNUMBER([.R21]);INDEX([$log.AM$1:$log.AM$1048576];[.$R21];1;1);0) -> 0 | T21: of:=[.S21]=[.D21] -> 
A22: 118 | B22: of:=INDEX([$dates.$A$1:$dates.$CU$1048576];MATCH([.$B$1];[$dates.$A$1:$dates.$A$1048576];0);MATCH("slot_"&[.A22]&"_tracker_id";[$dates.$A$1:$dates.$AMJ$1];0);1) -> 0 | C22: of:=INDEX([$trackers.B$1:$trackers.B$1048576];MATCH([.$B22];[$trackers.$A$1:$trackers.$A$1048576];0);1;1) ->  | D22: of:=INDEX([$trackers.C$1:$trackers.C$1048576];MATCH([.$B22];[$trackers.$A$1:$trackers.$A$1048576];0);1;1) ->  | E22: of:=INDEX([$trackers.D$1:$trackers.D$1048576];MATCH([.$B22];[$trackers.$A$1:$trackers.$A$1048576];0);1;1) ->  | F22: of:=INDEX([$trackers.E$1:$trackers.E$1048576];MATCH([.$B22];[$trackers.$A$1:$trackers.$A$1048576];0);1;1) ->  | G22: of:=INDEX([$trackers.F$1:$trackers.F$1048576];MATCH([.$B22];[$trackers.$A$1:$trackers.$A$1048576];0);1;1) ->  | H22: of:=IF([.$P22];INDEX([$log.EQ$1:$log.EQ$1048576];[.$N22];1;1);0) ->  | I22: of:=IF([.J22]=0;"";"movement notes:"&CHAR(10)&TRIM([.J22]))&IF([.K22]=0;"";CHAR(10)&CHAR(10)&"progression stage notes:"&CHAR(10)&TRIM([.K22])) ->  | J22: of:=IF([.$T22];INDEX([$log.H$1:$log.H$1048576];[.$R22];1;1);0) ->  | K22: of:=IF([.$P22];INDEX([$log.I$1:$log.I$1048576];[.$N22];1;1);0) ->  | L22: of:=IF([.P22];INDEX([$log.EO$1:$log.EO$1048576];[.$N22];1;1);0) ->  | M22: of:=IF([.$P22];INDEX([$log.Z$1:$log.Z$1048576];[.$N22];1;1);0) ->  | N22: of:=INDEX(INDIRECT("$log."&[.$B$2]&":$log."&[.$B$2]);1;MATCH([.$A22]&"_last_row";[$log.$A$1:$log.$AMJ$1];0);1) -> 118_last_row | O22: of:=IF(ISNUMBER([.N22]);INDEX([$log.AK$1:$log.AK$1048576];[.$N22];1;1);0) -> 0 | P22: of:=[.O22]=[.B22] -> true | Q22: of:=IF([.P22];INDEX([$log.ER$1:$log.ER$1048576];[.$N22];1;1);[.F22]) ->  | R22: of:=INDEX(INDIRECT("$log."&[.$B$2]&":$log."&[.$B$2]);1;MATCH([.$A22]&"_mvmt_last_row";[$log.$A$1:$log.$AMJ$1];0);1) ->  | S22: of:=IF(ISNUMBER([.R22]);INDEX([$log.AM$1:$log.AM$1048576];[.$R22];1;1);0) -> 0 | T22: of:=[.S22]=[.D22] -> 
A23: 119 | B23: of:=INDEX([$dates.$A$1:$dates.$CU$1048576];MATCH([.$B$1];[$dates.$A$1:$dates.$A$1048576];0);MATCH("slot_"&[.A23]&"_tracker_id";[$dates.$A$1:$dates.$AMJ$1];0);1) -> 0 | C23: of:=INDEX([$trackers.B$1:$trackers.B$1048576];MATCH([.$B23];[$trackers.$A$1:$trackers.$A$1048576];0);1;1) ->  | D23: of:=INDEX([$trackers.C$1:$trackers.C$1048576];MATCH([.$B23];[$trackers.$A$1:$trackers.$A$1048576];0);1;1) ->  | E23: of:=INDEX([$trackers.D$1:$trackers.D$1048576];MATCH([.$B23];[$trackers.$A$1:$trackers.$A$1048576];0);1;1) ->  | F23: of:=INDEX([$trackers.E$1:$trackers.E$1048576];MATCH([.$B23];[$trackers.$A$1:$trackers.$A$1048576];0);1;1) ->  | G23: of:=INDEX([$trackers.F$1:$trackers.F$1048576];MATCH([.$B23];[$trackers.$A$1:$trackers.$A$1048576];0);1;1) ->  | H23: of:=IF([.$P23];INDEX([$log.EQ$1:$log.EQ$1048576];[.$N23];1;1);0) ->  | I23: of:=IF([.J23]=0;"";"movement notes:"&CHAR(10)&TRIM([.J23]))&IF([.K23]=0;"";CHAR(10)&CHAR(10)&"progression stage notes:"&CHAR(10)&TRIM([.K23])) ->  | J23: of:=IF([.$T23];INDEX([$log.H$1:$log.H$1048576];[.$R23];1;1);0) ->  | K23: of:=IF([.$P23];INDEX([$log.I$1:$log.I$1048576];[.$N23];1;1);0) ->  | L23: of:=IF([.P23];INDEX([$log.EO$1:$log.EO$1048576];[.$N23];1;1);0) ->  | M23: of:=IF([.$P23];INDEX([$log.Z$1:$log.Z$1048576];[.$N23];1;1);0) ->  | N23: of:=INDEX(INDIRECT("$log."&[.$B$2]&":$log."&[.$B$2]);1;MATCH([.$A23]&"_last_row";[$log.$A$1:$log.$AMJ$1];0);1) -> 119_last_row | O23: of:=IF(ISNUMBER([.N23]);INDEX([$log.AK$1:$log.AK$1048576];[.$N23];1;1);0) -> 0 | P23: of:=[.O23]=[.B23] -> true | Q23: of:=IF([.P23];INDEX([$log.ER$1:$log.ER$1048576];[.$N23];1;1);[.F23]) ->  | R23: of:=INDEX(INDIRECT("$log."&[.$B$2]&":$log."&[.$B$2]);1;MATCH([.$A23]&"_mvmt_last_row";[$log.$A$1:$log.$AMJ$1];0);1) ->  | S23: of:=IF(ISNUMBER([.R23]);INDEX([$log.AM$1:$log.AM$1048576];[.$R23];1;1);0) -> 0 | T23: of:=[.S23]=[.D23] -> 
A24: 120 | B24: of:=INDEX([$dates.$A$1:$dates.$CU$1048576];MATCH([.$B$1];[$dates.$A$1:$dates.$A$1048576];0);MATCH("slot_"&[.A24]&"_tracker_id";[$dates.$A$1:$dates.$AMJ$1];0);1) -> 0 | C24: of:=INDEX([$trackers.B$1:$trackers.B$1048576];MATCH([.$B24];[$trackers.$A$1:$trackers.$A$1048576];0);1;1) ->  | D24: of:=INDEX([$trackers.C$1:$trackers.C$1048576];MATCH([.$B24];[$trackers.$A$1:$trackers.$A$1048576];0);1;1) ->  | E24: of:=INDEX([$trackers.D$1:$trackers.D$1048576];MATCH([.$B24];[$trackers.$A$1:$trackers.$A$1048576];0);1;1) ->  | F24: of:=INDEX([$trackers.E$1:$trackers.E$1048576];MATCH([.$B24];[$trackers.$A$1:$trackers.$A$1048576];0);1;1) ->  | G24: of:=INDEX([$trackers.F$1:$trackers.F$1048576];MATCH([.$B24];[$trackers.$A$1:$trackers.$A$1048576];0);1;1) ->  | H24: of:=IF([.$P24];INDEX([$log.EQ$1:$log.EQ$1048576];[.$N24];1;1);0) ->  | I24: of:=IF([.J24]=0;"";"movement notes:"&CHAR(10)&TRIM([.J24]))&IF([.K24]=0;"";CHAR(10)&CHAR(10)&"progression stage notes:"&CHAR(10)&TRIM([.K24])) ->  | J24: of:=IF([.$T24];INDEX([$log.H$1:$log.H$1048576];[.$R24];1;1);0) ->  | K24: of:=IF([.$P24];INDEX([$log.I$1:$log.I$1048576];[.$N24];1;1);0) ->  | L24: of:=IF([.P24];INDEX([$log.EO$1:$log.EO$1048576];[.$N24];1;1);0) ->  | M24: of:=IF([.$P24];INDEX([$log.Z$1:$log.Z$1048576];[.$N24];1;1);0) ->  | N24: of:=INDEX(INDIRECT("$log."&[.$B$2]&":$log."&[.$B$2]);1;MATCH([.$A24]&"_last_row";[$log.$A$1:$log.$AMJ$1];0);1) -> 120_last_row | O24: of:=IF(ISNUMBER([.N24]);INDEX([$log.AK$1:$log.AK$1048576];[.$N24];1;1);0) -> 0 | P24: of:=[.O24]=[.B24] -> true | Q24: of:=IF([.P24];INDEX([$log.ER$1:$log.ER$1048576];[.$N24];1;1);[.F24]) ->  | R24: of:=INDEX(INDIRECT("$log."&[.$B$2]&":$log."&[.$B$2]);1;MATCH([.$A24]&"_mvmt_last_row";[$log.$A$1:$log.$AMJ$1];0);1) ->  | S24: of:=IF(ISNUMBER([.R24]);INDEX([$log.AM$1:$log.AM$1048576];[.$R24];1;1);0) -> 0 | T24: of:=[.S24]=[.D24] -> 
A25: 121 | B25: of:=INDEX([$dates.$A$1:$dates.$CU$1048576];MATCH([.$B$1];[$dates.$A$1:$dates.$A$1048576];0);MATCH("slot_"&[.A25]&"_tracker_id";[$dates.$A$1:$dates.$AMJ$1];0);1) -> 0 | C25: of:=INDEX([$trackers.B$1:$trackers.B$1048576];MATCH([.$B25];[$trackers.$A$1:$trackers.$A$1048576];0);1;1) ->  | D25: of:=INDEX([$trackers.C$1:$trackers.C$1048576];MATCH([.$B25];[$trackers.$A$1:$trackers.$A$1048576];0);1;1) ->  | E25: of:=INDEX([$trackers.D$1:$trackers.D$1048576];MATCH([.$B25];[$trackers.$A$1:$trackers.$A$1048576];0);1;1) ->  | F25: of:=INDEX([$trackers.E$1:$trackers.E$1048576];MATCH([.$B25];[$trackers.$A$1:$trackers.$A$1048576];0);1;1) ->  | G25: of:=INDEX([$trackers.F$1:$trackers.F$1048576];MATCH([.$B25];[$trackers.$A$1:$trackers.$A$1048576];0);1;1) ->  | H25: of:=IF([.$P25];INDEX([$log.EQ$1:$log.EQ$1048576];[.$N25];1;1);0) ->  | I25: of:=IF([.J25]=0;"";"movement notes:"&CHAR(10)&TRIM([.J25]))&IF([.K25]=0;"";CHAR(10)&CHAR(10)&"progression stage notes:"&CHAR(10)&TRIM([.K25])) ->  | J25: of:=IF([.$T25];INDEX([$log.H$1:$log.H$1048576];[.$R25];1;1);0) ->  | K25: of:=IF([.$P25];INDEX([$log.I$1:$log.I$1048576];[.$N25];1;1);0) ->  | L25: of:=IF([.P25];INDEX([$log.EO$1:$log.EO$1048576];[.$N25];1;1);0) ->  | M25: of:=IF([.$P25];INDEX([$log.Z$1:$log.Z$1048576];[.$N25];1;1);0) ->  | N25: of:=INDEX(INDIRECT("$log."&[.$B$2]&":$log."&[.$B$2]);1;MATCH([.$A25]&"_last_row";[$log.$A$1:$log.$AMJ$1];0);1) -> 121_last_row | O25: of:=IF(ISNUMBER([.N25]);INDEX([$log.AK$1:$log.AK$1048576];[.$N25];1;1);0) -> 0 | P25: of:=[.O25]=[.B25] -> true | Q25: of:=IF([.P25];INDEX([$log.ER$1:$log.ER$1048576];[.$N25];1;1);[.F25]) ->  | R25: of:=INDEX(INDIRECT("$log."&[.$B$2]&":$log."&[.$B$2]);1;MATCH([.$A25]&"_mvmt_last_row";[$log.$A$1:$log.$AMJ$1];0);1) ->  | S25: of:=IF(ISNUMBER([.R25]);INDEX([$log.AM$1:$log.AM$1048576];[.$R25];1;1);0) -> 0 | T25: of:=[.S25]=[.D25] -> 
A26: 122 | B26: of:=INDEX([$dates.$A$1:$dates.$CU$1048576];MATCH([.$B$1];[$dates.$A$1:$dates.$A$1048576];0);MATCH("slot_"&[.A26]&"_tracker_id";[$dates.$A$1:$dates.$AMJ$1];0);1) -> 0 | C26: of:=INDEX([$trackers.B$1:$trackers.B$1048576];MATCH([.$B26];[$trackers.$A$1:$trackers.$A$1048576];0);1;1) ->  | D26: of:=INDEX([$trackers.C$1:$trackers.C$1048576];MATCH([.$B26];[$trackers.$A$1:$trackers.$A$1048576];0);1;1) ->  | E26: of:=INDEX([$trackers.D$1:$trackers.D$1048576];MATCH([.$B26];[$trackers.$A$1:$trackers.$A$1048576];0);1;1) ->  | F26: of:=INDEX([$trackers.E$1:$trackers.E$1048576];MATCH([.$B26];[$trackers.$A$1:$trackers.$A$1048576];0);1;1) ->  | G26: of:=INDEX([$trackers.F$1:$trackers.F$1048576];MATCH([.$B26];[$trackers.$A$1:$trackers.$A$1048576];0);1;1) ->  | H26: of:=IF([.$P26];INDEX([$log.EQ$1:$log.EQ$1048576];[.$N26];1;1);0) ->  | I26: of:=IF([.J26]=0;"";"movement notes:"&CHAR(10)&TRIM([.J26]))&IF([.K26]=0;"";CHAR(10)&CHAR(10)&"progression stage notes:"&CHAR(10)&TRIM([.K26])) ->  | J26: of:=IF([.$T26];INDEX([$log.H$1:$log.H$1048576];[.$R26];1;1);0) ->  | K26: of:=IF([.$P26];INDEX([$log.I$1:$log.I$1048576];[.$N26];1;1);0) ->  | L26: of:=IF([.P26];INDEX([$log.EO$1:$log.EO$1048576];[.$N26];1;1);0) ->  | M26: of:=IF([.$P26];INDEX([$log.Z$1:$log.Z$1048576];[.$N26];1;1);0) ->  | N26: of:=INDEX(INDIRECT("$log."&[.$B$2]&":$log."&[.$B$2]);1;MATCH([.$A26]&"_last_row";[$log.$A$1:$log.$AMJ$1];0);1) -> 122_last_row | O26: of:=IF(ISNUMBER([.N26]);INDEX([$log.AK$1:$log.AK$1048576];[.$N26];1;1);0) -> 0 | P26: of:=[.O26]=[.B26] -> true | Q26: of:=IF([.P26];INDEX([$log.ER$1:$log.ER$1048576];[.$N26];1;1);[.F26]) ->  | R26: of:=INDEX(INDIRECT("$log."&[.$B$2]&":$log."&[.$B$2]);1;MATCH([.$A26]&"_mvmt_last_row";[$log.$A$1:$log.$AMJ$1];0);1) ->  | S26: of:=IF(ISNUMBER([.R26]);INDEX([$log.AM$1:$log.AM$1048576];[.$R26];1;1);0) -> 0 | T26: of:=[.S26]=[.D26] -> 
A27: 123 | B27: of:=INDEX([$dates.$A$1:$dates.$CU$1048576];MATCH([.$B$1];[$dates.$A$1:$dates.$A$1048576];0);MATCH("slot_"&[.A27]&"_tracker_id";[$dates.$A$1:$dates.$AMJ$1];0);1) -> 0 | C27: of:=INDEX([$trackers.B$1:$trackers.B$1048576];MATCH([.$B27];[$trackers.$A$1:$trackers.$A$1048576];0);1;1) ->  | D27: of:=INDEX([$trackers.C$1:$trackers.C$1048576];MATCH([.$B27];[$trackers.$A$1:$trackers.$A$1048576];0);1;1) ->  | E27: of:=INDEX([$trackers.D$1:$trackers.D$1048576];MATCH([.$B27];[$trackers.$A$1:$trackers.$A$1048576];0);1;1) ->  | F27: of:=INDEX([$trackers.E$1:$trackers.E$1048576];MATCH([.$B27];[$trackers.$A$1:$trackers.$A$1048576];0);1;1) ->  | G27: of:=INDEX([$trackers.F$1:$trackers.F$1048576];MATCH([.$B27];[$trackers.$A$1:$trackers.$A$1048576];0);1;1) ->  | H27: of:=IF([.$P27];INDEX([$log.EQ$1:$log.EQ$1048576];[.$N27];1;1);0) ->  | I27: of:=IF([.J27]=0;"";"movement notes:"&CHAR(10)&TRIM([.J27]))&IF([.K27]=0;"";CHAR(10)&CHAR(10)&"progression stage notes:"&CHAR(10)&TRIM([.K27])) ->  | J27: of:=IF([.$T27];INDEX([$log.H$1:$log.H$1048576];[.$R27];1;1);0) ->  | K27: of:=IF([.$P27];INDEX([$log.I$1:$log.I$1048576];[.$N27];1;1);0) ->  | L27: of:=IF([.P27];INDEX([$log.EO$1:$log.EO$1048576];[.$N27];1;1);0) ->  | M27: of:=IF([.$P27];INDEX([$log.Z$1:$log.Z$1048576];[.$N27];1;1);0) ->  | N27: of:=INDEX(INDIRECT("$log."&[.$B$2]&":$log."&[.$B$2]);1;MATCH([.$A27]&"_last_row";[$log.$A$1:$log.$AMJ$1];0);1) -> 123_last_row | O27: of:=IF(ISNUMBER([.N27]);INDEX([$log.AK$1:$log.AK$1048576];[.$N27];1;1);0) -> 0 | P27: of:=[.O27]=[.B27] -> true | Q27: of:=IF([.P27];INDEX([$log.ER$1:$log.ER$1048576];[.$N27];1;1);[.F27]) ->  | R27: of:=INDEX(INDIRECT("$log."&[.$B$2]&":$log."&[.$B$2]);1;MATCH([.$A27]&"_mvmt_last_row";[$log.$A$1:$log.$AMJ$1];0);1) ->  | S27: of:=IF(ISNUMBER([.R27]);INDEX([$log.AM$1:$log.AM$1048576];[.$R27];1;1);0) -> 0 | T27: of:=[.S27]=[.D27] -> 
A28: 124 | B28: of:=INDEX([$dates.$A$1:$dates.$CU$1048576];MATCH([.$B$1];[$dates.$A$1:$dates.$A$1048576];0);MATCH("slot_"&[.A28]&"_tracker_id";[$dates.$A$1:$dates.$AMJ$1];0);1) -> 0 | C28: of:=INDEX([$trackers.B$1:$trackers.B$1048576];MATCH([.$B28];[$trackers.$A$1:$trackers.$A$1048576];0);1;1) ->  | D28: of:=INDEX([$trackers.C$1:$trackers.C$1048576];MATCH([.$B28];[$trackers.$A$1:$trackers.$A$1048576];0);1;1) ->  | E28: of:=INDEX([$trackers.D$1:$trackers.D$1048576];MATCH([.$B28];[$trackers.$A$1:$trackers.$A$1048576];0);1;1) ->  | F28: of:=INDEX([$trackers.E$1:$trackers.E$1048576];MATCH([.$B28];[$trackers.$A$1:$trackers.$A$1048576];0);1;1) ->  | G28: of:=INDEX([$trackers.F$1:$trackers.F$1048576];MATCH([.$B28];[$trackers.$A$1:$trackers.$A$1048576];0);1;1) ->  | H28: of:=IF([.$P28];INDEX([$log.EQ$1:$log.EQ$1048576];[.$N28];1;1);0) ->  | I28: of:=IF([.J28]=0;"";"movement notes:"&CHAR(10)&TRIM([.J28]))&IF([.K28]=0;"";CHAR(10)&CHAR(10)&"progression stage notes:"&CHAR(10)&TRIM([.K28])) ->  | J28: of:=IF([.$T28];INDEX([$log.H$1:$log.H$1048576];[.$R28];1;1);0) ->  | K28: of:=IF([.$P28];INDEX([$log.I$1:$log.I$1048576];[.$N28];1;1);0) ->  | L28: of:=IF([.P28];INDEX([$log.EO$1:$log.EO$1048576];[.$N28];1;1);0) ->  | M28: of:=IF([.$P28];INDEX([$log.Z$1:$log.Z$1048576];[.$N28];1;1);0) ->  | N28: of:=INDEX(INDIRECT("$log."&[.$B$2]&":$log."&[.$B$2]);1;MATCH([.$A28]&"_last_row";[$log.$A$1:$log.$AMJ$1];0);1) -> 124_last_row | O28: of:=IF(ISNUMBER([.N28]);INDEX([$log.AK$1:$log.AK$1048576];[.$N28];1;1);0) -> 0 | P28: of:=[.O28]=[.B28] -> true | Q28: of:=IF([.P28];INDEX([$log.ER$1:$log.ER$1048576];[.$N28];1;1);[.F28]) ->  | R28: of:=INDEX(INDIRECT("$log."&[.$B$2]&":$log."&[.$B$2]);1;MATCH([.$A28]&"_mvmt_last_row";[$log.$A$1:$log.$AMJ$1];0);1) ->  | S28: of:=IF(ISNUMBER([.R28]);INDEX([$log.AM$1:$log.AM$1048576];[.$R28];1;1);0) -> 0 | T28: of:=[.S28]=[.D28] -> 
A29: 125 | B29: of:=INDEX([$dates.$A$1:$dates.$CU$1048576];MATCH([.$B$1];[$dates.$A$1:$dates.$A$1048576];0);MATCH("slot_"&[.A29]&"_tracker_id";[$dates.$A$1:$dates.$AMJ$1];0);1) -> 0 | C29: of:=INDEX([$trackers.B$1:$trackers.B$1048576];MATCH([.$B29];[$trackers.$A$1:$trackers.$A$1048576];0);1;1) ->  | D29: of:=INDEX([$trackers.C$1:$trackers.C$1048576];MATCH([.$B29];[$trackers.$A$1:$trackers.$A$1048576];0);1;1) ->  | E29: of:=INDEX([$trackers.D$1:$trackers.D$1048576];MATCH([.$B29];[$trackers.$A$1:$trackers.$A$1048576];0);1;1) ->  | F29: of:=INDEX([$trackers.E$1:$trackers.E$1048576];MATCH([.$B29];[$trackers.$A$1:$trackers.$A$1048576];0);1;1) ->  | G29: of:=INDEX([$trackers.F$1:$trackers.F$1048576];MATCH([.$B29];[$trackers.$A$1:$trackers.$A$1048576];0);1;1) ->  | H29: of:=IF([.$P29];INDEX([$log.EQ$1:$log.EQ$1048576];[.$N29];1;1);0) ->  | I29: of:=IF([.J29]=0;"";"movement notes:"&CHAR(10)&TRIM([.J29]))&IF([.K29]=0;"";CHAR(10)&CHAR(10)&"progression stage notes:"&CHAR(10)&TRIM([.K29])) ->  | J29: of:=IF([.$T29];INDEX([$log.H$1:$log.H$1048576];[.$R29];1;1);0) ->  | K29: of:=IF([.$P29];INDEX([$log.I$1:$log.I$1048576];[.$N29];1;1);0) ->  | L29: of:=IF([.P29];INDEX([$log.EO$1:$log.EO$1048576];[.$N29];1;1);0) ->  | M29: of:=IF([.$P29];INDEX([$log.Z$1:$log.Z$1048576];[.$N29];1;1);0) ->  | N29: of:=INDEX(INDIRECT("$log."&[.$B$2]&":$log."&[.$B$2]);1;MATCH([.$A29]&"_last_row";[$log.$A$1:$log.$AMJ$1];0);1) -> 125_last_row | O29: of:=IF(ISNUMBER([.N29]);INDEX([$log.AK$1:$log.AK$1048576];[.$N29];1;1);0) -> 0 | P29: of:=[.O29]=[.B29] -> true | Q29: of:=IF([.P29];INDEX([$log.ER$1:$log.ER$1048576];[.$N29];1;1);[.F29]) ->  | R29: of:=INDEX(INDIRECT("$log."&[.$B$2]&":$log."&[.$B$2]);1;MATCH([.$A29]&"_mvmt_last_row";[$log.$A$1:$log.$AMJ$1];0);1) ->  | S29: of:=IF(ISNUMBER([.R29]);INDEX([$log.AM$1:$log.AM$1048576];[.$R29];1;1);0) -> 0 | T29: of:=[.S29]=[.D29] -> 
A30: 126 | B30: of:=INDEX([$dates.$A$1:$dates.$CU$1048576];MATCH([.$B$1];[$dates.$A$1:$dates.$A$1048576];0);MATCH("slot_"&[.A30]&"_tracker_id";[$dates.$A$1:$dates.$AMJ$1];0);1) -> 0 | C30: of:=INDEX([$trackers.B$1:$trackers.B$1048576];MATCH([.$B30];[$trackers.$A$1:$trackers.$A$1048576];0);1;1) ->  | D30: of:=INDEX([$trackers.C$1:$trackers.C$1048576];MATCH([.$B30];[$trackers.$A$1:$trackers.$A$1048576];0);1;1) ->  | E30: of:=INDEX([$trackers.D$1:$trackers.D$1048576];MATCH([.$B30];[$trackers.$A$1:$trackers.$A$1048576];0);1;1) ->  | F30: of:=INDEX([$trackers.E$1:$trackers.E$1048576];MATCH([.$B30];[$trackers.$A$1:$trackers.$A$1048576];0);1;1) ->  | G30: of:=INDEX([$trackers.F$1:$trackers.F$1048576];MATCH([.$B30];[$trackers.$A$1:$trackers.$A$1048576];0);1;1) ->  | H30: of:=IF([.$P30];INDEX([$log.EQ$1:$log.EQ$1048576];[.$N30];1;1);0) ->  | I30: of:=IF([.J30]=0;"";"movement notes:"&CHAR(10)&TRIM([.J30]))&IF([.K30]=0;"";CHAR(10)&CHAR(10)&"progression stage notes:"&CHAR(10)&TRIM([.K30])) ->  | J30: of:=IF([.$T30];INDEX([$log.H$1:$log.H$1048576];[.$R30];1;1);0) ->  | K30: of:=IF([.$P30];INDEX([$log.I$1:$log.I$1048576];[.$N30];1;1);0) ->  | L30: of:=IF([.P30];INDEX([$log.EO$1:$log.EO$1048576];[.$N30];1;1);0) ->  | M30: of:=IF([.$P30];INDEX([$log.Z$1:$log.Z$1048576];[.$N30];1;1);0) ->  | N30: of:=INDEX(INDIRECT("$log."&[.$B$2]&":$log."&[.$B$2]);1;MATCH([.$A30]&"_last_row";[$log.$A$1:$log.$AMJ$1];0);1) -> 126_last_row | O30: of:=IF(ISNUMBER([.N30]);INDEX([$log.AK$1:$log.AK$1048576];[.$N30];1;1);0) -> 0 | P30: of:=[.O30]=[.B30] -> true | Q30: of:=IF([.P30];INDEX([$log.ER$1:$log.ER$1048576];[.$N30];1;1);[.F30]) ->  | R30: of:=INDEX(INDIRECT("$log."&[.$B$2]&":$log."&[.$B$2]);1;MATCH([.$A30]&"_mvmt_last_row";[$log.$A$1:$log.$AMJ$1];0);1) ->  | S30: of:=IF(ISNUMBER([.R30]);INDEX([$log.AM$1:$log.AM$1048576];[.$R30];1;1);0) -> 0 | T30: of:=[.S30]=[.D30] -> 
A31: 127 | B31: of:=INDEX([$dates.$A$1:$dates.$CU$1048576];MATCH([.$B$1];[$dates.$A$1:$dates.$A$1048576];0);MATCH("slot_"&[.A31]&"_tracker_id";[$dates.$A$1:$dates.$AMJ$1];0);1) -> 0 | C31: of:=INDEX([$trackers.B$1:$trackers.B$1048576];MATCH([.$B31];[$trackers.$A$1:$trackers.$A$1048576];0);1;1) ->  | D31: of:=INDEX([$trackers.C$1:$trackers.C$1048576];MATCH([.$B31];[$trackers.$A$1:$trackers.$A$1048576];0);1;1) ->  | E31: of:=INDEX([$trackers.D$1:$trackers.D$1048576];MATCH([.$B31];[$trackers.$A$1:$trackers.$A$1048576];0);1;1) ->  | F31: of:=INDEX([$trackers.E$1:$trackers.E$1048576];MATCH([.$B31];[$trackers.$A$1:$trackers.$A$1048576];0);1;1) ->  | G31: of:=INDEX([$trackers.F$1:$trackers.F$1048576];MATCH([.$B31];[$trackers.$A$1:$trackers.$A$1048576];0);1;1) ->  | H31: of:=IF([.$P31];INDEX([$log.EQ$1:$log.EQ$1048576];[.$N31];1;1);0) ->  | I31: of:=IF([.J31]=0;"";"movement notes:"&CHAR(10)&TRIM([.J31]))&IF([.K31]=0;"";CHAR(10)&CHAR(10)&"progression stage notes:"&CHAR(10)&TRIM([.K31])) ->  | J31: of:=IF([.$T31];INDEX([$log.H$1:$log.H$1048576];[.$R31];1;1);0) ->  | K31: of:=IF([.$P31];INDEX([$log.I$1:$log.I$1048576];[.$N31];1;1);0) ->  | L31: of:=IF([.P31];INDEX([$log.EO$1:$log.EO$1048576];[.$N31];1;1);0) ->  | M31: of:=IF([.$P31];INDEX([$log.Z$1:$log.Z$1048576];[.$N31];1;1);0) ->  | N31: of:=INDEX(INDIRECT("$log."&[.$B$2]&":$log."&[.$B$2]);1;MATCH([.$A31]&"_last_row";[$log.$A$1:$log.$AMJ$1];0);1) -> 127_last_row | O31: of:=IF(ISNUMBER([.N31]);INDEX([$log.AK$1:$log.AK$1048576];[.$N31];1;1);0) -> 0 | P31: of:=[.O31]=[.B31] -> true | Q31: of:=IF([.P31];INDEX([$log.ER$1:$log.ER$1048576];[.$N31];1;1);[.F31]) ->  | R31: of:=INDEX(INDIRECT("$log."&[.$B$2]&":$log."&[.$B$2]);1;MATCH([.$A31]&"_mvmt_last_row";[$log.$A$1:$log.$AMJ$1];0);1) ->  | S31: of:=IF(ISNUMBER([.R31]);INDEX([$log.AM$1:$log.AM$1048576];[.$R31];1;1);0) -> 0 | T31: of:=[.S31]=[.D31] -> 
A32: 128 | B32: of:=INDEX([$dates.$A$1:$dates.$CU$1048576];MATCH([.$B$1];[$dates.$A$1:$dates.$A$1048576];0);MATCH("slot_"&[.A32]&"_tracker_id";[$dates.$A$1:$dates.$AMJ$1];0);1) -> 0 | C32: of:=INDEX([$trackers.B$1:$trackers.B$1048576];MATCH([.$B32];[$trackers.$A$1:$trackers.$A$1048576];0);1;1) ->  | D32: of:=INDEX([$trackers.C$1:$trackers.C$1048576];MATCH([.$B32];[$trackers.$A$1:$trackers.$A$1048576];0);1;1) ->  | E32: of:=INDEX([$trackers.D$1:$trackers.D$1048576];MATCH([.$B32];[$trackers.$A$1:$trackers.$A$1048576];0);1;1) ->  | F32: of:=INDEX([$trackers.E$1:$trackers.E$1048576];MATCH([.$B32];[$trackers.$A$1:$trackers.$A$1048576];0);1;1) ->  | G32: of:=INDEX([$trackers.F$1:$trackers.F$1048576];MATCH([.$B32];[$trackers.$A$1:$trackers.$A$1048576];0);1;1) ->  | H32: of:=IF([.$P32];INDEX([$log.EQ$1:$log.EQ$1048576];[.$N32];1;1);0) ->  | I32: of:=IF([.J32]=0;"";"movement notes:"&CHAR(10)&TRIM([.J32]))&IF([.K32]=0;"";CHAR(10)&CHAR(10)&"progression stage notes:"&CHAR(10)&TRIM([.K32])) ->  | J32: of:=IF([.$T32];INDEX([$log.H$1:$log.H$1048576];[.$R32];1;1);0) ->  | K32: of:=IF([.$P32];INDEX([$log.I$1:$log.I$1048576];[.$N32];1;1);0) ->  | L32: of:=IF([.P32];INDEX([$log.EO$1:$log.EO$1048576];[.$N32];1;1);0) ->  | M32: of:=IF([.$P32];INDEX([$log.Z$1:$log.Z$1048576];[.$N32];1;1);0) ->  | N32: of:=INDEX(INDIRECT("$log."&[.$B$2]&":$log."&[.$B$2]);1;MATCH([.$A32]&"_last_row";[$log.$A$1:$log.$AMJ$1];0);1) -> 128_last_row | O32: of:=IF(ISNUMBER([.N32]);INDEX([$log.AK$1:$log.AK$1048576];[.$N32];1;1);0) -> 0 | P32: of:=[.O32]=[.B32] -> true | Q32: of:=IF([.P32];INDEX([$log.ER$1:$log.ER$1048576];[.$N32];1;1);[.F32]) ->  | R32: of:=INDEX(INDIRECT("$log."&[.$B$2]&":$log."&[.$B$2]);1;MATCH([.$A32]&"_mvmt_last_row";[$log.$A$1:$log.$AMJ$1];0);1) ->  | S32: of:=IF(ISNUMBER([.R32]);INDEX([$log.AM$1:$log.AM$1048576];[.$R32];1;1);0) -> 0 | T32: of:=[.S32]=[.D32] -> 
A33: 129 | B33: of:=INDEX([$dates.$A$1:$dates.$CU$1048576];MATCH([.$B$1];[$dates.$A$1:$dates.$A$1048576];0);MATCH("slot_"&[.A33]&"_tracker_id";[$dates.$A$1:$dates.$AMJ$1];0);1) -> 0 | C33: of:=INDEX([$trackers.B$1:$trackers.B$1048576];MATCH([.$B33];[$trackers.$A$1:$trackers.$A$1048576];0);1;1) ->  | D33: of:=INDEX([$trackers.C$1:$trackers.C$1048576];MATCH([.$B33];[$trackers.$A$1:$trackers.$A$1048576];0);1;1) ->  | E33: of:=INDEX([$trackers.D$1:$trackers.D$1048576];MATCH([.$B33];[$trackers.$A$1:$trackers.$A$1048576];0);1;1) ->  | F33: of:=INDEX([$trackers.E$1:$trackers.E$1048576];MATCH([.$B33];[$trackers.$A$1:$trackers.$A$1048576];0);1;1) ->  | G33: of:=INDEX([$trackers.F$1:$trackers.F$1048576];MATCH([.$B33];[$trackers.$A$1:$trackers.$A$1048576];0);1;1) ->  | H33: of:=IF([.$P33];INDEX([$log.EQ$1:$log.EQ$1048576];[.$N33];1;1);0) ->  | I33: of:=IF([.J33]=0;"";"movement notes:"&CHAR(10)&TRIM([.J33]))&IF([.K33]=0;"";CHAR(10)&CHAR(10)&"progression stage notes:"&CHAR(10)&TRIM([.K33])) ->  | J33: of:=IF([.$T33];INDEX([$log.H$1:$log.H$1048576];[.$R33];1;1);0) ->  | K33: of:=IF([.$P33];INDEX([$log.I$1:$log.I$1048576];[.$N33];1;1);0) ->  | L33: of:=IF([.P33];INDEX([$log.EO$1:$log.EO$1048576];[.$N33];1;1);0) ->  | M33: of:=IF([.$P33];INDEX([$log.Z$1:$log.Z$1048576];[.$N33];1;1);0) ->  | N33: of:=INDEX(INDIRECT("$log."&[.$B$2]&":$log."&[.$B$2]);1;MATCH([.$A33]&"_last_row";[$log.$A$1:$log.$AMJ$1];0);1) -> 129_last_row | O33: of:=IF(ISNUMBER([.N33]);INDEX([$log.AK$1:$log.AK$1048576];[.$N33];1;1);0) -> 0 | P33: of:=[.O33]=[.B33] -> true | Q33: of:=IF([.P33];INDEX([$log.ER$1:$log.ER$1048576];[.$N33];1;1);[.F33]) ->  | R33: of:=INDEX(INDIRECT("$log."&[.$B$2]&":$log."&[.$B$2]);1;MATCH([.$A33]&"_mvmt_last_row";[$log.$A$1:$log.$AMJ$1];0);1) ->  | S33: of:=IF(ISNUMBER([.R33]);INDEX([$log.AM$1:$log.AM$1048576];[.$R33];1;1);0) -> 0 | T33: of:=[.S33]=[.D33] -> 
A34: 130 | B34: of:=INDEX([$dates.$A$1:$dates.$CU$1048576];MATCH([.$B$1];[$dates.$A$1:$dates.$A$1048576];0);MATCH("slot_"&[.A34]&"_tracker_id";[$dates.$A$1:$dates.$AMJ$1];0);1) -> 0 | C34: of:=INDEX([$trackers.B$1:$trackers.B$1048576];MATCH([.$B34];[$trackers.$A$1:$trackers.$A$1048576];0);1;1) ->  | D34: of:=INDEX([$trackers.C$1:$trackers.C$1048576];MATCH([.$B34];[$trackers.$A$1:$trackers.$A$1048576];0);1;1) ->  | E34: of:=INDEX([$trackers.D$1:$trackers.D$1048576];MATCH([.$B34];[$trackers.$A$1:$trackers.$A$1048576];0);1;1) ->  | F34: of:=INDEX([$trackers.E$1:$trackers.E$1048576];MATCH([.$B34];[$trackers.$A$1:$trackers.$A$1048576];0);1;1) ->  | G34: of:=INDEX([$trackers.F$1:$trackers.F$1048576];MATCH([.$B34];[$trackers.$A$1:$trackers.$A$1048576];0);1;1) ->  | H34: of:=IF([.$P34];INDEX([$log.EQ$1:$log.EQ$1048576];[.$N34];1;1);0) ->  | I34: of:=IF([.J34]=0;"";"movement notes:"&CHAR(10)&TRIM([.J34]))&IF([.K34]=0;"";CHAR(10)&CHAR(10)&"progression stage notes:"&CHAR(10)&TRIM([.K34])) ->  | J34: of:=IF([.$T34];INDEX([$log.H$1:$log.H$1048576];[.$R34];1;1);0) ->  | K34: of:=IF([.$P34];INDEX([$log.I$1:$log.I$1048576];[.$N34];1;1);0) ->  | L34: of:=IF([.P34];INDEX([$log.EO$1:$log.EO$1048576];[.$N34];1;1);0) ->  | M34: of:=IF([.$P34];INDEX([$log.Z$1:$log.Z$1048576];[.$N34];1;1);0) ->  | N34: of:=INDEX(INDIRECT("$log."&[.$B$2]&":$log."&[.$B$2]);1;MATCH([.$A34]&"_last_row";[$log.$A$1:$log.$AMJ$1];0);1) -> 130_last_row | O34: of:=IF(ISNUMBER([.N34]);INDEX([$log.AK$1:$log.AK$1048576];[.$N34];1;1);0) -> 0 | P34: of:=[.O34]=[.B34] -> true | Q34: of:=IF([.P34];INDEX([$log.ER$1:$log.ER$1048576];[.$N34];1;1);[.F34]) ->  | R34: of:=INDEX(INDIRECT("$log."&[.$B$2]&":$log."&[.$B$2]);1;MATCH([.$A34]&"_mvmt_last_row";[$log.$A$1:$log.$AMJ$1];0);1) ->  | S34: of:=IF(ISNUMBER([.R34]);INDEX([$log.AM$1:$log.AM$1048576];[.$R34];1;1);0) -> 0 | T34: of:=[.S34]=[.D34] -> 

Sheet: dates
A1: date | B1: weekday | C1: workout_ref | D1: work_slot_1 | E1: work_slot_2 | F1: work_slot_3 | G1: work_slot_4 | H1: work_slot_5 | I1: work_slot_6 | J1: work_slot_7 | K1: work_slot_8 | L1: work_slot_9 | M1: work_slot_10 | N1: work_slot_11 | O1: work_slot_12 | P1: work_slot_13 | Q1: work_slot_14 | R1: work_slot_15 | S1: work_slot_16 | T1: work_slot_17 | U1: work_slot_18 | V1: work_slot_19 | W1: work_slot_20 | X1: slot_101_tracker_id | Y1: slot_101_tracker_ref | Z1: slot_102_tracker_id | AA1: slot_102_tracker_ref | AB1: slot_103_tracker_id | AC1: slot_103_tracker_ref | AD1: slot_104_tracker_id | AE1: slot_104_tracker_ref | AF1: slot_105_tracker_id | AG1: slot_105_tracker_ref | AH1: slot_106_tracker_id | AI1: slot_106_tracker_ref | AJ1: slot_107_tracker_id | AK1: slot_107_tracker_ref | AL1: slot_108_tracker_id | AM1: slot_108_tracker_ref | AN1: slot_109_tracker_id | AO1: slot_109_tracker_ref | AP1: slot_110_tracker_id | AQ1: slot_110_tracker_ref | AR1: slot_111_tracker_id | AS1: slot_111_tracker_ref | AT1: slot_112_tracker_id | AU1: slot_112_tracker_ref | AV1: slot_113_tracker_id | AW1: slot_113_tracker_ref | AX1: slot_114_tracker_id | AY1: slot_114_tracker_ref | AZ1: slot_115_tracker_id | BA1: slot_115_tracker_ref | BB1: slot_116_tracker_id | BC1: slot_116_tracker_ref | BD1: slot_117_tracker_id | BE1: slot_117_tracker_ref | BF1: slot_118_tracker_id | BG1: slot_118_tracker_ref | BH1: slot_119_tracker_id | BI1: slot_119_tracker_ref | BJ1: slot_120_tracker_id | BK1: slot_120_tracker_ref | BL1: slot_121_tracker_id | BM1: slot_121_tracker_ref | BN1: slot_122_tracker_id | BO1: slot_122_tracker_ref | BP1: slot_123_tracker_id | BQ1: slot_123_tracker_ref | BR1: slot_124_tracker_id | BS1: slot_124_tracker_ref | BT1: slot_125_tracker_id | BU1: slot_125_tracker_ref | BV1: slot_126_tracker_id | BW1: slot_126_tracker_ref | BX1: slot_127_tracker_id | BY1: slot_127_tracker_ref | BZ1: slot_128_tracker_id | CA1: slot_128_tracker_ref | CB1: slot_129_tracker_id | CC1: slot_129_tracker_ref | CD1: slot_130_tracker_id | CE1: slot_130_tracker_ref | CF1: work slot reference | CG1: work_slot_1_ref | CH1: work_slot_2_ref | CI1: work_slot_3_ref | CJ1: work_slot_4_ref | CK1: work_slot_5_ref | CL1: work_slot_6_ref | CM1: work_slot_7_ref | CN1: work_slot_8_ref | CO1: work_slot_9_ref | CP1: work_slot_10_ref | CQ1: work_slot_11_ref | CR1: work_slot_12_ref | CS1: work_slot_13_ref | CT1: work_slot_14_ref | CU1: work_slot_15_ref
A2: 2020-06-26 | B2: of:=WEEKDAY([.A2]) -> 6 | C2: of:=COM.MICROSOFT.TEXTJOIN("; "; 1; [.CG2:.CU2]) -> back squat SL | D2: 101 | X2: 1001 | Y2: of:=INDEX([$trackers.$B$1:$trackers.$B$1048576];MATCH([.X2];[$trackers.$A$1:$trackers.$A$1048576];0);1;1) -> back squat SL | Z2: 1002 | AA2: of:=INDEX([$trackers.$B$1:$trackers.$B$1048576];MATCH([.Z2];[$trackers.$A$1:$trackers.$A$1048576];0);1;1) -> bench SL | AC2: of:=INDEX([$trackers.$B$1:$trackers.$B$1048576];MATCH([.AB2];[$trackers.$A$1:$trackers.$A$1048576];0);1;1) ->  | AE2: of:=INDEX([$trackers.$B$1:$trackers.$B$1048576];MATCH([.AD2];[$trackers.$A$1:$trackers.$A$1048576];0);1;1) ->  | AG2: of:=INDEX([$trackers.$B$1:$trackers.$B$1048576];MATCH([.AF2];[$trackers.$A$1:$trackers.$A$1048576];0);1;1) ->  | AI2: of:=INDEX([$trackers.$B$1:$trackers.$B$1048576];MATCH([.AH2];[$trackers.$A$1:$trackers.$A$1048576];0);1;1) ->  | AK2: of:=INDEX([$trackers.$B$1:$trackers.$B$1048576];MATCH([.AJ2];[$trackers.$A$1:$trackers.$A$1048576];0);1;1) ->  | AM2: of:=INDEX([$trackers.$B$1:$trackers.$B$1048576];MATCH([.AL2];[$trackers.$A$1:$trackers.$A$1048576];0);1;1) ->  | AO2: of:=INDEX([$trackers.$B$1:$trackers.$B$1048576];MATCH([.AN2];[$trackers.$A$1:$trackers.$A$1048576];0);1;1) ->  | AQ2: of:=INDEX([$trackers.$B$1:$trackers.$B$1048576];MATCH([.AP2];[$trackers.$A$1:$trackers.$A$1048576];0);1;1) ->  | AS2: of:=INDEX([$trackers.$B$1:$trackers.$B$1048576];MATCH([.AR2];[$trackers.$A$1:$trackers.$A$1048576];0);1;1) ->  | AU2: of:=INDEX([$trackers.$B$1:$trackers.$B$1048576];MATCH([.AT2];[$trackers.$A$1:$trackers.$A$1048576];0);1;1) ->  | AW2: of:=INDEX([$trackers.$B$1:$trackers.$B$1048576];MATCH([.AV2];[$trackers.$A$1:$trackers.$A$1048576];0);1;1) ->  | AY2: of:=INDEX([$trackers.$B$1:$trackers.$B$1048576];MATCH([.AX2];[$trackers.$A$1:$trackers.$A$1048576];0);1;1) ->  | BA2: of:=INDEX([$trackers.$B$1:$trackers.$B$1048576];MATCH([.AZ2];[$trackers.$A$1:$trackers.$A$1048576];0);1;1) ->  | BC2: of:=INDEX([$trackers.$B$1:$trackers.$B$1048576];MATCH([.BB2];[$trackers.$A$1:$trackers.$A$1048576];0);1;1) ->  | BE2: of:=INDEX([$trackers.$B$1:$trackers.$B$1048576];MATCH([.BD2];[$trackers.$A$1:$trackers.$A$1048576];0);1;1) ->  | BG2: of:=INDEX([$trackers.$B$1:$trackers.$B$1048576];MATCH([.BF2];[$trackers.$A$1:$trackers.$A$1048576];0);1;1) ->  | BI2: of:=INDEX([$trackers.$B$1:$trackers.$B$1048576];MATCH([.BH2];[$trackers.$A$1:$trackers.$A$1048576];0);1;1) ->  | BK2: of:=INDEX([$trackers.$B$1:$trackers.$B$1048576];MATCH([.BJ2];[$trackers.$A$1:$trackers.$A$1048576];0);1;1) ->  | BM2: of:=INDEX([$trackers.$B$1:$trackers.$B$1048576];MATCH([.BL2];[$trackers.$A$1:$trackers.$A$1048576];0);1;1) ->  | BO2: of:=INDEX([$trackers.$B$1:$trackers.$B$1048576];MATCH([.BN2];[$trackers.$A$1:$trackers.$A$1048576];0);1;1) ->  | BQ2: of:=INDEX([$trackers.$B$1:$trackers.$B$1048576];MATCH([.BP2];[$trackers.$A$1:$trackers.$A$1048576];0);1;1) ->  | BS2: of:=INDEX([$trackers.$B$1:$trackers.$B$1048576];MATCH([.BR2];[$trackers.$A$1:$trackers.$A$1048576];0);1;1) ->  | BU2: of:=INDEX([$trackers.$B$1:$trackers.$B$1048576];MATCH([.BT2];[$trackers.$A$1:$trackers.$A$1048576];0);1;1) ->  | BW2: of:=INDEX([$trackers.$B$1:$trackers.$B$1048576];MATCH([.BV2];[$trackers.$A$1:$trackers.$A$1048576];0);1;1) ->  | BY2: of:=INDEX([$trackers.$B$1:$trackers.$B$1048576];MATCH([.BX2];[$trackers.$A$1:$trackers.$A$1048576];0);1;1) ->  | CA2: of:=INDEX([$trackers.$B$1:$trackers.$B$1048576];MATCH([.BZ2];[$trackers.$A$1:$trackers.$A$1048576];0);1;1) ->  | CC2: of:=INDEX([$trackers.$B$1:$trackers.$B$1048576];MATCH([.CB2];[$trackers.$A$1:$trackers.$A$1048576];0);1;1) ->  | CE2: of:=INDEX([$trackers.$B$1:$trackers.$B$1048576];MATCH([.CD2];[$trackers.$A$1:$trackers.$A$1048576];0);1;1) ->  | CG2: of:=IF([.D2]="";"";INDEX([.$A2:.$AMJ2];1;MATCH("slot_"&[.D2]&"_tracker_ref";[.$A$1:.$AMJ$1];0);1)) -> back squat SL | CH2: of:=IF([.E2]="";"";INDEX([.$A2:.$AMJ2];1;MATCH("slot_"&[.E2]&"_tracker_ref";[.$A$1:.$AMJ$1];0);1)) ->  | CI2: of:=IF([.F2]="";"";INDEX([.$A2:.$AMJ2];1;MATCH("slot_"&[.F2]&"_tracker_ref";[.$A$1:.$AMJ$1];0);1)) ->  | CJ2: of:=IF([.G2]="";"";INDEX([.$A2:.$AMJ2];1;MATCH("slot_"&[.G2]&"_tracker_ref";[.$A$1:.$AMJ$1];0);1)) ->  | CK2: of:=IF([.H2]="";"";INDEX([.$A2:.$AMJ2];1;MATCH("slot_"&[.H2]&"_tracker_ref";[.$A$1:.$AMJ$1];0);1)) ->  | CL2: of:=IF([.I2]="";"";INDEX([.$A2:.$AMJ2];1;MATCH("slot_"&[.I2]&"_tracker_ref";[.$A$1:.$AMJ$1];0);1)) ->  | CM2: of:=IF([.J2]="";"";INDEX([.$A2:.$AMJ2];1;MATCH("slot_"&[.J2]&"_tracker_ref";[.$A$1:.$AMJ$1];0);1)) ->  | CN2: of:=IF([.K2]="";"";INDEX([.$A2:.$AMJ2];1;MATCH("slot_"&[.K2]&"_tracker_ref";[.$A$1:.$AMJ$1];0);1)) ->  | CO2: of:=IF([.L2]="";"";INDEX([.$A2:.$AMJ2];1;MATCH("slot_"&[.L2]&"_tracker_ref";[.$A$1:.$AMJ$1];0);1)) ->  | CP2: of:=IF([.M2]="";"";INDEX([.$A2:.$AMJ2];1;MATCH("slot_"&[.M2]&"_tracker_ref";[.$A$1:.$AMJ$1];0);1)) ->  | CQ2: of:=IF([.N2]="";"";INDEX([.$A2:.$AMJ2];1;MATCH("slot_"&[.N2]&"_tracker_ref";[.$A$1:.$AMJ$1];0);1)) ->  | CR2: of:=IF([.O2]="";"";INDEX([.$A2:.$AMJ2];1;MATCH("slot_"&[.O2]&"_tracker_ref";[.$A$1:.$AMJ$1];0);1)) ->  | CS2: of:=IF([.P2]="";"";INDEX([.$A2:.$AMJ2];1;MATCH("slot_"&[.P2]&"_tracker_ref";[.$A$1:.$AMJ$1];0);1)) ->  | CT2: of:=IF([.Q2]="";"";INDEX([.$A2:.$AMJ2];1;MATCH("slot_"&[.Q2]&"_tracker_ref";[.$A$1:.$AMJ$1];0);1)) ->  | CU2: of:=IF([.R2]="";"";INDEX([.$A2:.$AMJ2];1;MATCH("slot_"&[.R2]&"_tracker_ref";[.$A$1:.$AMJ$1];0);1)) -> 
A3: 2020-06-27 | B3: of:=WEEKDAY([.A3]) -> 7 | C3: of:=COM.MICROSOFT.TEXTJOIN("; "; 1; [.CG3:.CU3]) -> bench SL | D3: 102 | X3: 1001 | Y3: of:=INDEX([$trackers.$B$1:$trackers.$B$1048576];MATCH([.X3];[$trackers.$A$1:$trackers.$A$1048576];0);1;1) -> back squat SL | Z3: 1002 | AA3: of:=INDEX([$trackers.$B$1:$trackers.$B$1048576];MATCH([.Z3];[$trackers.$A$1:$trackers.$A$1048576];0);1;1) -> bench SL | AC3: of:=INDEX([$trackers.$B$1:$trackers.$B$1048576];MATCH([.AB3];[$trackers.$A$1:$trackers.$A$1048576];0);1;1) ->  | AE3: of:=INDEX([$trackers.$B$1:$trackers.$B$1048576];MATCH([.AD3];[$trackers.$A$1:$trackers.$A$1048576];0);1;1) ->  | AG3: of:=INDEX([$trackers.$B$1:$trackers.$B$1048576];MATCH([.AF3];[$trackers.$A$1:$trackers.$A$1048576];0);1;1) ->  | AI3: of:=INDEX([$trackers.$B$1:$trackers.$B$1048576];MATCH([.AH3];[$trackers.$A$1:$trackers.$A$1048576];0);1;1) ->  | AK3: of:=INDEX([$trackers.$B$1:$trackers.$B$1048576];MATCH([.AJ3];[$trackers.$A$1:$trackers.$A$1048576];0);1;1) ->  | AM3: of:=INDEX([$trackers.$B$1:$trackers.$B$1048576];MATCH([.AL3];[$trackers.$A$1:$trackers.$A$1048576];0);1;1) ->  | AO3: of:=INDEX([$trackers.$B$1:$trackers.$B$1048576];MATCH([.AN3];[$trackers.$A$1:$trackers.$A$1048576];0);1;1) ->  | AQ3: of:=INDEX([$trackers.$B$1:$trackers.$B$1048576];MATCH([.AP3];[$trackers.$A$1:$trackers.$A$1048576];0);1;1) ->  | AS3: of:=INDEX([$trackers.$B$1:$trackers.$B$1048576];MATCH([.AR3];[$trackers.$A$1:$trackers.$A$1048576];0);1;1) ->  | AU3: of:=INDEX([$trackers.$B$1:$trackers.$B$1048576];MATCH([.AT3];[$trackers.$A$1:$trackers.$A$1048576];0);1;1) ->  | AW3: of:=INDEX([$trackers.$B$1:$trackers.$B$1048576];MATCH([.AV3];[$trackers.$A$1:$trackers.$A$1048576];0);1;1) ->  | AY3: of:=INDEX([$trackers.$B$1:$trackers.$B$1048576];MATCH([.AX3];[$trackers.$A$1:$trackers.$A$1048576];0);1;1) ->  | BA3: of:=INDEX([$trackers.$B$1:$trackers.$B$1048576];MATCH([.AZ3];[$trackers.$A$1:$trackers.$A$1048576];0);1;1) ->  | BC3: of:=INDEX([$trackers.$B$1:$trackers.$B$1048576];MATCH([.BB3];[$trackers.$A$1:$trackers.$A$1048576];0);1;1) ->  | BE3: of:=INDEX([$trackers.$B$1:$trackers.$B$1048576];MATCH([.BD3];[$trackers.$A$1:$trackers.$A$1048576];0);1;1) ->  | BG3: of:=INDEX([$trackers.$B$1:$trackers.$B$1048576];MATCH([.BF3];[$trackers.$A$1:$trackers.$A$1048576];0);1;1) ->  | BI3: of:=INDEX([$trackers.$B$1:$trackers.$B$1048576];MATCH([.BH3];[$trackers.$A$1:$trackers.$A$1048576];0);1;1) ->  | BK3: of:=INDEX([$trackers.$B$1:$trackers.$B$1048576];MATCH([.BJ3];[$trackers.$A$1:$trackers.$A$1048576];0);1;1) ->  | BM3: of:=INDEX([$trackers.$B$1:$trackers.$B$1048576];MATCH([.BL3];[$trackers.$A$1:$trackers.$A$1048576];0);1;1) ->  | BO3: of:=INDEX([$trackers.$B$1:$trackers.$B$1048576];MATCH([.BN3];[$trackers.$A$1:$trackers.$A$1048576];0);1;1) ->  | BQ3: of:=INDEX([$trackers.$B$1:$trackers.$B$1048576];MATCH([.BP3];[$trackers.$A$1:$trackers.$A$1048576];0);1;1) ->  | BS3: of:=INDEX([$trackers.$B$1:$trackers.$B$1048576];MATCH([.BR3];[$trackers.$A$1:$trackers.$A$1048576];0);1;1) ->  | BU3: of:=INDEX([$trackers.$B$1:$trackers.$B$1048576];MATCH([.BT3];[$trackers.$A$1:$trackers.$A$1048576];0);1;1) ->  | BW3: of:=INDEX([$trackers.$B$1:$trackers.$B$1048576];MATCH([.BV3];[$trackers.$A$1:$trackers.$A$1048576];0);1;1) ->  | BY3: of:=INDEX([$trackers.$B$1:$trackers.$B$1048576];MATCH([.BX3];[$trackers.$A$1:$trackers.$A$1048576];0);1;1) ->  | CA3: of:=INDEX([$trackers.$B$1:$trackers.$B$1048576];MATCH([.BZ3];[$trackers.$A$1:$trackers.$A$1048576];0);1;1) ->  | CC3: of:=INDEX([$trackers.$B$1:$trackers.$B$1048576];MATCH([.CB3];[$trackers.$A$1:$trackers.$A$1048576];0);1;1) ->  | CE3: of:=INDEX([$trackers.$B$1:$trackers.$B$1048576];MATCH([.CD3];[$trackers.$A$1:$trackers.$A$1048576];0);1;1) ->  | CG3: of:=IF([.D3]="";"";INDEX([.$A3:.$AMJ3];1;MATCH("slot_"&[.D3]&"_tracker_ref";[.$A$1:.$AMJ$1];0);1)) -> bench SL | CH3: of:=IF([.E3]="";"";INDEX([.$A3:.$AMJ3];1;MATCH("slot_"&[.E3]&"_tracker_ref";[.$A$1:.$AMJ$1];0);1)) ->  | CI3: of:=IF([.F3]="";"";INDEX([.$A3:.$AMJ3];1;MATCH("slot_"&[.F3]&"_tracker_ref";[.$A$1:.$AMJ$1];0);1)) ->  | CJ3: of:=IF([.G3]="";"";INDEX([.$A3:.$AMJ3];1;MATCH("slot_"&[.G3]&"_tracker_ref";[.$A$1:.$AMJ$1];0);1)) ->  | CK3: of:=IF([.H3]="";"";INDEX([.$A3:.$AMJ3];1;MATCH("slot_"&[.H3]&"_tracker_ref";[.$A$1:.$AMJ$1];0);1)) ->  | CL3: of:=IF([.I3]="";"";INDEX([.$A3:.$AMJ3];1;MATCH("slot_"&[.I3]&"_tracker_ref";[.$A$1:.$AMJ$1];0);1)) ->  | CM3: of:=IF([.J3]="";"";INDEX([.$A3:.$AMJ3];1;MATCH("slot_"&[.J3]&"_tracker_ref";[.$A$1:.$AMJ$1];0);1)) ->  | CN3: of:=IF([.K3]="";"";INDEX([.$A3:.$AMJ3];1;MATCH("slot_"&[.K3]&"_tracker_ref";[.$A$1:.$AMJ$1];0);1)) ->  | CO3: of:=IF([.L3]="";"";INDEX([.$A3:.$AMJ3];1;MATCH("slot_"&[.L3]&"_tracker_ref";[.$A$1:.$AMJ$1];0);1)) ->  | CP3: of:=IF([.M3]="";"";INDEX([.$A3:.$AMJ3];1;MATCH("slot_"&[.M3]&"_tracker_ref";[.$A$1:.$AMJ$1];0);1)) ->  | CQ3: of:=IF([.N3]="";"";INDEX([.$A3:.$AMJ3];1;MATCH("slot_"&[.N3]&"_tracker_ref";[.$A$1:.$AMJ$1];0);1)) ->  | CR3: of:=IF([.O3]="";"";INDEX([.$A3:.$AMJ3];1;MATCH("slot_"&[.O3]&"_tracker_ref";[.$A$1:.$AMJ$1];0);1)) ->  | CS3: of:=IF([.P3]="";"";INDEX([.$A3:.$AMJ3];1;MATCH("slot_"&[.P3]&"_tracker_ref";[.$A$1:.$AMJ$1];0);1)) ->  | CT3: of:=IF([.Q3]="";"";INDEX([.$A3:.$AMJ3];1;MATCH("slot_"&[.Q3]&"_tracker_ref";[.$A$1:.$AMJ$1];0);1)) ->  | CU3: of:=IF([.R3]="";"";INDEX([.$A3:.$AMJ3];1;MATCH("slot_"&[.R3]&"_tracker_ref";[.$A$1:.$AMJ$1];0);1)) -> 

Sheet: trackers
A1: tracker_id | B1: tracker_name | C1: movement_id | D1: movement_ref | E1: first_stage_id | F1: progression_ref
A2: 1001 | B2: back squat SL | C2: 1001 | D2: of:=INDEX([$movements.B$1:$movements.B$1048576];MATCH([.C2];[$movements.A$1:$movements.A$1048576];0);1;1) -> back squat (non-microloadable), WAS bar | E2: 1001 | F2: of:=INDEX([$progression_stages.C$1:$progression_stages.C$1048576];MATCH([.E2];[$progression_stages.A$1:$progression_stages.A$1048576];0);1;1) -> SL 3x5 non-DL
A3: 1002 | B3: bench SL | C3: 1002 | D3: of:=INDEX([$movements.B$1:$movements.B$1048576];MATCH([.C3];[$movements.A$1:$movements.A$1048576];0);1;1) -> bench (non-microloadable), WAS bar | E3: 1001 | F3: of:=INDEX([$progression_stages.C$1:$progression_stages.C$1048576];MATCH([.E3];[$progression_stages.A$1:$progression_stages.A$1048576];0);1;1) -> SL 3x5 non-DL

Sheet: progression_stages
A1: stage_id | B1: id_check | C1: progression_descr | D1: success_to_stage | E1: fail_to_stage | F1: instruction | G1: rest | H1: skip_wup | I1: roll_notes_forward | J1: more_is_better | K1: calc_e1rm | L1: max_attempt | M1: result_out_start | N1: result_out_end | O1: success | P1: smash | Q1: small_lp_x_incrm | R1: big_lp_x_incrm | S1: add_x_incrm_at_start | T1: propn_at_start | U1: deload_after_n_fail | V1: deload_by_factor | W1: propn_of_target
A2: 1001 | B2: of:=OR(ROW([.A2])=2;[.A2]>[.A1]) -> true | C2: SL 3x5 non-DL | F2: 3x5 | G2: 1.5/3/5m | J2: true | K2: true | O2: 15 | Q2: 1 | U2: 3 | V2: 0.9
A3: 1002 | B3: of:=OR(ROW([.A3])=2;[.A3]>[.A2]) -> true | C3: SL 3x5 DL | F3: 1x5 | J3: true | K3: true | O3: 5 | Q3: 2 | U3: 3 | V3: 0.9

Sheet: movements
A1: movement_id | B1: movement | C1: max_wup_jump | D1: min_wup | E1: min_increment | F1: min_wup_increment | G1: bar_adds | H1: loading_points
A2: 1001 | B2: back squat (non-microloadable), WAS bar | C2: 45 | D2: 41.5 | E2: 5 | F2: 5 | G2: 41.5 | H2: 2
A3: 1002 | B3: bench (non-microloadable), WAS bar | C3: 45 | D3: 41.5 | E3: 5 | F3: 5 | G3: 41.5 | H3: 2

Sheet: 'file:///home/fang2415/fitness/progmologwa-dev/progmologwa.fods/progmologwa-snaps/progmologwa.ods'#trackers
A1: tracker_id | B1: tracker_name
A2: 1001 | B2: back squat SL
A3: 1002 | B3: bench SL
A4: 1003 | B4: Pendlay SL
A5: 1004 | B5: OHP SL
A6: 1005 | B6: DL SL
A7: 1006 | B7: BW squat static
A8: 1007 | B8: BW DL static
A9: 1008 | B9: goblet squat SL
A10: 1009 | B10: inv row trial
A11: 1010 | B11: Static broomstick OHP
A12: 1011 | B12: Pendlay broomsticks
A13: 1012 | B13: Static broomstick DL
A14: 1013 | B14: Plate OHP from zero
A15: 1014 | B15: 1DB FS 3x5
A16: 1015 | B16: plate Pendlay 3x5
A17: 1016 | B17: 1DB DL 1x5
A18: 1017 | B18: DB OHP 3x5
A19: 1018 | B19: DB DL 3x5
A20: 1019 | B20: DB Pendlay SL
A21: 1020 | B21: back squat IP wrong smash
A22: 1021 | B22: bench IP wrong smash
A23: 1022 | B23: Pendlay IP wrong smash
A24: 1023 | B24: OHP IP wrong smash
A25: 1024 | B25: DL IP wrong smash
A26: 1025 | B26: back squat IP
A27: 1026 | B27: bench IP
A28: 1027 | B28: Pendlay IP
A29: 1028 | B29: OHP IP
A30: 1029 | B30: DL IP
A31: 1030 | B31: OHP 5lb incr IP wrong smash
A32: 1031 | B32: OHP 5lb incr SL
A33: 1032 | B33: left plank positions
A34: 1033 | B34: front plank positions
A35: 1034 | B35: right plank positions
A36: 1035 | B36: T1 back squat
A37: 1036 | B37: T1 OHP
A38: 1037 | B38: T1 bench
A39: 1038 | B39: T1 DL
A40: 1039 | B40: T2 back squat
A41: 1040 | B41: T2 OHP
A42: 1041 | B42: T2 bench
A43: 1042 | B43: T2 DL
A44: 1043 | B44: T3 lat pull
A45: 1044 | B45: T3 DB row
A46: 1045 | B46: elliptical warmup
A47: 1046 | B47: front plank positions, easier from 2021-01-15
A48: 1047 | B48: T1 back squat w wrong stages
A49: 1048 | B49: T2 bench
A50: 1049 | B50: elliptical short hiit
A51: 1050 | B51: front plank positions, easier from 2021-01-15
A52: 1051 | B52: front plank positions, in sync from 2021-01-21
A53: 1052 | B53: left plank positions
A54: 1053 | B54: right plank positions
A55: 1054 | B55: left plank positions from eyes
A56: 1055 | B56: right plank positions from eyes
A57: 1056 | B57: upper wup
A58: 1057 | B58: lower wup
A59: 1058 | B59: ab roller experiments
A60: 1059 | B60: left plank experiments
A61: 1060 | B61: right plank experiments
A62: 1061 | B62: elliptical warmup
A63: 1062 | B63: left plank @forehead, RIR as v
A64: 1063 | B64: PTLL front plank @nose, RIR as v
A65: 1064 | B65: right plank @forehead, RIR as v
A66: 1065 | B66: T1 OHP switch to kneeling
A67: 1066 | B67: T2 OHP switch to kneeling
A68: 1067 | B68: PTLL front plank @shoulders, RIR as v
A69: 1068 | B69: bird dog rehab
A70: 1069 | B70: side plank rehab
A71: 1070 | B71: curl-up rehab
A72: 1071 | B72: bridge rehab
A73: 1072 | B73: McGill big 3 rehab
A74: 1073 | B74: neck flexor slow climb
A75: 1074 | B75: cat-camel mobilization
A76: 1075 | B76: bridge rehab
A77: 1076 | B77: T3 Egyptian cable lateral raise
A78: 1077 | B78: pushup experiments
A79: 1078 | B79: elliptical short hiit
A80: 1079 | B80: daily notes
A81: 1080 | B81: vacuum pyramids trial
A82: 1081 | B82: vacuum pyramids
A83: 1082 | B83: pf pyramids trial
A84: 1083 | B84: pf pyramids
A85: 1084 | B85: twist-kneel trial
A86: 1085 | B86: vacuum leg-lift trials
A87: 1086 | B87: 90-90 trial form climb
A88: 1087 | B88: 50% vacuum pyramid slow climb
A89: 1088 | B89: T1 back squat
A90: 1089 | B90: pf time pyramids
A91: 1090 | B91: heavy jumprope warmup
A92: 1091 | B92: heavy jumprope HIIT
A93: 1092 | B93: quadruped knee hold pyramid
A94: 1093 | B94: T1 back squat
A95: 1094 | B95: T2 back squat
A96: 1095 | B96: T2 DL
A97: 1096 | B97: T3 pushups
A98: 1097 | B98: T3 walking lunges
A99: 1098 | B99: T3 pushups
A100: 1099 | B100: T3 ab wheel rollouts
A101: 1100 | B101: T3 pushups
A102: 1101 | B102: T3 walking lunges
A103: 1102 | B103: T3 DB walking lunges
A104: 1103 | B104: T1 back squat
A105: 1104 | B105: T1 bench
A106: 1105 | B106: T1 DL
A107: 1106 | B107: T1 OHP (kneeling)
A108: 1107 | B108: T2 back squat
A109: 1108 | B109: T2 bench
A110: 1109 | B110: T2 DL
A111: 1110 | B111: T2 OHP (kneeling)
A112: 1111 | B112: daily notes
A113: 1112 | B113: bw Taylor calibration
A114: 1113 | B114: 90-90 mobilization
A115: 1114 | B115: cat-camel mobilization
A116: 1115 | B116: T3 leg extensions
A117: 1116 | B117: T3 neck curls
A118: 1117 | B118: T3 neck extensions
A119: 1118 | B119: bw Taylor calibration
A120: 1119 | B120: bw Taylor calibration
A121: 1120 | B121: T3 neck curls
A122: 1121 | B122: Block walk rehab
A123: 1122 | B123: rehab squat
A124: 1123 | B124: rehab DL
A125: 1124 | B125: rehab bench
A126: 1125 | B126: rehab DL
A127: 1126 | B127: T3 neck curls
A128: 1127 | B128: T3 neck extensions
A129: 1128 | B129: T2 DL
A130: 1129 | B130: T3 step-ups
A131: 1130 | B131: T1 back squat
A132: 1131 | B132: T1 OHP (kneeling)
A133: 1132 | B133: T1 bench
A134: 1133 | B134: T1 DL
A135: 1134 | B135: windsurfing session
A136: 1135 | B136: bike 414 to campus
A137: 1136 | B137: bike campus to 414
A138: 1137 | B138: T2 back squat
A139: 1138 | B139: T2 bench
A140: 1139 | B140: T2 DL
A141: 1140 | B141: T2 OHP (kneeling)
A142: 1141 | B142: T3 ab wheel rollouts
A143: 1142 | B143: T3 neck curls
A144: 1143 | B144: T3 neck extensions
A145: 1144 | B145: T3 neck side curls
A146: 1145 | B146: T3 ab wheel rollouts
A147: 1146 | B147: knee-high heavy jumprope HIIT
A148: 1147 | B148: cat-camel/90-90 mobilizations
A149: 1148 | B149: T2 bench
A150: 1149 | B150: T2 OHP (kneeling)
A151: 1150 | B151: T3 lat pull
A152: 1151 | B152: T3 DB row
A153: 1152 | B153: T3 leg extensions
A154: 1153 | B154: T3 ab wheel rollouts
A155: 1154 | B155: T1 back squat
A156: 1155 | B156: T1 OHP (kneeling)
A157: 1156 | B157: T1 bench
A158: 1157 | B158: T1 DL
A159: 1158 | B159: T2 back squat
A160: 1159 | B160: T2 bench
A161: 1160 | B161: T2 DL
A162: 1161 | B162: T2 OHP (kneeling)
A163: 1162 | B163: T1 OHP (kneeling, microloaded)
A164: 1163 | B164: T2 OHP (kneeling, microloaded)
A165: 1164 | B165: USD
A166: 1165 | B166: Stair-box-jump warmup experiments
A167: 1166 | B167: T2 back squat
A168: 1167 | B168: T2 DL
A169: 1168 | B169: Water retrospective
A170: 1169 | B170: Water by drink
A171: 1170 | B171: T1 back squat
A172: 1171 | B172: T1 bench
A173: 1172 | B173: T1 DL
A174: 1173 | B174: T1 OHP (kneeling, microloaded)
A175: 1174 | B175: BBB squat
A176: 1175 | B176: BBB bench
A177: 1176 | B177: BBB deadlift
A178: 1177 | B178: BBB OHP
A179: 1178 | B179: Scale calibration
A180: 1179 | B180: Asst lat pull
A181: 1180 | B181: Asst leg extensions
A182: 1181 | B182: Asst ab wheel rollouts
A183: 1182 | B183: Asst DB row
A184: 1183 | B184: Asst dips
A185: 1184 | B185: Asst DB front raises
A186: 1185 | B186: Snow shoveling session
A187: 1186 | B187: Asst dips
A188: 1187 | B188: Snowboarding
A189: 1188 | B189: Stair-box-jump warmup experiments
A190: 1189 | B190: Neck iso rotations
A191: 1190 | B191: Asst DB skullcrushers
A192: 1191 | B192: Deload squat
A193: 1192 | B193: Deload bench
A194: 1193 | B194: Deload deadlift
A195: 1194 | B195: Deload OHP
A196: 1195 | B196: Deload asst lat pull
A197: 1196 | B197: Deload asst leg extensions
A198: 1197 | B198: Deload asst ab wheel rollouts
A199: 1198 | B199: Deload asst DB row
A200: 1199 | B200: Deload asst DB skullcrushers
A201: 1200 | B201: Deload asst banded dips
A202: 1201 | B202: FSL squat
A203: 1202 | B203: FSL bench
A204: 1203 | B204: FSL deadlift
A205: 1204 | B205: FSL OHP
A206: 1205 | B206: 85% TM test squat
A207: 1206 | B207: 85% TM test bench
A208: 1207 | B208: 85% TM test deadlift
A209: 1208 | B209: 85% TM test OHP
A210: 1209 | B210: Asst reverse hypers
A211: 1210 | B211: Pull-up max test
A212: 1211 | B212: Lev/SSL squat
A213: 1212 | B213: Lev/SSL bench
A214: 1213 | B214: Lev/SSL deadlift
A215: 1214 | B215: Lev/SSL OHP
A216: 1215 | B216: Fighter pull-ups from 6
A217: 1216 | B217: Fighter Jr. pull-ups from 5
A218: 1217 | B218: 1600m locomotion
A219: 1218 | B219: Asst cable-strap flys
A220: 1219 | B220: Asst DB incline press
A221: 1220 | B221: Lev anchor squat
A222: 1221 | B222: Lev anchor bench
A223: 1222 | B223: Lev anchor deadlift
A224: 1223 | B224: Lev anchor OHP
A225: 1224 | B225: Fighter Jr. BW dips from 5
A226: 1225 | B226: Asst Pallof press
A227: 1226 | B227: Wup: CCs, 90-90s, stair jumps
A228: 1227 | B228: Fighter Jr. BW dips from 2
A229: 1228 | B229: BW dips max test
A230: 1229 | B230: DL weakpoint test
A231: 1230 | B231: Squat 5RM test
A232: 1231 | B232: Fighter Jr. BW dips from 9
A233: 1232 | B233: DL 5RM test
A234: 1233 | B234: Bench 15RM test
A235: 1234 | B235: DB fly 15RM test
A236: 1235 | B236: OHP 15RM test
A237: 1236 | B237: Bradford press 15RM test
A238: 1237 | B238: OHP 5RM test
A239: 1238 | B239: Squat 5s Pro BBB@FSL
A240: 1239 | B240: Bench 10s Pro BBB@FSL
A241: 1240 | B241: DL 5s Pro BBB@FSL
A242: 1241 | B242: OHP 10s Pro BBB@FSL
A243: 1242 | B243: DB flys 10s Pro BBB@FSL
A244: 1243 | B244: Bradford 10s Pro BBB@FSL
A245: 1244 | B245: DB Bradford 10s Pro BBB@FSL
A246: 1245 | B246: Asst reverse crunches (progression experiments)
A247: 1246 | B247: Asst pushups plus
A248: 1247 | B248: Asst reverse crunches
A249: 1248 | B249: Chin/tongue press pyramid
A250: 1249 | B250: Squat 5s Pro BBB@50%
A251: 1250 | B251: Asst BW dips from 8s
A252: 1251 | B252: Asst pull-ups from 10s
A253: 1252 | B253: Asst calf raises
A254: 1253 | B254: bike 414-campus round trip
A255: 1254 | B255: Bench 10s Pro deload
A256: 1255 | B256: OHP 10s Pro deload
A257: 1256 | B257: DB flys 10s Pro deload
A258: 1257 | B258: DB Bradford 10s Pro deload
A259: 1258 | B259: Deload asst BW dips at 8
A260: 1259 | B260: Deload asst pull-ups at 10
A261: 1260 | B261: Deload asst calf raises
A262: 1261 | B262: Deload asst pushups plus at third stair
A263: 1262 | B263: Deload asst DB row
A264: 1263 | B264: Deload asst Pallof press
A265: 1264 | B265: Bench 15/12/10+ RP@FSL
A266: 1265 | B266: OHP 15/12/10+ RP@FSL
A267: 1266 | B267: DB flys 15/12/10+ RP@FSL
A268: 1267 | B268: DB Bradford 15/12/10+ RP@FSL
A269: 1268 | B269: Asst Pendlay row
A270: 1269 | B270: Wup: CCs, 90-90s, stair jumps
A271: 1270 | B271: Asst BW dips from 5s, jump at +5
A272: 1271 | B272: Asst pull-ups from 9s
A273: 1272 | B273: Wup: CCs, 90-90s, stair jumps
A274: 1273 | B274: Asst pushups plus
A275: 1274 | B275: Asst BW dips from 6s, jump at +10
A276: 1275
A277: 1276
A278: 1277
A279: 1278
A280: 1279
A281: 1280
A282: 1281
A283: 1282
A284: 1283
A285: 1284
A286: 1285
A287: 1286
A288: 1287
A289: 1288
A290: 1289
A291: 1290
A292: 1291
A293: 1292
A294: 1293
A295: 1294
A296: 1295
A297: 1296
A298: 1297
A299: 1298
A300: 1299